scripts_paper/tuned_logs_g4/imagenet1k-inception-bn-symbol.log
{"i": ["cuda", "topi_nn_conv2d", [["TENSOR", [1, 1024, 7, 7], "float32"], ["TENSOR", [128, 1024, 1, 1], "float32"], [1, 1], [0, 0, 0, 0], [1, 1], "NCHW", "float32"], {}, ["conv2d", [1, 1024, 7, 7, "float32"], [128, 1024, 1, 1, "float32"], [1, 1], [0, 0, 0, 0], [1, 1], "NCHW", "float32"], {"i": 50906, "t": "direct", "c": null, "e": [["tile_f", "sp", [-1, 1, 16, 1]], ["tile_y", "sp", [-1, 1, 1, 1]], ["tile_x", "sp", [-1, 1, 7, 1]], ["tile_rc", "sp", [-1, 16]], ["tile_ry", "sp", [-1, 1]], ["tile_rx", "sp", [-1, 1]], ["auto_unroll_max_step", "ot", 1500], ["unroll_explicit", "ot", 0]]}], "r": [[3.378352378911273e-05], 0, 2.3696987628936768, 1581625429.7792146], "v": 0.1}
{"i": ["cuda", "topi_nn_conv2d", [["TENSOR", [1, 192, 7, 7], "float32"], ["TENSOR", [224, 192, 3, 3], "float32"], [1, 1], [1, 1, 1, 1], [1, 1], "NCHW", "float32"], {}, ["conv2d", [1, 192, 7, 7, "float32"], [224, 192, 3, 3, "float32"], [1, 1], [1, 1, 1, 1], [1, 1], "NCHW", "float32"], {"i": 209385, "t": "winograd", "c": null, "e": [["tile_b", "sp", [-1, 1, 1, 1]], ["tile_y", "sp", [-1, 1, 4, 8]], ["tile_x", "sp", [-1, 1, 8, 2]], ["tile_rc", "sp", [-1, 96]], ["auto_unroll_max_step", "ot", 128], ["unroll_explicit", "ot", 0]]}], "r": [[1.4147070899599368e-05], 0, 1.8513569831848145, 1581628572.2476685], "v": 0.1}
{"i": ["cuda", "topi_nn_conv2d", [["TENSOR", [1, 1024, 7, 7], "float32"], ["TENSOR", [192, 1024, 1, 1], "float32"], [1, 1], [0, 0, 0, 0], [1, 1], "NCHW", "float32"], {}, ["conv2d", [1, 1024, 7, 7, "float32"], [192, 1024, 1, 1, "float32"], [1, 1], [0, 0, 0, 0], [1, 1], "NCHW", "float32"], {"i": 317907, "t": "direct", "c": null, "e": [["tile_f", "sp", [-1, 3, 8, 1]], ["tile_y", "sp", [-1, 1, 7, 1]], ["tile_x", "sp", [-1, 1, 1, 1]], ["tile_rc", "sp", [-1, 16]], ["tile_ry", "sp", [-1, 1]], ["tile_rx", "sp", [-1, 1]], ["auto_unroll_max_step", "ot", 1500], ["unroll_explicit", "ot", 1]]}], "r": [[3.937710588622164e-05], 0, 1.5674848556518555, 1581630396.2324553], "v": 0.1}
{"i": ["cuda", "topi_nn_conv2d", [["TENSOR", [1, 1024, 7, 7], "float32"], ["TENSOR", [352, 1024, 1, 1], "float32"], [1, 1], [0, 0, 0, 0], [1, 1], "NCHW", "float32"], {}, ["conv2d", [1, 1024, 7, 7, "float32"], [352, 1024, 1, 1, "float32"], [1, 1], [0, 0, 0, 0], [1, 1], "NCHW", "float32"], {"i": 56255, "t": "direct", "c": null, "e": [["tile_f", "sp", [-1, 2, 8, 1]], ["tile_y", "sp", [-1, 1, 1, 7]], ["tile_x", "sp", [-1, 1, 7, 1]], ["tile_rc", "sp", [-1, 16]], ["tile_ry", "sp", [-1, 1]], ["tile_rx", "sp", [-1, 1]], ["auto_unroll_max_step", "ot", 512], ["unroll_explicit", "ot", 0]]}], "r": [[5.693697562707052e-05], 0, 1.5418882369995117, 1581632596.6564505], "v": 0.1}
{"i": ["cuda", "topi_nn_conv2d", [["TENSOR", [1, 1056, 7, 7], "float32"], ["TENSOR", [128, 1056, 1, 1], "float32"], [1, 1], [0, 0, 0, 0], [1, 1], "NCHW", "float32"], {}, ["conv2d", [1, 1056, 7, 7, "float32"], [128, 1056, 1, 1, "float32"], [1, 1], [0, 0, 0, 0], [1, 1], "NCHW", "float32"], {"i": 256609, "t": "direct", "c": null, "e": [["tile_f", "sp", [-1, 1, 4, 2]], ["tile_y", "sp", [-1, 1, 7, 1]], ["tile_x", "sp", [-1, 1, 7, 1]], ["tile_rc", "sp", [-1, 44]], ["tile_ry", "sp", [-1, 1]], ["tile_rx", "sp", [-1, 1]], ["auto_unroll_max_step", "ot", 1500], ["unroll_explicit", "ot", 1]]}], "r": [[3.0860690436133036e-05], 0, 1.6664645671844482, 1581635135.1878107], "v": 0.1}
{"i": ["cuda", "topi_nn_conv2d", [["TENSOR", [1, 224, 7, 7], "float32"], ["TENSOR", [224, 224, 3, 3], "float32"], [1, 1], [1, 1, 1, 1], [1, 1], "NCHW", "float32"], {}, ["conv2d", [1, 224, 7, 7, "float32"], [224, 224, 3, 3, "float32"], [1, 1], [1, 1, 1, 1], [1, 1], "NCHW", "float32"], {"i": 554299, "t": "winograd", "c": null, "e": [["tile_b", "sp", [-1, 1, 1, 1]], ["tile_y", "sp", [-1, 2, 4, 4]], ["tile_x", "sp", [-1, 1, 8, 2]], ["tile_rc", "sp", [-1, 112]], ["auto_unroll_max_step", "ot", 1500], ["unroll_explicit", "ot", 1]]}], "r": [[1.556581961706416e-05], 0, 1.8507087230682373, 1581636538.554623], "v": 0.1}
{"i": ["cuda", "topi_nn_conv2d", [["TENSOR", [1, 160, 7, 7], "float32"], ["TENSOR", [224, 160, 3, 3], "float32"], [1, 1], [1, 1, 1, 1], [1, 1], "NCHW", "float32"], {}, ["conv2d", [1, 160, 7, 7, "float32"], [224, 160, 3, 3, "float32"], [1, 1], [1, 1, 1, 1], [1, 1], "NCHW", "float32"], {"i": 85250, "t": "winograd", "c": null, "e": [["tile_b", "sp", [-1, 1, 1, 1]], ["tile_y", "sp", [-1, 1, 8, 4]], ["tile_x", "sp", [-1, 1, 4, 4]], ["tile_rc", "sp", [-1, 80]], ["auto_unroll_max_step", "ot", 0], ["unroll_explicit", "ot", 0]]}], "r": [[1.2677653603652572e-05], 0, 1.7578372955322266, 1581638197.8149452], "v": 0.1}
{"i": ["cuda", "topi_nn_conv2d", [["TENSOR", [1, 1056, 7, 7], "float32"], ["TENSOR", [160, 1056, 1, 1], "float32"], [1, 1], [0, 0, 0, 0], [1, 1], "NCHW", "float32"], {}, ["conv2d", [1, 1056, 7, 7, "float32"], [160, 1056, 1, 1, "float32"], [1, 1], [0, 0, 0, 0], [1, 1], "NCHW", "float32"], {"i": 392977, "t": "direct", "c": null, "e": [["tile_f", "sp", [-1, 1, 4, 2]], ["tile_y", "sp", [-1, 1, 7, 1]], ["tile_x", "sp", [-1, 1, 7, 1]], ["tile_rc", "sp", [-1, 44]], ["tile_ry", "sp", [-1, 1]], ["tile_rx", "sp", [-1, 1]], ["auto_unroll_max_step", "ot", 512], ["unroll_explicit", "ot", 1]]}], "r": [[3.1214837330552655e-05], 0, 1.636885404586792, 1581639995.679023], "v": 0.1}
{"i": ["cuda", "topi_nn_conv2d", [["TENSOR", [1, 192, 7, 7], "float32"], ["TENSOR", [320, 192, 3, 3], "float32"], [1, 1], [1, 1, 1, 1], [1, 1], "NCHW", "float32"], {}, ["conv2d", [1, 192, 7, 7, "float32"], [320, 192, 3, 3, "float32"], [1, 1], [1, 1, 1, 1], [1, 1], "NCHW", "float32"], {"i": 431601, "t": "winograd", "c": null, "e": [["tile_b", "sp", [-1, 1, 1, 1]], ["tile_y", "sp", [-1, 2, 8, 4]], ["tile_x", "sp", [-1, 1, 8, 2]], ["tile_rc", "sp", [-1, 24]], ["auto_unroll_max_step", "ot", 1500], ["unroll_explicit", "ot", 0]]}], "r": [[2.1944489045673968e-05], 0, 1.874619960784912, 1581643266.4472296], "v": 0.1}
{"i": ["cuda", "topi_nn_conv2d", [["TENSOR", [1, 1056, 7, 7], "float32"], ["TENSOR", [192, 1056, 1, 1], "float32"], [1, 1], [0, 0, 0, 0], [1, 1], "NCHW", "float32"], {}, ["conv2d", [1, 1056, 7, 7, "float32"], [192, 1056, 1, 1, "float32"], [1, 1], [0, 0, 0, 0], [1, 1], "NCHW", "float32"], {"i": 331331, "t": "direct", "c": null, "e": [["tile_f", "sp", [-1, 3, 4, 1]], ["tile_y", "sp", [-1, 1, 7, 1]], ["tile_x", "sp", [-1, 1, 7, 1]], ["tile_rc", "sp", [-1, 44]], ["tile_ry", "sp", [-1, 1]], ["tile_rx", "sp", [-1, 1]], ["auto_unroll_max_step", "ot", 1500], ["unroll_explicit", "ot", 0]]}], "r": [[3.567189098750744e-05], 0, 1.6229853630065918, 1581645894.7273834], "v": 0.1}
{"i": ["cuda", "topi_nn_conv2d", [["TENSOR", [1, 1056, 7, 7], "float32"], ["TENSOR", [352, 1056, 1, 1], "float32"], [1, 1], [0, 0, 0, 0], [1, 1], "NCHW", "float32"], {}, ["conv2d", [1, 1056, 7, 7, "float32"], [352, 1056, 1, 1, "float32"], [1, 1], [0, 0, 0, 0], [1, 1], "NCHW", "float32"], {"i": 120668, "t": "direct", "c": null, "e": [["tile_f", "sp", [-1, 1, 1, 11]], ["tile_y", "sp", [-1, 1, 7, 1]], ["tile_x", "sp", [-1, 1, 7, 1]], ["tile_rc", "sp", [-1, 22]], ["tile_ry", "sp", [-1, 1]], ["tile_rx", "sp", [-1, 1]], ["auto_unroll_max_step", "ot", 512], ["unroll_explicit", "ot", 0]]}], "r": [[5.022888633993743e-05], 0, 1.6931192874908447, 1581650110.6138184], "v": 0.1}
{"i": ["cuda", "topi_nn_conv2d", [["TENSOR", [1, 256, 14, 14], "float32"], ["TENSOR", [256, 256, 3, 3], "float32"], [2, 2], [1, 1, 1, 1], [1, 1], "NCHW", "float32"], {}, ["conv2d", [1, 256, 14, 14, "float32"], [256, 256, 3, 3, "float32"], [2, 2], [1, 1, 1, 1], [1, 1], "NCHW", "float32"], {"i": 558709, "t": "direct", "c": null, "e": [["tile_f", "sp", [-1, 4, 4, 1]], ["tile_y", "sp", [-1, 1, 7, 1]], ["tile_x", "sp", [-1, 1, 7, 1]], ["tile_rc", "sp", [-1, 16]], ["tile_ry", "sp", [-1, 3]], ["tile_rx", "sp", [-1, 3]], ["auto_unroll_max_step", "ot", 1500], ["unroll_explicit", "ot", 1]]}], "r": [[8.993237859007833e-05], 0, 2.443676233291626, 1581654183.2540631], "v": 0.1}
{"i": ["cuda", "topi_nn_conv2d", [["TENSOR", [1, 192, 14, 14], "float32"], ["TENSOR", [256, 192, 3, 3], "float32"], [1, 1], [1, 1, 1, 1], [1, 1], "NCHW", "float32"], {}, ["conv2d", [1, 192, 14, 14, "float32"], [256, 192, 3, 3, "float32"], [1, 1], [1, 1, 1, 1], [1, 1], "NCHW", "float32"], {"i": 127837, "t": "winograd", "c": null, "e": [["tile_b", "sp", [-1, 1, 1, 1]], ["tile_y", "sp", [-1, 1, 16, 8]], ["tile_x", "sp", [-1, 7, 7, 1]], ["tile_rc", "sp", [-1, 16]], ["auto_unroll_max_step", "ot", 1500], ["unroll_explicit", "ot", 1]]}], "r": [[3.9687434420015167e-05], 0, 2.2217934131622314, 1581657163.0071259], "v": 0.1}
{"i": ["cuda", "topi_nn_conv2d", [["TENSOR", [1, 608, 14, 14], "float32"], ["TENSOR", [192, 608, 1, 1], "float32"], [1, 1], [0, 0, 0, 0], [1, 1], "NCHW", "float32"], {}, ["conv2d", [1, 608, 14, 14, "float32"], [192, 608, 1, 1, "float32"], [1, 1], [0, 0, 0, 0], [1, 1], "NCHW", "float32"], {"i": 1419645, "t": "direct", "c": null, "e": [["tile_f", "sp", [-1, 4, 6, 1]], ["tile_y", "sp", [-1, 2, 1, 1]], ["tile_x", "sp", [-1, 1, 14, 1]], ["tile_rc", "sp", [-1, 16]], ["tile_ry", "sp", [-1, 1]], ["tile_rx", "sp", [-1, 1]], ["auto_unroll_max_step", "ot", 512], ["unroll_explicit", "ot", 0]]}], "r": [[3.843846398959519e-05], 0, 1.5732369422912598, 1581659980.9408472], "v": 0.1}
{"i": ["cuda", "topi_nn_conv2d", [["TENSOR", [1, 128, 14, 14], "float32"], ["TENSOR", [192, 128, 3, 3], "float32"], [2, 2], [1, 1, 1, 1], [1, 1], "NCHW", "float32"], {}, ["conv2d", [1, 128, 14, 14, "float32"], [192, 128, 3, 3, "float32"], [2, 2], [1, 1, 1, 1], [1, 1], "NCHW", "float32"], {"i": 1012761, "t": "direct", "c": null, "e": [["tile_f", "sp", [-1, 1, 12, 1]], ["tile_y", "sp", [-1, 1, 7, 1]], ["tile_x", "sp", [-1, 7, 1, 1]], ["tile_rc", "sp", [-1, 16]], ["tile_ry", "sp", [-1, 3]], ["tile_rx", "sp", [-1, 3]], ["auto_unroll_max_step", "ot", 1500], ["unroll_explicit", "ot", 1]]}], "r": [[3.480606544502618e-05], 0, 2.7983429431915283, 1581664182.3082519], "v": 0.1}
{"i": ["cuda", "topi_nn_conv2d", [["TENSOR", [1, 192, 14, 14], "float32"], ["TENSOR", [192, 192, 3, 3], "float32"], [1, 1], [1, 1, 1, 1], [1, 1], "NCHW", "float32"], {}, ["conv2d", [1, 192, 14, 14, "float32"], [192, 192, 3, 3, "float32"], [1, 1], [1, 1, 1, 1], [1, 1], "NCHW", "float32"], {"i": 260302, "t": "winograd", "c": null, "e": [["tile_b", "sp", [-1, 1, 1, 1]], ["tile_y", "sp", [-1, 1, 16, 6]], ["tile_x", "sp", [-1, 7, 7, 1]], ["tile_rc", "sp", [-1, 16]], ["auto_unroll_max_step", "ot", 1500], ["unroll_explicit", "ot", 1]]}], "r": [[2.775986798833819e-05], 0, 2.2718663215637207, 1581667007.33061], "v": 0.1}
{"i": ["cuda", "topi_nn_conv2d", [["TENSOR", [1, 160, 14, 14], "float32"], ["TENSOR", [192, 160, 3, 3], "float32"], [1, 1], [1, 1, 1, 1], [1, 1], "NCHW", "float32"], {}, ["conv2d", [1, 160, 14, 14, "float32"], [192, 160, 3, 3, "float32"], [1, 1], [1, 1, 1, 1], [1, 1], "NCHW", "float32"], {"i": 196462, "t": "winograd", "c": null, "e": [["tile_b", "sp", [-1, 1, 1, 1]], ["tile_y", "sp", [-1, 1, 16, 6]], ["tile_x", "sp", [-1, 7, 7, 1]], ["tile_rc", "sp", [-1, 80]], ["auto_unroll_max_step", "ot", 128], ["unroll_explicit", "ot", 1]]}], "r": [[2.3586430394775897e-05], 0, 1.9675848484039307, 1581671397.2958622], "v": 0.1}
{"i": ["cuda", "topi_nn_conv2d", [["TENSOR", [1, 608, 14, 14], "float32"], ["TENSOR", [160, 608, 1, 1], "float32"], [1, 1], [0, 0, 0, 0], [1, 1], "NCHW", "float32"], {}, ["conv2d", [1, 608, 14, 14, "float32"], [160, 608, 1, 1, "float32"], [1, 1], [0, 0, 0, 0], [1, 1], "NCHW", "float32"], {"i": 1639718, "t": "direct", "c": null, "e": [["tile_f", "sp", [-1, 4, 8, 1]], ["tile_y", "sp", [-1, 1, 14, 1]], ["tile_x", "sp", [-1, 1, 1, 2]], ["tile_rc", "sp", [-1, 16]], ["tile_ry", "sp", [-1, 1]], ["tile_rx", "sp", [-1, 1]], ["auto_unroll_max_step", "ot", 1500], ["unroll_explicit", "ot", 0]]}], "r": [[3.14084030027657e-05], 0, 1.4910621643066406, 1581675749.2965484], "v": 0.1}
{"i": ["cuda", "topi_nn_conv2d", [["TENSOR", [1, 128, 14, 14], "float32"], ["TENSOR", [192, 128, 3, 3], "float32"], [1, 1], [1, 1, 1, 1], [1, 1], "NCHW", "float32"], {}, ["conv2d", [1, 128, 14, 14, "float32"], [192, 128, 3, 3, "float32"], [1, 1], [1, 1, 1, 1], [1, 1], "NCHW", "float32"], {"i": 149422, "t": "winograd", "c": null, "e": [["tile_b", "sp", [-1, 1, 1, 1]], ["tile_y", "sp", [-1, 1, 16, 6]], ["tile_x", "sp", [-1, 7, 7, 1]], ["tile_rc", "sp", [-1, 16]], ["auto_unroll_max_step", "ot", 1500], ["unroll_explicit", "ot", 1]]}], "r": [[2.048505172711572e-05], 0, 2.252681016921997, 1581678793.7457068], "v": 0.1}
{"i": ["cuda", "topi_nn_conv2d", [["TENSOR", [1, 608, 14, 14], "float32"], ["TENSOR", [128, 608, 1, 1], "float32"], [1, 1], [0, 0, 0, 0], [1, 1], "NCHW", "float32"], {}, ["conv2d", [1, 608, 14, 14, "float32"], [128, 608, 1, 1, "float32"], [1, 1], [0, 0, 0, 0], [1, 1], "NCHW", "float32"], {"i": 1250422, "t": "direct", "c": null, "e": [["tile_f", "sp", [-1, 2, 8, 1]], ["tile_y", "sp", [-1, 1, 2, 1]], ["tile_x", "sp", [-1, 1, 7, 2]], ["tile_rc", "sp", [-1, 16]], ["tile_ry", "sp", [-1, 1]], ["tile_rx", "sp", [-1, 1]], ["auto_unroll_max_step", "ot", 0], ["unroll_explicit", "ot", 1]]}], "r": [[3.152338231795956e-05], 0, 1.5416340827941895, 1581681759.9664202], "v": 0.1}
{"i": ["cuda", "topi_nn_conv2d", [["TENSOR", [1, 608, 14, 14], "float32"], ["TENSOR", [96, 608, 1, 1], "float32"], [1, 1], [0, 0, 0, 0], [1, 1], "NCHW", "float32"], {}, ["conv2d", [1, 608, 14, 14, "float32"], [96, 608, 1, 1, "float32"], [1, 1], [0, 0, 0, 0], [1, 1], "NCHW", "float32"], {"i": 3699707, "t": "direct", "c": null, "e": [["tile_f", "sp", [-1, 1, 8, 3]], ["tile_y", "sp", [-1, 1, 2, 1]], ["tile_x", "sp", [-1, 1, 14, 1]], ["tile_rc", "sp", [-1, 16]], ["tile_ry", "sp", [-1, 1]], ["tile_rx", "sp", [-1, 1]], ["auto_unroll_max_step", "ot", 1500], ["unroll_explicit", "ot", 1]]}], "r": [[2.7931065493532222e-05], 0, 1.547670602798462, 1581684069.3797], "v": 0.1}
{"i": ["cuda", "topi_nn_conv2d", [["TENSOR", [1, 160, 14, 14], "float32"], ["TENSOR", [160, 160, 3, 3], "float32"], [1, 1], [1, 1, 1, 1], [1, 1], "NCHW", "float32"], {}, ["conv2d", [1, 160, 14, 14, "float32"], [160, 160, 3, 3, "float32"], [1, 1], [1, 1, 1, 1], [1, 1], "NCHW", "float32"], {"i": 153372, "t": "winograd", "c": null, "e": [["tile_b", "sp", [-1, 1, 1, 1]], ["tile_y", "sp", [-1, 1, 16, 5]], ["tile_x", "sp", [-1, 7, 7, 1]], ["tile_rc", "sp", [-1, 32]], ["auto_unroll_max_step", "ot", 1500], ["unroll_explicit", "ot", 1]]}], "r": [[2.2591421313506815e-05], 0, 2.8565568923950195, 1581688086.4203873], "v": 0.1}
{"i": ["cuda", "topi_nn_conv2d", [["TENSOR", [1, 128, 14, 14], "float32"], ["TENSOR", [160, 128, 3, 3], "float32"], [1, 1], [1, 1, 1, 1], [1, 1], "NCHW", "float32"], {}, ["conv2d", [1, 128, 14, 14, "float32"], [160, 128, 3, 3, "float32"], [1, 1], [1, 1, 1, 1], [1, 1], "NCHW", "float32"], {"i": 86172, "t": "winograd", "c": null, "e": [["tile_b", "sp", [-1, 1, 1, 1]], ["tile_y", "sp", [-1, 1, 16, 5]], ["tile_x", "sp", [-1, 7, 7, 1]], ["tile_rc", "sp", [-1, 64]], ["auto_unroll_max_step", "ot", 128], ["unroll_explicit", "ot", 1]]}], "r": [[2.0246263892434687e-05], 0, 1.9501214027404785, 1581690634.9103653], "v": 0.1}
{"i": ["cuda", "topi_nn_conv2d", [["TENSOR", [1, 576, 14, 14], "float32"], ["TENSOR", [160, 576, 1, 1], "float32"], [1, 1], [0, 0, 0, 0], [1, 1], "NCHW", "float32"], {}, ["conv2d", [1, 576, 14, 14, "float32"], [160, 576, 1, 1, "float32"], [1, 1], [0, 0, 0, 0], [1, 1], "NCHW", "float32"], {"i": 499110, "t": "direct", "c": null, "e": [["tile_f", "sp", [-1, 4, 8, 1]], ["tile_y", "sp", [-1, 1, 2, 1]], ["tile_x", "sp", [-1, 1, 7, 2]], ["tile_rc", "sp", [-1, 16]], ["tile_ry", "sp", [-1, 1]], ["tile_rx", "sp", [-1, 1]], ["auto_unroll_max_step", "ot", 0], ["unroll_explicit", "ot", 0]]}], "r": [[3.0763465995291654e-05], 0, 1.5844333171844482, 1581692718.2938163], "v": 0.1}
{"i": ["cuda", "topi_nn_conv2d", [["TENSOR", [1, 576, 14, 14], "float32"], ["TENSOR", [192, 576, 1, 1], "float32"], [1, 1], [0, 0, 0, 0], [1, 1], "NCHW", "float32"], {}, ["conv2d", [1, 576, 14, 14, "float32"], [192, 576, 1, 1, "float32"], [1, 1], [0, 0, 0, 0], [1, 1], "NCHW", "float32"], {"i": 2469093, "t": "direct", "c": null, "e": [["tile_f", "sp", [-1, 1, 8, 3]], ["tile_y", "sp", [-1, 1, 2, 1]], ["tile_x", "sp", [-1, 1, 7, 2]], ["tile_rc", "sp", [-1, 12]], ["tile_ry", "sp", [-1, 1]], ["tile_rx", "sp", [-1, 1]], ["auto_unroll_max_step", "ot", 512], ["unroll_explicit", "ot", 0]]}], "r": [[3.512141315519013e-05], 0, 1.5456726551055908, 1581695755.5991995], "v": 0.1}
{"i": ["cuda", "topi_nn_conv2d", [["TENSOR", [1, 576, 14, 14], "float32"], ["TENSOR", [128, 576, 1, 1], "float32"], [1, 1], [0, 0, 0, 0], [1, 1], "NCHW", "float32"], {}, ["conv2d", [1, 576, 14, 14, "float32"], [128, 576, 1, 1, "float32"], [1, 1], [0, 0, 0, 0], [1, 1], "NCHW", "float32"], {"i": 881814, "t": "direct", "c": null, "e": [["tile_f", "sp", [-1, 1, 8, 2]], ["tile_y", "sp", [-1, 1, 2, 1]], ["tile_x", "sp", [-1, 1, 7, 2]], ["tile_rc", "sp", [-1, 12]], ["tile_ry", "sp", [-1, 1]], ["tile_rx", "sp", [-1, 1]], ["auto_unroll_max_step", "ot", 512], ["unroll_explicit", "ot", 0]]}], "r": [[2.9289109050718407e-05], 0, 1.6588292121887207, 1581698816.7415993], "v": 0.1}
{"i": ["cuda", "topi_nn_conv2d", [["TENSOR", [1, 128, 14, 14], "float32"], ["TENSOR", [128, 128, 3, 3], "float32"], [1, 1], [1, 1, 1, 1], [1, 1], "NCHW", "float32"], {}, ["conv2d", [1, 128, 14, 14, "float32"], [128, 128, 3, 3, "float32"], [1, 1], [1, 1, 1, 1], [1, 1], "NCHW", "float32"], {"i": 55762, "t": "winograd", "c": null, "e": [["tile_b", "sp", [-1, 1, 1, 1]], ["tile_y", "sp", [-1, 1, 16, 4]], ["tile_x", "sp", [-1, 7, 7, 1]], ["tile_rc", "sp", [-1, 64]], ["auto_unroll_max_step", "ot", 1500], ["unroll_explicit", "ot", 1]]}], "r": [[1.7290282000147723e-05], 0, 1.8854942321777344, 1581701282.114643], "v": 0.1}
{"i": ["cuda", "topi_nn_conv2d", [["TENSOR", [1, 96, 14, 14], "float32"], ["TENSOR", [128, 96, 3, 3], "float32"], [1, 1], [1, 1, 1, 1], [1, 1], "NCHW", "float32"], {}, ["conv2d", [1, 96, 14, 14, "float32"], [128, 96, 3, 3, "float32"], [1, 1], [1, 1, 1, 1], [1, 1], "NCHW", "float32"], {"i": 85762, "t": "winograd", "c": null, "e": [["tile_b", "sp", [-1, 1, 1, 1]], ["tile_y", "sp", [-1, 1, 16, 4]], ["tile_x", "sp", [-1, 7, 7, 1]], ["tile_rc", "sp", [-1, 96]], ["auto_unroll_max_step", "ot", 1500], ["unroll_explicit", "ot", 1]]}], "r": [[1.48081212447712e-05], 0, 1.9436910152435303, 1581703057.9135895], "v": 0.1}
{"i": ["cuda", "topi_nn_conv2d", [["TENSOR", [1, 576, 14, 14], "float32"], ["TENSOR", [96, 576, 1, 1], "float32"], [1, 1], [0, 0, 0, 0], [1, 1], "NCHW", "float32"], {}, ["conv2d", [1, 576, 14, 14, "float32"], [96, 576, 1, 1, "float32"], [1, 1], [0, 0, 0, 0], [1, 1], "NCHW", "float32"], {"i": 1990142, "t": "direct", "c": null, "e": [["tile_f", "sp", [-1, 1, 16, 3]], ["tile_y", "sp", [-1, 1, 2, 1]], ["tile_x", "sp", [-1, 1, 7, 2]], ["tile_rc", "sp", [-1, 48]], ["tile_ry", "sp", [-1, 1]], ["tile_rx", "sp", [-1, 1]], ["auto_unroll_max_step", "ot", 512], ["unroll_explicit", "ot", 0]]}], "r": [[2.4832903095975232e-05], 0, 1.8801186084747314, 1581706456.5086744], "v": 0.1}
{"i": ["cuda", "topi_nn_conv2d", [["TENSOR", [1, 64, 14, 14], "float32"], ["TENSOR", [96, 64, 3, 3], "float32"], [1, 1], [1, 1, 1, 1], [1, 1], "NCHW", "float32"], {}, ["conv2d", [1, 64, 14, 14, "float32"], [96, 64, 3, 3, "float32"], [1, 1], [1, 1, 1, 1], [1, 1], "NCHW", "float32"], {"i": 77465, "t": "winograd", "c": null, "e": [["tile_b", "sp", [-1, 1, 1, 1]], ["tile_y", "sp", [-1, 2, 3, 8]], ["tile_x", "sp", [-1, 1, 49, 1]], ["tile_rc", "sp", [-1, 64]], ["auto_unroll_max_step", "ot", 128], ["unroll_explicit", "ot", 1]]}], "r": [[1.2576990279727833e-05], 0, 1.895033836364746, 1581709537.964348], "v": 0.1}
{"i": ["cuda", "topi_nn_conv2d", [["TENSOR", [1, 576, 14, 14], "float32"], ["TENSOR", [64, 576, 1, 1], "float32"], [1, 1], [0, 0, 0, 0], [1, 1], "NCHW", "float32"], {}, ["conv2d", [1, 576, 14, 14, "float32"], [64, 576, 1, 1, "float32"], [1, 1], [0, 0, 0, 0], [1, 1], "NCHW", "float32"], {"i": 2552615, "t": "direct", "c": null, "e": [["tile_f", "sp", [-1, 2, 16, 1]], ["tile_y", "sp", [-1, 1, 2, 1]], ["tile_x", "sp", [-1, 1, 7, 2]], ["tile_rc", "sp", [-1, 48]], ["tile_ry", "sp", [-1, 1]], ["tile_rx", "sp", [-1, 1]], ["auto_unroll_max_step", "ot", 1500], ["unroll_explicit", "ot", 1]]}], "r": [[2.015478645254976e-05], 0, 1.6221613883972168, 1581712299.9100332], "v": 0.1}
{"i": ["cuda", "topi_nn_conv2d", [["TENSOR", [1, 576, 14, 14], "float32"], ["TENSOR", [224, 576, 1, 1], "float32"], [1, 1], [0, 0, 0, 0], [1, 1], "NCHW", "float32"], {}, ["conv2d", [1, 576, 14, 14, "float32"], [224, 576, 1, 1, "float32"], [1, 1], [0, 0, 0, 0], [1, 1], "NCHW", "float32"], {"i": 5305241, "t": "direct", "c": null, "e": [["tile_f", "sp", [-1, 7, 4, 1]], ["tile_y", "sp", [-1, 1, 2, 1]], ["tile_x", "sp", [-1, 1, 14, 1]], ["tile_rc", "sp", [-1, 16]], ["tile_ry", "sp", [-1, 1]], ["tile_rx", "sp", [-1, 1]], ["auto_unroll_max_step", "ot", 512], ["unroll_explicit", "ot", 1]]}], "r": [[4.02574814690592e-05], 0, 1.683138132095337, 1581714505.9361672], "v": 0.1}
{"i": ["cuda", "topi_nn_conv2d", [["TENSOR", [1, 96, 27, 27], "float32"], ["TENSOR", [96, 96, 3, 3], "float32"], [2, 2], [1, 1, 1, 1], [1, 1], "NCHW", "float32"], {}, ["conv2d", [1, 96, 27, 27, "float32"], [96, 96, 3, 3, "float32"], [2, 2], [1, 1, 1, 1], [1, 1], "NCHW", "float32"], {"i": 16268715, "t": "direct", "c": null, "e": [["tile_f", "sp", [-1, 3, 8, 1]], ["tile_y", "sp", [-1, 1, 2, 1]], ["tile_x", "sp", [-1, 1, 7, 2]], ["tile_rc", "sp", [-1, 16]], ["tile_ry", "sp", [-1, 3]], ["tile_rx", "sp", [-1, 3]], ["auto_unroll_max_step", "ot", 1500], ["unroll_explicit", "ot", 1]]}], "r": [[3.464494347826087e-05], 0, 2.693740129470825, 1581719681.8166025], "v": 0.1}
{"i": ["cuda", "topi_nn_conv2d", [["TENSOR", [1, 320, 27, 27], "float32"], ["TENSOR", [64, 320, 1, 1], "float32"], [1, 1], [0, 0, 0, 0], [1, 1], "NCHW", "float32"], {}, ["conv2d", [1, 320, 27, 27, "float32"], [64, 320, 1, 1, "float32"], [1, 1], [0, 0, 0, 0], [1, 1], "NCHW", "float32"], {"i": 1259204, "t": "direct", "c": null, "e": [["tile_f", "sp", [-1, 2, 8, 2]], ["tile_y", "sp", [-1, 1, 1, 3]], ["tile_x", "sp", [-1, 1, 27, 1]], ["tile_rc", "sp", [-1, 40]], ["tile_ry", "sp", [-1, 1]], ["tile_rx", "sp", [-1, 1]], ["auto_unroll_max_step", "ot", 1500], ["unroll_explicit", "ot", 0]]}], "r": [[2.53400891025641e-05], 0, 1.7744503021240234, 1581723052.9430838], "v": 0.1}
{"i": ["cuda", "topi_nn_conv2d", [["TENSOR", [1, 128, 27, 27], "float32"], ["TENSOR", [160, 128, 3, 3], "float32"], [2, 2], [1, 1, 1, 1], [1, 1], "NCHW", "float32"], {}, ["conv2d", [1, 128, 27, 27, "float32"], [160, 128, 3, 3, "float32"], [2, 2], [1, 1, 1, 1], [1, 1], "NCHW", "float32"], {"i": 3412240, "t": "direct", "c": null, "e": [["tile_f", "sp", [-1, 2, 16, 1]], ["tile_y", "sp", [-1, 2, 1, 1]], ["tile_x", "sp", [-1, 1, 14, 1]], ["tile_rc", "sp", [-1, 8]], ["tile_ry", "sp", [-1, 3]], ["tile_rx", "sp", [-1, 3]], ["auto_unroll_max_step", "ot", 512], ["unroll_explicit", "ot", 0]]}], "r": [[5.609235745869211e-05], 0, 1.708946943283081, 1581725876.876222], "v": 0.1}
{"i": ["cuda", "topi_nn_conv2d", [["TENSOR", [1, 320, 27, 27], "float32"], ["TENSOR", [128, 320, 1, 1], "float32"], [1, 1], [0, 0, 0, 0], [1, 1], "NCHW", "float32"], {}, ["conv2d", [1, 320, 27, 27, "float32"], [128, 320, 1, 1, "float32"], [1, 1], [0, 0, 0, 0], [1, 1], "NCHW", "float32"], {"i": 1702818, "t": "direct", "c": null, "e": [["tile_f", "sp", [-1, 8, 4, 1]], ["tile_y", "sp", [-1, 1, 1, 3]], ["tile_x", "sp", [-1, 1, 27, 1]], ["tile_rc", "sp", [-1, 20]], ["tile_ry", "sp", [-1, 1]], ["tile_rx", "sp", [-1, 1]], ["auto_unroll_max_step", "ot", 1500], ["unroll_explicit", "ot", 0]]}], "r": [[3.337880547792063e-05], 0, 1.6675159931182861, 1581729367.0113277], "v": 0.1}
{"i": ["cuda", "topi_nn_conv2d", [["TENSOR", [1, 256, 27, 27], "float32"], ["TENSOR", [64, 256, 1, 1], "float32"], [1, 1], [0, 0, 0, 0], [1, 1], "NCHW", "float32"], {}, ["conv2d", [1, 256, 27, 27, "float32"], [64, 256, 1, 1, "float32"], [1, 1], [0, 0, 0, 0], [1, 1], "NCHW", "float32"], {"i": 486380, "t": "direct", "c": null, "e": [["tile_f", "sp", [-1, 4, 8, 1]], ["tile_y", "sp", [-1, 1, 1, 3]], ["tile_x", "sp", [-1, 1, 27, 1]], ["tile_rc", "sp", [-1, 32]], ["tile_ry", "sp", [-1, 1]], ["tile_rx", "sp", [-1, 1]], ["auto_unroll_max_step", "ot", 512], ["unroll_explicit", "ot", 0]]}], "r": [[2.116811296580348e-05], 0, 1.9280648231506348, 1581732127.4388738], "v": 0.1}
{"i": ["cuda", "topi_nn_conv2d", [["TENSOR", [1, 192, 27, 27], "float32"], ["TENSOR", [32, 192, 1, 1], "float32"], [1, 1], [0, 0, 0, 0], [1, 1], "NCHW", "float32"], {}, ["conv2d", [1, 192, 27, 27, "float32"], [32, 192, 1, 1, "float32"], [1, 1], [0, 0, 0, 0], [1, 1], "NCHW", "float32"], {"i": 794152, "t": "direct", "c": null, "e": [["tile_f", "sp", [-1, 2, 8, 1]], ["tile_y", "sp", [-1, 3, 1, 1]], ["tile_x", "sp", [-1, 1, 27, 1]], ["tile_rc", "sp", [-1, 16]], ["tile_ry", "sp", [-1, 1]], ["tile_rx", "sp", [-1, 1]], ["auto_unroll_max_step", "ot", 1500], ["unroll_explicit", "ot", 0]]}], "r": [[1.099679831015332e-05], 0, 1.9301600456237793, 1581734534.7192578], "v": 0.1}
{"i": ["cuda", "topi_nn_conv2d", [["TENSOR", [1, 96, 27, 27], "float32"], ["TENSOR", [96, 96, 3, 3], "float32"], [1, 1], [1, 1, 1, 1], [1, 1], "NCHW", "float32"], {}, ["conv2d", [1, 96, 27, 27, "float32"], [96, 96, 3, 3, "float32"], [1, 1], [1, 1, 1, 1], [1, 1], "NCHW", "float32"], {"i": 723467, "t": "winograd", "c": null, "e": [["tile_b", "sp", [-1, 1, 1, 1]], ["tile_y", "sp", [-1, 1, 8, 6]], ["tile_x", "sp", [-1, 7, 28, 1]], ["tile_rc", "sp", [-1, 24]], ["auto_unroll_max_step", "ot", 1500], ["unroll_explicit", "ot", 0]]}], "r": [[2.4672530874430167e-05], 0, 2.0868337154388428, 1581738592.750088], "v": 0.1}
{"i": ["cuda", "topi_nn_conv2d", [["TENSOR", [1, 64, 27, 27], "float32"], ["TENSOR", [96, 64, 3, 3], "float32"], [1, 1], [1, 1, 1, 1], [1, 1], "NCHW", "float32"], {}, ["conv2d", [1, 64, 27, 27, "float32"], [96, 64, 3, 3, "float32"], [1, 1], [1, 1, 1, 1], [1, 1], "NCHW", "float32"], {"i": 280886, "t": "winograd", "c": null, "e": [["tile_b", "sp", [-1, 1, 1, 1]], ["tile_y", "sp", [-1, 1, 2, 24]], ["tile_x", "sp", [-1, 1, 98, 2]], ["tile_rc", "sp", [-1, 32]], ["auto_unroll_max_step", "ot", 128], ["unroll_explicit", "ot", 0]]}], "r": [[1.9732629576918102e-05], 0, 1.698559045791626, 1581742713.1480541], "v": 0.1}
{"i": ["cuda", "topi_nn_conv2d", [["TENSOR", [1, 64, 27, 27], "float32"], ["TENSOR", [64, 64, 3, 3], "float32"], [1, 1], [1, 1, 1, 1], [1, 1], "NCHW", "float32"], {}, ["conv2d", [1, 64, 27, 27, "float32"], [64, 64, 3, 3, "float32"], [1, 1], [1, 1, 1, 1], [1, 1], "NCHW", "float32"], {"i": 338480, "t": "winograd", "c": null, "e": [["tile_b", "sp", [-1, 1, 1, 1]], ["tile_y", "sp", [-1, 2, 8, 2]], ["tile_x", "sp", [-1, 7, 28, 1]], ["tile_rc", "sp", [-1, 32]], ["auto_unroll_max_step", "ot", 1500], ["unroll_explicit", "ot", 1]]}], "r": [[1.589817083418039e-05], 0, 2.439114570617676, 1581746133.261696], "v": 0.1}
{"i": ["cuda", "topi_nn_conv2d", [["TENSOR", [1, 192, 27, 27], "float32"], ["TENSOR", [64, 192, 1, 1], "float32"], [1, 1], [0, 0, 0, 0], [1, 1], "NCHW", "float32"], {}, ["conv2d", [1, 192, 27, 27, "float32"], [64, 192, 1, 1, "float32"], [1, 1], [0, 0, 0, 0], [1, 1], "NCHW", "float32"], {"i": 1191979, "t": "direct", "c": null, "e": [["tile_f", "sp", [-1, 2, 8, 1]], ["tile_y", "sp", [-1, 1, 1, 3]], ["tile_x", "sp", [-1, 1, 27, 1]], ["tile_rc", "sp", [-1, 16]], ["tile_ry", "sp", [-1, 1]], ["tile_rx", "sp", [-1, 1]], ["auto_unroll_max_step", "ot", 1500], ["unroll_explicit", "ot", 0]]}], "r": [[1.5053882104724762e-05], 0, 1.7422945499420166, 1581748259.9299722], "v": 0.1}
{"i": ["cuda", "topi_nn_conv2d", [["TENSOR", [1, 64, 55, 55], "float32"], ["TENSOR", [192, 64, 3, 3], "float32"], [1, 1], [1, 1, 1, 1], [1, 1], "NCHW", "float32"], {}, ["conv2d", [1, 64, 55, 55, "float32"], [192, 64, 3, 3, "float32"], [1, 1], [1, 1, 1, 1], [1, 1], "NCHW", "float32"], {"i": 4611852, "t": "winograd", "c": null, "e": [["tile_b", "sp", [-1, 1, 1, 1]], ["tile_y", "sp", [-1, 4, 2, 8]], ["tile_x", "sp", [-1, 2, 56, 1]], ["tile_rc", "sp", [-1, 16]], ["auto_unroll_max_step", "ot", 1500], ["unroll_explicit", "ot", 1]]}], "r": [[0.000145856503875969], 0, 2.580749988555908, 1581755155.9815824], "v": 0.1}
{"i": ["cuda", "topi_nn_conv2d", [["TENSOR", [1, 64, 55, 55], "float32"], ["TENSOR", [64, 64, 1, 1], "float32"], [1, 1], [0, 0, 0, 0], [1, 1], "NCHW", "float32"], {}, ["conv2d", [1, 64, 55, 55, "float32"], [64, 64, 1, 1, "float32"], [1, 1], [0, 0, 0, 0], [1, 1], "NCHW", "float32"], {"i": 848088, "t": "direct", "c": null, "e": [["tile_f", "sp", [-1, 4, 16, 1]], ["tile_y", "sp", [-1, 1, 1, 1]], ["tile_x", "sp", [-1, 5, 11, 1]], ["tile_rc", "sp", [-1, 16]], ["tile_ry", "sp", [-1, 1]], ["tile_rx", "sp", [-1, 1]], ["auto_unroll_max_step", "ot", 1500], ["unroll_explicit", "ot", 1]]}], "r": [[1.433748266977486e-05], 0, 2.665633201599121, 1581760878.5338476], "v": 0.1}
{"i": ["cuda", "topi_nn_conv2d", [["TENSOR", [1, 3, 224, 224], "float32"], ["TENSOR", [64, 3, 7, 7], "float32"], [2, 2], [3, 3, 3, 3], [1, 1], "NCHW", "float32"], {}, ["conv2d", [1, 3, 224, 224, "float32"], [64, 3, 7, 7, "float32"], [2, 2], [3, 3, 3, 3], [1, 1], "NCHW", "float32"], {"i": 36664213, "t": "direct", "c": null, "e": [["tile_f", "sp", [-1, 1, 8, 4]], ["tile_y", "sp", [-1, 1, 2, 7]], ["tile_x", "sp", [-1, 1, 16, 1]], ["tile_rc", "sp", [-1, 1]], ["tile_ry", "sp", [-1, 7]], ["tile_rx", "sp", [-1, 7]], ["auto_unroll_max_step", "ot", 1500], ["unroll_explicit", "ot", 0]]}], "r": [[5.86613580952381e-05], 0, 1.6443324089050293, 1581763916.9815388], "v": 0.1}
