scripts_paper/tuned_logs_g4/imagenet1k-inception-bn-quantized-5batches-naive-symbol.log
{"i": ["cuda", "topi_nn_conv2d", [["TENSOR", [1, 1024, 7, 7], "int8"], ["TENSOR", [128, 1024, 1, 1], "int8"], [1, 1], [0, 0], [1, 1], "NCHW", "int32"], {}, ["conv2d", [1, 1024, 7, 7, "int8"], [128, 1024, 1, 1, "int8"], [1, 1], [0, 0], [1, 1], "NCHW", "int32"], {"i": 1102534, "t": "int8", "c": null, "e": [["tile_n", "sp", [-1, 1, 1, 1]], ["tile_f", "sp", [-1, 1, 2, 1]], ["tile_y", "sp", [-1, 1, 1, 1]], ["tile_x", "sp", [-1, 1, 7, 1]], ["fuse_yx", "ot", 0], ["tile_rc", "sp", [-1, 8]], ["tile_ry", "sp", [-1, 1]], ["tile_rx", "sp", [-1, 1]], ["reorder_inner", "re", [1, 0, 2]], ["AA_double_buffer", "ot", 1], ["WW_double_buffer", "ot", 1], ["auto_unroll_max_step", "ot", 1500]]}], "r": [[8.811574877280386e-06], 0, 2.7568438053131104, 1581534580.0103867], "v": 0.1}
{"i": ["cuda", "topi_nn_conv2d", [["TENSOR", [1, 192, 9, 9], "int8"], ["TENSOR", [224, 192, 3, 3], "int8"], [1, 1], [0, 0], [1, 1], "NCHW", "int32"], {}, ["conv2d", [1, 192, 9, 9, "int8"], [224, 192, 3, 3, "int8"], [1, 1], [0, 0], [1, 1], "NCHW", "int32"], {"i": 319099, "t": "winograd", "c": null, "e": [["tile_b", "sp", [-1, 1, 1, 1]], ["tile_y", "sp", [-1, 2, 4, 4]], ["tile_x", "sp", [-1, 1, 8, 2]], ["tile_rc", "sp", [-1, 96]], ["auto_unroll_max_step", "ot", 1500], ["unroll_explicit", "ot", 0]]}], "r": [[1.4063228123329176e-05], 0, 1.8188965320587158, 1581541560.8943925], "v": 0.1}
{"i": ["cuda", "topi_nn_conv2d", [["TENSOR", [1, 1024, 7, 7], "int8"], ["TENSOR", [192, 1024, 1, 1], "int8"], [1, 1], [0, 0], [1, 1], "NCHW", "int32"], {}, ["conv2d", [1, 1024, 7, 7, "int8"], [192, 1024, 1, 1, "int8"], [1, 1], [0, 0], [1, 1], "NCHW", "int32"], {"i": 2792178, "t": "int8", "c": null, "e": [["tile_n", "sp", [-1, 1, 1, 1]], ["tile_f", "sp", [-1, 1, 3, 1]], ["tile_y", "sp", [-1, 1, 1, 1]], ["tile_x", "sp", [-1, 1, 7, 1]], ["fuse_yx", "ot", 0], ["tile_rc", "sp", [-1, 4]], ["tile_ry", "sp", [-1, 1]], ["tile_rx", "sp", [-1, 1]], ["reorder_inner", "re", [1, 2, 0]], ["AA_double_buffer", "ot", 1], ["WW_double_buffer", "ot", 1], ["auto_unroll_max_step", "ot", 1500]]}], "r": [[1.0039634798229856e-05], 0, 2.5901026725769043, 1581545576.0670624], "v": 0.1}
{"i": ["cuda", "topi_nn_conv2d", [["TENSOR", [1, 1024, 7, 7], "int8"], ["TENSOR", [352, 1024, 1, 1], "int8"], [1, 1], [0, 0], [1, 1], "NCHW", "int32"], {}, ["conv2d", [1, 1024, 7, 7, "int8"], [352, 1024, 1, 1, "int8"], [1, 1], [0, 0], [1, 1], "NCHW", "int32"], {"i": 1508641, "t": "int8", "c": null, "e": [["tile_n", "sp", [-1, 1, 1, 1]], ["tile_f", "sp", [-1, 2, 1, 1]], ["tile_y", "sp", [-1, 1, 7, 1]], ["tile_x", "sp", [-1, 1, 7, 1]], ["fuse_yx", "ot", 0], ["tile_rc", "sp", [-1, 16]], ["tile_ry", "sp", [-1, 1]], ["tile_rx", "sp", [-1, 1]], ["reorder_inner", "re", [2, 1, 0]], ["AA_double_buffer", "ot", 0], ["WW_double_buffer", "ot", 1], ["auto_unroll_max_step", "ot", 1500]]}], "r": [[1.1884512792848335e-05], 0, 2.08004093170166, 1581553108.9942136], "v": 0.1}
{"i": ["cuda", "topi_nn_conv2d", [["TENSOR", [1, 1056, 7, 7], "int8"], ["TENSOR", [128, 1056, 1, 1], "int8"], [1, 1], [0, 0], [1, 1], "NCHW", "int32"], {}, ["conv2d", [1, 1056, 7, 7, "int8"], [128, 1056, 1, 1, "int8"], [1, 1], [0, 0], [1, 1], "NCHW", "int32"], {"i": 588336, "t": "int8", "c": null, "e": [["tile_n", "sp", [-1, 1, 1, 1]], ["tile_f", "sp", [-1, 1, 1, 1]], ["tile_y", "sp", [-1, 1, 7, 1]], ["tile_x", "sp", [-1, 1, 7, 1]], ["fuse_yx", "ot", 0], ["tile_rc", "sp", [-1, 22]], ["tile_ry", "sp", [-1, 1]], ["tile_rx", "sp", [-1, 1]], ["reorder_inner", "re", [1, 0, 2]], ["AA_double_buffer", "ot", 1], ["WW_double_buffer", "ot", 1], ["auto_unroll_max_step", "ot", 0]]}], "r": [[6.4880674277866e-06], 0, 1.8315556049346924, 1581557047.4935136], "v": 0.1}
{"i": ["cuda", "topi_nn_conv2d", [["TENSOR", [1, 224, 9, 9], "int8"], ["TENSOR", [224, 224, 3, 3], "int8"], [1, 1], [0, 0], [1, 1], "NCHW", "int32"], {}, ["conv2d", [1, 224, 9, 9, "int8"], [224, 224, 3, 3, "int8"], [1, 1], [0, 0], [1, 1], "NCHW", "int32"], {"i": 554345, "t": "winograd", "c": null, "e": [["tile_b", "sp", [-1, 1, 1, 1]], ["tile_y", "sp", [-1, 1, 4, 8]], ["tile_x", "sp", [-1, 1, 8, 2]], ["tile_rc", "sp", [-1, 112]], ["auto_unroll_max_step", "ot", 1500], ["unroll_explicit", "ot", 1]]}], "r": [[1.5330761039481594e-05], 0, 2.292583703994751, 1581561796.851661], "v": 0.1}
{"i": ["cuda", "topi_nn_conv2d", [["TENSOR", [1, 160, 9, 9], "int8"], ["TENSOR", [224, 160, 3, 3], "int8"], [1, 1], [0, 0], [1, 1], "NCHW", "int32"], {}, ["conv2d", [1, 160, 9, 9, "int8"], [224, 160, 3, 3, "int8"], [1, 1], [0, 0], [1, 1], "NCHW", "int32"], {"i": 85250, "t": "winograd", "c": null, "e": [["tile_b", "sp", [-1, 1, 1, 1]], ["tile_y", "sp", [-1, 1, 8, 4]], ["tile_x", "sp", [-1, 1, 4, 4]], ["tile_rc", "sp", [-1, 80]], ["auto_unroll_max_step", "ot", 0], ["unroll_explicit", "ot", 0]]}], "r": [[1.2717072702407002e-05], 0, 1.7448225021362305, 1581565738.8607209], "v": 0.1}
{"i": ["cuda", "topi_nn_conv2d", [["TENSOR", [1, 1056, 7, 7], "int8"], ["TENSOR", [160, 1056, 1, 1], "int8"], [1, 1], [0, 0], [1, 1], "NCHW", "int32"], {}, ["conv2d", [1, 1056, 7, 7, "int8"], [160, 1056, 1, 1, "int8"], [1, 1], [0, 0], [1, 1], "NCHW", "int32"], {"i": 922400, "t": "int8", "c": null, "e": [["tile_n", "sp", [-1, 1, 1, 1]], ["tile_f", "sp", [-1, 1, 1, 1]], ["tile_y", "sp", [-1, 1, 7, 1]], ["tile_x", "sp", [-1, 1, 7, 1]], ["fuse_yx", "ot", 0], ["tile_rc", "sp", [-1, 22]], ["tile_ry", "sp", [-1, 1]], ["tile_rx", "sp", [-1, 1]], ["reorder_inner", "re", [2, 0, 1]], ["AA_double_buffer", "ot", 1], ["WW_double_buffer", "ot", 1], ["auto_unroll_max_step", "ot", 0]]}], "r": [[6.739863405355604e-06], 0, 1.791327714920044, 1581574626.2160444], "v": 0.1}
{"i": ["cuda", "topi_nn_conv2d", [["TENSOR", [1, 192, 9, 9], "int8"], ["TENSOR", [320, 192, 3, 3], "int8"], [1, 1], [0, 0], [1, 1], "NCHW", "int32"], {}, ["conv2d", [1, 192, 9, 9, "int8"], [320, 192, 3, 3, "int8"], [1, 1], [0, 0], [1, 1], "NCHW", "int32"], {"i": 925586, "t": "winograd", "c": null, "e": [["tile_b", "sp", [-1, 1, 1, 1]], ["tile_y", "sp", [-1, 1, 8, 8]], ["tile_x", "sp", [-1, 1, 8, 2]], ["tile_rc", "sp", [-1, 24]], ["auto_unroll_max_step", "ot", 1500], ["unroll_explicit", "ot", 1]]}], "r": [[2.218145349933975e-05], 0, 2.4259250164031982, 1581582859.992895], "v": 0.1}
{"i": ["cuda", "topi_nn_conv2d", [["TENSOR", [1, 1056, 7, 7], "int8"], ["TENSOR", [192, 1056, 1, 1], "int8"], [1, 1], [0, 0], [1, 1], "NCHW", "int32"], {}, ["conv2d", [1, 1056, 7, 7, "int8"], [192, 1056, 1, 1, "int8"], [1, 1], [0, 0], [1, 1], "NCHW", "int32"], {"i": 4774858, "t": "int8", "c": null, "e": [["tile_n", "sp", [-1, 1, 1, 1]], ["tile_f", "sp", [-1, 1, 3, 1]], ["tile_y", "sp", [-1, 1, 7, 1]], ["tile_x", "sp", [-1, 1, 7, 1]], ["fuse_yx", "ot", 1], ["tile_rc", "sp", [-1, 24]], ["tile_ry", "sp", [-1, 1]], ["tile_rx", "sp", [-1, 1]], ["reorder_inner", "re", [0, 1, 2]], ["AA_double_buffer", "ot", 1], ["WW_double_buffer", "ot", 1], ["auto_unroll_max_step", "ot", 1500]]}], "r": [[8.361388009525144e-06], 0, 2.6576614379882812, 1581588822.3422897], "v": 0.1}
{"i": ["cuda", "topi_nn_conv2d", [["TENSOR", [1, 1056, 7, 7], "int8"], ["TENSOR", [352, 1056, 1, 1], "int8"], [1, 1], [0, 0], [1, 1], "NCHW", "int32"], {}, ["conv2d", [1, 1056, 7, 7, "int8"], [352, 1056, 1, 1, "int8"], [1, 1], [0, 0], [1, 1], "NCHW", "int32"], {"i": 2812990, "t": "int8", "c": null, "e": [["tile_n", "sp", [-1, 1, 1, 1]], ["tile_f", "sp", [-1, 1, 1, 2]], ["tile_y", "sp", [-1, 1, 7, 1]], ["tile_x", "sp", [-1, 1, 7, 1]], ["fuse_yx", "ot", 1], ["tile_rc", "sp", [-1, 33]], ["tile_ry", "sp", [-1, 1]], ["tile_rx", "sp", [-1, 1]], ["reorder_inner", "re", [1, 0, 2]], ["AA_double_buffer", "ot", 1], ["WW_double_buffer", "ot", 1], ["auto_unroll_max_step", "ot", 1500]]}], "r": [[1.2134866452935303e-05], 0, 2.2632930278778076, 1581593825.225164], "v": 0.1}
{"i": ["cuda", "topi_nn_conv2d", [["TENSOR", [1, 256, 16, 16], "int8"], ["TENSOR", [256, 256, 3, 3], "int8"], [2, 2], [0, 0], [1, 1], "NCHW", "int32"], {}, ["conv2d", [1, 256, 16, 16, "int8"], [256, 256, 3, 3, "int8"], [2, 2], [0, 0], [1, 1], "NCHW", "int32"], {"i": 5407780, "t": "int8", "c": null, "e": [["tile_n", "sp", [-1, 1, 1, 1]], ["tile_f", "sp", [-1, 1, 1, 2]], ["tile_y", "sp", [-1, 1, 7, 1]], ["tile_x", "sp", [-1, 1, 7, 1]], ["fuse_yx", "ot", 1], ["tile_rc", "sp", [-1, 4]], ["tile_ry", "sp", [-1, 3]], ["tile_rx", "sp", [-1, 3]], ["reorder_inner", "re", [2, 1, 0]], ["AA_double_buffer", "ot", 1], ["WW_double_buffer", "ot", 1], ["auto_unroll_max_step", "ot", 1500]]}], "r": [[1.7869597311381317e-05], 0, 2.1831588745117188, 1581599253.7478113], "v": 0.1}
{"i": ["cuda", "topi_nn_conv2d", [["TENSOR", [1, 192, 16, 16], "int8"], ["TENSOR", [256, 192, 3, 3], "int8"], [1, 1], [0, 0], [1, 1], "NCHW", "int32"], {}, ["conv2d", [1, 192, 16, 16, "int8"], [256, 192, 3, 3, "int8"], [1, 1], [0, 0], [1, 1], "NCHW", "int32"], {"i": 32979, "t": "winograd", "c": null, "e": [["tile_b", "sp", [-1, 1, 1, 1]], ["tile_y", "sp", [-1, 1, 16, 16]], ["tile_x", "sp", [-1, 1, 8, 2]], ["tile_rc", "sp", [-1, 8]], ["auto_unroll_max_step", "ot", 0], ["unroll_explicit", "ot", 0]]}], "r": [[4.392024487179487e-05], 0, 3.4630582332611084, 1581606424.0918896], "v": 0.1}
{"i": ["cuda", "topi_nn_conv2d", [["TENSOR", [1, 608, 14, 14], "int8"], ["TENSOR", [192, 608, 1, 1], "int8"], [1, 1], [0, 0], [1, 1], "NCHW", "int32"], {}, ["conv2d", [1, 608, 14, 14, "int8"], [192, 608, 1, 1, "int8"], [1, 1], [0, 0], [1, 1], "NCHW", "int32"], {"i": 12885322, "t": "int8", "c": null, "e": [["tile_n", "sp", [-1, 1, 1, 1]], ["tile_f", "sp", [-1, 3, 1, 1]], ["tile_y", "sp", [-1, 1, 7, 1]], ["tile_x", "sp", [-1, 1, 14, 1]], ["fuse_yx", "ot", 1], ["tile_rc", "sp", [-1, 8]], ["tile_ry", "sp", [-1, 1]], ["tile_rx", "sp", [-1, 1]], ["reorder_inner", "re", [2, 0, 1]], ["AA_double_buffer", "ot", 1], ["WW_double_buffer", "ot", 1], ["auto_unroll_max_step", "ot", 0]]}], "r": [[9.150857520528739e-06], 0, 2.0292463302612305, 1581616367.8214214], "v": 0.1}
{"i": ["cuda", "topi_nn_conv2d", [["TENSOR", [1, 128, 16, 16], "int8"], ["TENSOR", [192, 128, 3, 3], "int8"], [2, 2], [0, 0], [1, 1], "NCHW", "int32"], {}, ["conv2d", [1, 128, 16, 16, "int8"], [192, 128, 3, 3, "int8"], [2, 2], [0, 0], [1, 1], "NCHW", "int32"], {"i": 7182858, "t": "int8", "c": null, "e": [["tile_n", "sp", [-1, 1, 1, 1]], ["tile_f", "sp", [-1, 1, 3, 1]], ["tile_y", "sp", [-1, 1, 7, 1]], ["tile_x", "sp", [-1, 1, 7, 1]], ["fuse_yx", "ot", 0], ["tile_rc", "sp", [-1, 2]], ["tile_ry", "sp", [-1, 3]], ["tile_rx", "sp", [-1, 3]], ["reorder_inner", "re", [0, 1, 2]], ["AA_double_buffer", "ot", 1], ["WW_double_buffer", "ot", 1], ["auto_unroll_max_step", "ot", 1500]]}], "r": [[8.832303996983408e-06], 0, 3.0979833602905273, 1581623532.8952837], "v": 0.1}
{"i": ["cuda", "topi_nn_conv2d", [["TENSOR", [1, 192, 16, 16], "int8"], ["TENSOR", [192, 192, 3, 3], "int8"], [1, 1], [0, 0], [1, 1], "NCHW", "int32"], {}, ["conv2d", [1, 192, 16, 16, "int8"], [192, 192, 3, 3, "int8"], [1, 1], [0, 0], [1, 1], "NCHW", "int32"], {"i": 419932, "t": "winograd", "c": null, "e": [["tile_b", "sp", [-1, 1, 1, 1]], ["tile_y", "sp", [-1, 1, 12, 8]], ["tile_x", "sp", [-1, 1, 8, 2]], ["tile_rc", "sp", [-1, 16]], ["auto_unroll_max_step", "ot", 1500], ["unroll_explicit", "ot", 0]]}], "r": [[3.50886006460138e-05], 0, 3.605814218521118, 1581630934.7045717], "v": 0.1}
{"i": ["cuda", "topi_nn_conv2d", [["TENSOR", [1, 160, 16, 16], "int8"], ["TENSOR", [192, 160, 3, 3], "int8"], [1, 1], [0, 0], [1, 1], "NCHW", "int32"], {}, ["conv2d", [1, 160, 16, 16, "int8"], [192, 160, 3, 3, "int8"], [1, 1], [0, 0], [1, 1], "NCHW", "int32"], {"i": 784437, "t": "winograd", "c": null, "e": [["tile_b", "sp", [-1, 1, 1, 1]], ["tile_y", "sp", [-1, 2, 12, 4]], ["tile_x", "sp", [-1, 1, 8, 2]], ["tile_rc", "sp", [-1, 16]], ["auto_unroll_max_step", "ot", 1500], ["unroll_explicit", "ot", 1]]}], "r": [[2.9957225879396985e-05], 0, 3.8137805461883545, 1581637162.6392107], "v": 0.1}
{"i": ["cuda", "topi_nn_conv2d", [["TENSOR", [1, 608, 14, 14], "int8"], ["TENSOR", [160, 608, 1, 1], "int8"], [1, 1], [0, 0], [1, 1], "NCHW", "int32"], {}, ["conv2d", [1, 608, 14, 14, "int8"], [160, 608, 1, 1, "int8"], [1, 1], [0, 0], [1, 1], "NCHW", "int32"], {"i": 6052321, "t": "int8", "c": null, "e": [["tile_n", "sp", [-1, 1, 1, 1]], ["tile_f", "sp", [-1, 2, 1, 1]], ["tile_y", "sp", [-1, 1, 7, 1]], ["tile_x", "sp", [-1, 1, 14, 1]], ["fuse_yx", "ot", 1], ["tile_rc", "sp", [-1, 8]], ["tile_ry", "sp", [-1, 1]], ["tile_rx", "sp", [-1, 1]], ["reorder_inner", "re", [0, 1, 2]], ["AA_double_buffer", "ot", 1], ["WW_double_buffer", "ot", 1], ["auto_unroll_max_step", "ot", 0]]}], "r": [[8.086885439271963e-06], 0, 1.8352439403533936, 1581641734.6079776], "v": 0.1}
{"i": ["cuda", "topi_nn_conv2d", [["TENSOR", [1, 128, 16, 16], "int8"], ["TENSOR", [192, 128, 3, 3], "int8"], [1, 1], [0, 0], [1, 1], "NCHW", "int32"], {}, ["conv2d", [1, 128, 16, 16, "int8"], [192, 128, 3, 3, "int8"], [1, 1], [0, 0], [1, 1], "NCHW", "int32"], {"i": 149450, "t": "winograd", "c": null, "e": [["tile_b", "sp", [-1, 1, 1, 1]], ["tile_y", "sp", [-1, 1, 8, 8]], ["tile_x", "sp", [-1, 1, 8, 2]], ["tile_rc", "sp", [-1, 16]], ["auto_unroll_max_step", "ot", 128], ["unroll_explicit", "ot", 0]]}], "r": [[2.229458904810645e-05], 0, 3.436619997024536, 1581645276.800859], "v": 0.1}
{"i": ["cuda", "topi_nn_conv2d", [["TENSOR", [1, 608, 14, 14], "int8"], ["TENSOR", [128, 608, 1, 1], "int8"], [1, 1], [0, 0], [1, 1], "NCHW", "int32"], {}, ["conv2d", [1, 608, 14, 14, "int8"], [128, 608, 1, 1, "int8"], [1, 1], [0, 0], [1, 1], "NCHW", "int32"], {"i": 15662590, "t": "int8", "c": null, "e": [["tile_n", "sp", [-1, 1, 1, 1]], ["tile_f", "sp", [-1, 1, 2, 1]], ["tile_y", "sp", [-1, 1, 1, 2]], ["tile_x", "sp", [-1, 1, 14, 1]], ["fuse_yx", "ot", 0], ["tile_rc", "sp", [-1, 4]], ["tile_ry", "sp", [-1, 1]], ["tile_rx", "sp", [-1, 1]], ["reorder_inner", "re", [1, 0, 2]], ["AA_double_buffer", "ot", 1], ["WW_double_buffer", "ot", 1], ["auto_unroll_max_step", "ot", 1500]]}], "r": [[7.173566296200569e-06], 0, 2.481060028076172, 1581654862.8028634], "v": 0.1}
{"i": ["cuda", "topi_nn_conv2d", [["TENSOR", [1, 608, 14, 14], "int8"], ["TENSOR", [96, 608, 1, 1], "int8"], [1, 1], [0, 0], [1, 1], "NCHW", "int32"], {}, ["conv2d", [1, 608, 14, 14, "int8"], [96, 608, 1, 1, "int8"], [1, 1], [0, 0], [1, 1], "NCHW", "int32"], {"i": 23402568, "t": "int8", "c": null, "e": [["tile_n", "sp", [-1, 1, 1, 1]], ["tile_f", "sp", [-1, 1, 2, 1]], ["tile_y", "sp", [-1, 1, 2, 1]], ["tile_x", "sp", [-1, 1, 7, 2]], ["fuse_yx", "ot", 0], ["tile_rc", "sp", [-1, 8]], ["tile_ry", "sp", [-1, 1]], ["tile_rx", "sp", [-1, 1]], ["reorder_inner", "re", [2, 1, 0]], ["AA_double_buffer", "ot", 1], ["WW_double_buffer", "ot", 1], ["auto_unroll_max_step", "ot", 1500]]}], "r": [[6.644067554240631e-06], 0, 2.363663673400879, 1581665983.3283489], "v": 0.1}
{"i": ["cuda", "topi_nn_conv2d", [["TENSOR", [1, 160, 16, 16], "int8"], ["TENSOR", [160, 160, 3, 3], "int8"], [1, 1], [0, 0], [1, 1], "NCHW", "int32"], {}, ["conv2d", [1, 160, 16, 16, "int8"], [160, 160, 3, 3, "int8"], [1, 1], [0, 0], [1, 1], "NCHW", "int32"], {"i": 507273, "t": "winograd", "c": null, "e": [["tile_b", "sp", [-1, 1, 1, 1]], ["tile_y", "sp", [-1, 1, 40, 4]], ["tile_x", "sp", [-1, 1, 8, 2]], ["tile_rc", "sp", [-1, 8]], ["auto_unroll_max_step", "ot", 1500], ["unroll_explicit", "ot", 1]]}], "r": [[2.3733610764587524e-05], 0, 5.578750848770142, 1581673224.6872773], "v": 0.1}
{"i": ["cuda", "topi_nn_conv2d", [["TENSOR", [1, 128, 16, 16], "int8"], ["TENSOR", [160, 128, 3, 3], "int8"], [1, 1], [0, 0], [1, 1], "NCHW", "int32"], {}, ["conv2d", [1, 128, 16, 16, "int8"], [160, 128, 3, 3, "int8"], [1, 1], [0, 0], [1, 1], "NCHW", "int32"], {"i": 175583, "t": "winograd", "c": null, "e": [["tile_b", "sp", [-1, 1, 1, 1]], ["tile_y", "sp", [-1, 1, 16, 10]], ["tile_x", "sp", [-1, 2, 8, 1]], ["tile_rc", "sp", [-1, 64]], ["auto_unroll_max_step", "ot", 1500], ["unroll_explicit", "ot", 0]]}], "r": [[1.598332424011632e-05], 0, 4.718297004699707, 1581683188.9351141], "v": 0.1}
{"i": ["cuda", "topi_nn_conv2d", [["TENSOR", [1, 576, 14, 14], "int8"], ["TENSOR", [160, 576, 1, 1], "int8"], [1, 1], [0, 0], [1, 1], "NCHW", "int32"], {}, ["conv2d", [1, 576, 14, 14, "int8"], [160, 576, 1, 1, "int8"], [1, 1], [0, 0], [1, 1], "NCHW", "int32"], {"i": 26737150, "t": "int8", "c": null, "e": [["tile_n", "sp", [-1, 1, 1, 1]], ["tile_f", "sp", [-1, 1, 1, 2]], ["tile_y", "sp", [-1, 1, 7, 1]], ["tile_x", "sp", [-1, 1, 14, 1]], ["fuse_yx", "ot", 1], ["tile_rc", "sp", [-1, 12]], ["tile_ry", "sp", [-1, 1]], ["tile_rx", "sp", [-1, 1]], ["reorder_inner", "re", [0, 2, 1]], ["AA_double_buffer", "ot", 1], ["WW_double_buffer", "ot", 1], ["auto_unroll_max_step", "ot", 512]]}], "r": [[7.645437164375697e-06], 0, 1.8706998825073242, 1581689387.3283696], "v": 0.1}
{"i": ["cuda", "topi_nn_conv2d", [["TENSOR", [1, 576, 14, 14], "int8"], ["TENSOR", [192, 576, 1, 1], "int8"], [1, 1], [0, 0], [1, 1], "NCHW", "int32"], {}, ["conv2d", [1, 576, 14, 14, "int8"], [192, 576, 1, 1, "int8"], [1, 1], [0, 0], [1, 1], "NCHW", "int32"], {"i": 22992275, "t": "int8", "c": null, "e": [["tile_n", "sp", [-1, 1, 1, 1]], ["tile_f", "sp", [-1, 1, 1, 3]], ["tile_y", "sp", [-1, 1, 7, 1]], ["tile_x", "sp", [-1, 1, 14, 1]], ["fuse_yx", "ot", 1], ["tile_rc", "sp", [-1, 8]], ["tile_ry", "sp", [-1, 1]], ["tile_rx", "sp", [-1, 1]], ["reorder_inner", "re", [1, 2, 0]], ["AA_double_buffer", "ot", 1], ["WW_double_buffer", "ot", 1], ["auto_unroll_max_step", "ot", 0]]}], "r": [[8.813394941858233e-06], 0, 1.583094835281372, 1581695507.6987062], "v": 0.1}
{"i": ["cuda", "topi_nn_conv2d", [["TENSOR", [1, 576, 14, 14], "int8"], ["TENSOR", [128, 576, 1, 1], "int8"], [1, 1], [0, 0], [1, 1], "NCHW", "int32"], {}, ["conv2d", [1, 576, 14, 14, "int8"], [128, 576, 1, 1, "int8"], [1, 1], [0, 0], [1, 1], "NCHW", "int32"], {"i": 19490037, "t": "int8", "c": null, "e": [["tile_n", "sp", [-1, 1, 1, 1]], ["tile_f", "sp", [-1, 1, 1, 2]], ["tile_y", "sp", [-1, 1, 2, 1]], ["tile_x", "sp", [-1, 1, 14, 1]], ["fuse_yx", "ot", 1], ["tile_rc", "sp", [-1, 6]], ["tile_ry", "sp", [-1, 1]], ["tile_rx", "sp", [-1, 1]], ["reorder_inner", "re", [1, 2, 0]], ["AA_double_buffer", "ot", 1], ["WW_double_buffer", "ot", 1], ["auto_unroll_max_step", "ot", 512]]}], "r": [[6.8208924194804065e-06], 0, 2.3536620140075684, 1581703186.4357145], "v": 0.1}
{"i": ["cuda", "topi_nn_conv2d", [["TENSOR", [1, 128, 16, 16], "int8"], ["TENSOR", [128, 128, 3, 3], "int8"], [1, 1], [0, 0], [1, 1], "NCHW", "int32"], {}, ["conv2d", [1, 128, 16, 16, "int8"], [128, 128, 3, 3, "int8"], [1, 1], [0, 0], [1, 1], "NCHW", "int32"], {"i": 128979, "t": "winograd", "c": null, "e": [["tile_b", "sp", [-1, 1, 1, 1]], ["tile_y", "sp", [-1, 1, 16, 8]], ["tile_x", "sp", [-1, 1, 8, 2]], ["tile_rc", "sp", [-1, 64]], ["auto_unroll_max_step", "ot", 0], ["unroll_explicit", "ot", 1]]}], "r": [[1.4303490038857706e-05], 0, 3.593940258026123, 1581710703.7427015], "v": 0.1}
{"i": ["cuda", "topi_nn_conv2d", [["TENSOR", [1, 96, 16, 16], "int8"], ["TENSOR", [128, 96, 3, 3], "int8"], [1, 1], [0, 0], [1, 1], "NCHW", "int32"], {}, ["conv2d", [1, 96, 16, 16, "int8"], [128, 96, 3, 3, "int8"], [1, 1], [0, 0], [1, 1], "NCHW", "int32"], {"i": 95379, "t": "winograd", "c": null, "e": [["tile_b", "sp", [-1, 1, 1, 1]], ["tile_y", "sp", [-1, 1, 16, 8]], ["tile_x", "sp", [-1, 1, 8, 2]], ["tile_rc", "sp", [-1, 48]], ["auto_unroll_max_step", "ot", 128], ["unroll_explicit", "ot", 0]]}], "r": [[1.2914262002630714e-05], 0, 3.6742162704467773, 1581715018.6913445], "v": 0.1}
{"i": ["cuda", "topi_nn_conv2d", [["TENSOR", [1, 576, 14, 14], "int8"], ["TENSOR", [96, 576, 1, 1], "int8"], [1, 1], [0, 0], [1, 1], "NCHW", "int32"], {}, ["conv2d", [1, 576, 14, 14, "int8"], [96, 576, 1, 1, "int8"], [1, 1], [0, 0], [1, 1], "NCHW", "int32"], {"i": 40725222, "t": "int8", "c": null, "e": [["tile_n", "sp", [-1, 1, 1, 1]], ["tile_f", "sp", [-1, 1, 6, 1]], ["tile_y", "sp", [-1, 1, 1, 2]], ["tile_x", "sp", [-1, 1, 14, 1]], ["fuse_yx", "ot", 0], ["tile_rc", "sp", [-1, 6]], ["tile_ry", "sp", [-1, 1]], ["tile_rx", "sp", [-1, 1]], ["reorder_inner", "re", [0, 1, 2]], ["AA_double_buffer", "ot", 1], ["WW_double_buffer", "ot", 1], ["auto_unroll_max_step", "ot", 1500]]}], "r": [[5.720165224758042e-06], 0, 2.65008544921875, 1581736431.7740912], "v": 0.1}
{"i": ["cuda", "topi_nn_conv2d", [["TENSOR", [1, 64, 16, 16], "int8"], ["TENSOR", [96, 64, 3, 3], "int8"], [1, 1], [0, 0], [1, 1], "NCHW", "int32"], {}, ["conv2d", [1, 64, 16, 16, "int8"], [96, 64, 3, 3, "int8"], [1, 1], [0, 0], [1, 1], "NCHW", "int32"], {"i": 326973, "t": "winograd", "c": null, "e": [["tile_b", "sp", [-1, 1, 1, 1]], ["tile_y", "sp", [-1, 2, 12, 4]], ["tile_x", "sp", [-1, 1, 8, 2]], ["tile_rc", "sp", [-1, 64]], ["auto_unroll_max_step", "ot", 1500], ["unroll_explicit", "ot", 1]]}], "r": [[1.0114345640318435e-05], 0, 5.65663743019104, 1581742203.5198019], "v": 0.1}
{"i": ["cuda", "topi_nn_conv2d", [["TENSOR", [1, 576, 14, 14], "int8"], ["TENSOR", [64, 576, 1, 1], "int8"], [1, 1], [0, 0], [1, 1], "NCHW", "int32"], {}, ["conv2d", [1, 576, 14, 14, "int8"], [64, 576, 1, 1, "int8"], [1, 1], [0, 0], [1, 1], "NCHW", "int32"], {"i": 18417429, "t": "int8", "c": null, "e": [["tile_n", "sp", [-1, 1, 1, 1]], ["tile_f", "sp", [-1, 1, 4, 1]], ["tile_y", "sp", [-1, 1, 2, 1]], ["tile_x", "sp", [-1, 1, 14, 1]], ["fuse_yx", "ot", 1], ["tile_rc", "sp", [-1, 12]], ["tile_ry", "sp", [-1, 1]], ["tile_rx", "sp", [-1, 1]], ["reorder_inner", "re", [1, 0, 2]], ["AA_double_buffer", "ot", 1], ["WW_double_buffer", "ot", 1], ["auto_unroll_max_step", "ot", 1500]]}], "r": [[4.826831209479097e-06], 0, 2.0658161640167236, 1581748246.6426222], "v": 0.1}
{"i": ["cuda", "topi_nn_conv2d", [["TENSOR", [1, 576, 14, 14], "int8"], ["TENSOR", [224, 576, 1, 1], "int8"], [1, 1], [0, 0], [1, 1], "NCHW", "int32"], {}, ["conv2d", [1, 576, 14, 14, "int8"], [224, 576, 1, 1, "int8"], [1, 1], [0, 0], [1, 1], "NCHW", "int32"], {"i": 43796991, "t": "int8", "c": null, "e": [["tile_n", "sp", [-1, 1, 1, 1]], ["tile_f", "sp", [-1, 2, 1, 2]], ["tile_y", "sp", [-1, 1, 7, 1]], ["tile_x", "sp", [-1, 1, 14, 1]], ["fuse_yx", "ot", 0], ["tile_rc", "sp", [-1, 6]], ["tile_ry", "sp", [-1, 1]], ["tile_rx", "sp", [-1, 1]], ["reorder_inner", "re", [2, 1, 0]], ["AA_double_buffer", "ot", 1], ["WW_double_buffer", "ot", 1], ["auto_unroll_max_step", "ot", 1500]]}], "r": [[1.0233654869623356e-05], 0, 1.8166160583496094, 1581755858.7390897], "v": 0.1}
{"i": ["cuda", "topi_nn_conv2d", [["TENSOR", [1, 96, 29, 29], "int8"], ["TENSOR", [96, 96, 3, 3], "int8"], [2, 2], [0, 0], [1, 1], "NCHW", "int32"], {}, ["conv2d", [1, 96, 29, 29, "int8"], [96, 96, 3, 3, "int8"], [2, 2], [0, 0], [1, 1], "NCHW", "int32"], {"i": 91166822, "t": "int8", "c": null, "e": [["tile_n", "sp", [-1, 1, 1, 1]], ["tile_f", "sp", [-1, 1, 6, 1]], ["tile_y", "sp", [-1, 2, 1, 1]], ["tile_x", "sp", [-1, 1, 14, 1]], ["fuse_yx", "ot", 1], ["tile_rc", "sp", [-1, 2]], ["tile_ry", "sp", [-1, 1]], ["tile_rx", "sp", [-1, 3]], ["reorder_inner", "re", [1, 2, 0]], ["AA_double_buffer", "ot", 1], ["WW_double_buffer", "ot", 1], ["auto_unroll_max_step", "ot", 1500]]}], "r": [[8.546367024480107e-06], 0, 2.4740450382232666, 1581766999.2587113], "v": 0.1}
{"i": ["cuda", "topi_nn_conv2d", [["TENSOR", [1, 320, 27, 27], "int8"], ["TENSOR", [64, 320, 1, 1], "int8"], [1, 1], [0, 0], [1, 1], "NCHW", "int32"], {}, ["conv2d", [1, 320, 27, 27, "int8"], [64, 320, 1, 1, "int8"], [1, 1], [0, 0], [1, 1], "NCHW", "int32"], {"i": 13362456, "t": "int8", "c": null, "e": [["tile_n", "sp", [-1, 1, 1, 1]], ["tile_f", "sp", [-1, 2, 1, 2]], ["tile_y", "sp", [-1, 1, 3, 1]], ["tile_x", "sp", [-1, 1, 27, 1]], ["fuse_yx", "ot", 0], ["tile_rc", "sp", [-1, 20]], ["tile_ry", "sp", [-1, 1]], ["tile_rx", "sp", [-1, 1]], ["reorder_inner", "re", [2, 1, 0]], ["AA_double_buffer", "ot", 1], ["WW_double_buffer", "ot", 1], ["auto_unroll_max_step", "ot", 512]]}], "r": [[6.022874021352313e-06], 0, 2.475969076156616, 1581776601.7965453], "v": 0.1}
{"i": ["cuda", "topi_nn_conv2d", [["TENSOR", [1, 128, 29, 29], "int8"], ["TENSOR", [160, 128, 3, 3], "int8"], [2, 2], [0, 0], [1, 1], "NCHW", "int32"], {}, ["conv2d", [1, 128, 29, 29, "int8"], [160, 128, 3, 3, "int8"], [2, 2], [0, 0], [1, 1], "NCHW", "int32"], {"i": 46029470, "t": "int8", "c": null, "e": [["tile_n", "sp", [-1, 1, 1, 1]], ["tile_f", "sp", [-1, 1, 1, 2]], ["tile_y", "sp", [-1, 1, 14, 1]], ["tile_x", "sp", [-1, 1, 14, 1]], ["fuse_yx", "ot", 1], ["tile_rc", "sp", [-1, 2]], ["tile_ry", "sp", [-1, 3]], ["tile_rx", "sp", [-1, 3]], ["reorder_inner", "re", [2, 0, 1]], ["AA_double_buffer", "ot", 1], ["WW_double_buffer", "ot", 1], ["auto_unroll_max_step", "ot", 512]]}], "r": [[1.3735746772946286e-05], 0, 2.1384637355804443, 1581785905.5778537], "v": 0.1}
{"i": ["cuda", "topi_nn_conv2d", [["TENSOR", [1, 320, 27, 27], "int8"], ["TENSOR", [128, 320, 1, 1], "int8"], [1, 1], [0, 0], [1, 1], "NCHW", "int32"], {}, ["conv2d", [1, 320, 27, 27, "int8"], [128, 320, 1, 1, "int8"], [1, 1], [0, 0], [1, 1], "NCHW", "int32"], {"i": 25859912, "t": "int8", "c": null, "e": [["tile_n", "sp", [-1, 1, 1, 1]], ["tile_f", "sp", [-1, 4, 2, 1]], ["tile_y", "sp", [-1, 1, 3, 1]], ["tile_x", "sp", [-1, 1, 27, 1]], ["fuse_yx", "ot", 0], ["tile_rc", "sp", [-1, 20]], ["tile_ry", "sp", [-1, 1]], ["tile_rx", "sp", [-1, 1]], ["reorder_inner", "re", [1, 2, 0]], ["AA_double_buffer", "ot", 1], ["WW_double_buffer", "ot", 0], ["auto_unroll_max_step", "ot", 1500]]}], "r": [[9.614254462973075e-06], 0, 2.6296002864837646, 1581799471.2477603], "v": 0.1}
{"i": ["cuda", "topi_nn_conv2d", [["TENSOR", [1, 256, 27, 27], "int8"], ["TENSOR", [64, 256, 1, 1], "int8"], [1, 1], [0, 0], [1, 1], "NCHW", "int32"], {}, ["conv2d", [1, 256, 27, 27, "int8"], [64, 256, 1, 1, "int8"], [1, 1], [0, 0], [1, 1], "NCHW", "int32"], {"i": 8700456, "t": "int8", "c": null, "e": [["tile_n", "sp", [-1, 1, 1, 1]], ["tile_f", "sp", [-1, 2, 1, 2]], ["tile_y", "sp", [-1, 1, 3, 1]], ["tile_x", "sp", [-1, 1, 27, 1]], ["fuse_yx", "ot", 1], ["tile_rc", "sp", [-1, 4]], ["tile_ry", "sp", [-1, 1]], ["tile_rx", "sp", [-1, 1]], ["reorder_inner", "re", [1, 0, 2]], ["AA_double_buffer", "ot", 1], ["WW_double_buffer", "ot", 1], ["auto_unroll_max_step", "ot", 512]]}], "r": [[4.9963581503970104e-06], 0, 2.0681490898132324, 1581810212.69511], "v": 0.1}
{"i": ["cuda", "topi_nn_conv2d", [["TENSOR", [1, 192, 27, 27], "int8"], ["TENSOR", [32, 192, 1, 1], "int8"], [1, 1], [0, 0], [1, 1], "NCHW", "int32"], {}, ["conv2d", [1, 192, 27, 27, "int8"], [32, 192, 1, 1, "int8"], [1, 1], [0, 0], [1, 1], "NCHW", "int32"], {"i": 6179681, "t": "int8", "c": null, "e": [["tile_n", "sp", [-1, 1, 1, 1]], ["tile_f", "sp", [-1, 2, 1, 1]], ["tile_y", "sp", [-1, 1, 3, 1]], ["tile_x", "sp", [-1, 1, 27, 1]], ["fuse_yx", "ot", 0], ["tile_rc", "sp", [-1, 12]], ["tile_ry", "sp", [-1, 1]], ["tile_rx", "sp", [-1, 1]], ["reorder_inner", "re", [1, 0, 2]], ["AA_double_buffer", "ot", 0], ["WW_double_buffer", "ot", 1], ["auto_unroll_max_step", "ot", 512]]}], "r": [[3.3417644834245252e-06], 0, 1.6345500946044922, 1581818183.2865164], "v": 0.1}
{"i": ["cuda", "topi_nn_conv2d", [["TENSOR", [1, 96, 29, 29], "int8"], ["TENSOR", [96, 96, 3, 3], "int8"], [1, 1], [0, 0], [1, 1], "NCHW", "int32"], {}, ["conv2d", [1, 96, 29, 29, "int8"], [96, 96, 3, 3, "int8"], [1, 1], [0, 0], [1, 1], "NCHW", "int32"], {"i": 1552267, "t": "winograd", "c": null, "e": [["tile_b", "sp", [-1, 1, 1, 1]], ["tile_y", "sp", [-1, 1, 8, 6]], ["tile_x", "sp", [-1, 7, 28, 1]], ["tile_rc", "sp", [-1, 32]], ["auto_unroll_max_step", "ot", 1500], ["unroll_explicit", "ot", 1]]}], "r": [[2.4155998283695103e-05], 0, 4.085012912750244, 1581825798.3410265], "v": 0.1}
{"i": ["cuda", "topi_nn_conv2d", [["TENSOR", [1, 64, 29, 29], "int8"], ["TENSOR", [96, 64, 3, 3], "int8"], [1, 1], [0, 0], [1, 1], "NCHW", "int32"], {}, ["conv2d", [1, 64, 29, 29, "int8"], [96, 64, 3, 3, "int8"], [1, 1], [0, 0], [1, 1], "NCHW", "int32"], {"i": 902667, "t": "winograd", "c": null, "e": [["tile_b", "sp", [-1, 1, 1, 1]], ["tile_y", "sp", [-1, 1, 8, 6]], ["tile_x", "sp", [-1, 7, 28, 1]], ["tile_rc", "sp", [-1, 32]], ["auto_unroll_max_step", "ot", 1500], ["unroll_explicit", "ot", 1]]}], "r": [[1.8157995913016656e-05], 0, 3.8528552055358887, 1581836176.655548], "v": 0.1}
{"i": ["cuda", "topi_nn_conv2d", [["TENSOR", [1, 64, 29, 29], "int8"], ["TENSOR", [64, 64, 3, 3], "int8"], [1, 1], [0, 0], [1, 1], "NCHW", "int32"], {}, ["conv2d", [1, 64, 29, 29, "int8"], [64, 64, 3, 3, "int8"], [1, 1], [0, 0], [1, 1], "NCHW", "int32"], {"i": 338497, "t": "winograd", "c": null, "e": [["tile_b", "sp", [-1, 1, 1, 1]], ["tile_y", "sp", [-1, 1, 8, 4]], ["tile_x", "sp", [-1, 7, 28, 1]], ["tile_rc", "sp", [-1, 32]], ["auto_unroll_max_step", "ot", 1500], ["unroll_explicit", "ot", 1]]}], "r": [[1.5389462182391176e-05], 0, 2.999734401702881, 1581842218.3362029], "v": 0.1}
{"i": ["cuda", "topi_nn_conv2d", [["TENSOR", [1, 192, 27, 27], "int8"], ["TENSOR", [64, 192, 1, 1], "int8"], [1, 1], [0, 0], [1, 1], "NCHW", "int32"], {}, ["conv2d", [1, 192, 27, 27, "int8"], [64, 192, 1, 1, "int8"], [1, 1], [0, 0], [1, 1], "NCHW", "int32"], {"i": 5844456, "t": "int8", "c": null, "e": [["tile_n", "sp", [-1, 1, 1, 1]], ["tile_f", "sp", [-1, 2, 1, 2]], ["tile_y", "sp", [-1, 1, 3, 1]], ["tile_x", "sp", [-1, 1, 27, 1]], ["fuse_yx", "ot", 1], ["tile_rc", "sp", [-1, 24]], ["tile_ry", "sp", [-1, 1]], ["tile_rx", "sp", [-1, 1]], ["reorder_inner", "re", [1, 0, 2]], ["AA_double_buffer", "ot", 1], ["WW_double_buffer", "ot", 1], ["auto_unroll_max_step", "ot", 0]]}], "r": [[4.249359727042767e-06], 0, 1.9717066287994385, 1581846975.3334863], "v": 0.1}
{"i": ["cuda", "topi_nn_conv2d", [["TENSOR", [1, 64, 57, 57], "int8"], ["TENSOR", [192, 64, 3, 3], "int8"], [1, 1], [0, 0], [1, 1], "NCHW", "int32"], {}, ["conv2d", [1, 64, 57, 57, "int8"], [192, 64, 3, 3, "int8"], [1, 1], [0, 0], [1, 1], "NCHW", "int32"], {"i": 4611790, "t": "winograd", "c": null, "e": [["tile_b", "sp", [-1, 1, 1, 1]], ["tile_y", "sp", [-1, 8, 2, 4]], ["tile_x", "sp", [-1, 2, 56, 1]], ["tile_rc", "sp", [-1, 16]], ["auto_unroll_max_step", "ot", 1500], ["unroll_explicit", "ot", 1]]}], "r": [[0.00014396054138915318], 0, 3.1560120582580566, 1581860824.5081782], "v": 0.1}
{"i": ["cuda", "topi_nn_conv2d", [["TENSOR", [1, 64, 55, 55], "int8"], ["TENSOR", [64, 64, 1, 1], "int8"], [1, 1], [0, 0], [1, 1], "NCHW", "int32"], {}, ["conv2d", [1, 64, 55, 55, "int8"], [64, 64, 1, 1, "int8"], [1, 1], [0, 0], [1, 1], "NCHW", "int32"], {"i": 873603, "t": "int8", "c": null, "e": [["tile_n", "sp", [-1, 1, 1, 1]], ["tile_f", "sp", [-1, 8, 1, 1]], ["tile_y", "sp", [-1, 1, 1, 1]], ["tile_x", "sp", [-1, 1, 55, 1]], ["fuse_yx", "ot", 1], ["tile_rc", "sp", [-1, 8]], ["tile_ry", "sp", [-1, 1]], ["tile_rx", "sp", [-1, 1]], ["reorder_inner", "re", [1, 2, 0]], ["AA_double_buffer", "ot", 1], ["WW_double_buffer", "ot", 0], ["auto_unroll_max_step", "ot", 0]]}], "r": [[5.40161839596457e-06], 0, 1.9182372093200684, 1581873036.845243], "v": 0.1}
{"i": ["cuda", "topi_nn_conv2d", [["TENSOR", [1, 3, 230, 230], "int8"], ["TENSOR", [64, 3, 7, 7], "int8"], [2, 2], [0, 0], [1, 1], "NCHW", "int32"], {}, ["conv2d", [1, 3, 230, 230, "int8"], [64, 3, 7, 7, "int8"], [2, 2], [0, 0], [1, 1], "NCHW", "int32"], {"i": 69497809, "t": "direct", "c": null, "e": [["tile_f", "sp", [-1, 1, 8, 8]], ["tile_y", "sp", [-1, 2, 1, 7]], ["tile_x", "sp", [-1, 1, 8, 1]], ["tile_rc", "sp", [-1, 1]], ["tile_ry", "sp", [-1, 7]], ["tile_rx", "sp", [-1, 1]], ["auto_unroll_max_step", "ot", 1500], ["unroll_explicit", "ot", 1]]}], "r": [[4.669176754470294e-05], 0, 2.894991159439087, 1581883562.5345063], "v": 0.1}
{"i": ["llvm -mcpu=cascadelake", "topi_x86_conv2d_NCHWc_int8", [["TENSOR", [1, 4, 230, 230], "uint8"], ["TENSOR", [64, 4, 7, 7], "int8"], [2, 2], [0, 0], [1, 1], "NCHW", "int32"], {}, ["conv2d", [1, 4, 230, 230, "uint8"], [64, 4, 7, 7, "int8"], [2, 2], [0, 0], [1, 1], "NCHW", "int32"], {"i": 3, "t": "direct", "c": null, "e": [["tile_ic", "sp", [-1, 4]], ["tile_oc", "sp", [-1, 16]], ["tile_ow", "sp", [-1, 2]], ["unroll_kw", "ot", true]]}], "r": [[4.937968770154916e-05], 0, 2.7684264183044434, 1579944385.21406], "v": 0.1}
{"i": ["llvm -mcpu=cascadelake", "topi_x86_conv2d_NCHWc_int8", [["TENSOR", [1, 64, 55, 55], "uint8"], ["TENSOR", [64, 64, 1, 1], "int8"], [1, 1], [0, 0], [1, 1], "NCHW", "int32"], {}, ["conv2d", [1, 64, 55, 55, "uint8"], [64, 64, 1, 1, "int8"], [1, 1], [0, 0], [1, 1], "NCHW", "int32"], {"i": 60, "t": "direct", "c": null, "e": [["tile_ic", "sp", [-1, 4]], ["tile_oc", "sp", [-1, 16]], ["tile_ow", "sp", [-1, 1]], ["tile_oh", "ot", 2]]}], "r": [[7.1810170285525415e-06], 0, 2.0601649284362793, 1579944557.9771187], "v": 0.1}
{"i": ["llvm -mcpu=cascadelake", "topi_x86_conv2d_NCHWc_int8", [["TENSOR", [1, 64, 57, 57], "uint8"], ["TENSOR", [192, 64, 3, 3], "int8"], [1, 1], [0, 0], [1, 1], "NCHW", "int32"], {}, ["conv2d", [1, 64, 57, 57, "uint8"], [192, 64, 3, 3, "int8"], [1, 1], [0, 0], [1, 1], "NCHW", "int32"], {"i": 34, "t": "direct", "c": null, "e": [["tile_ic", "sp", [-1, 64]], ["tile_oc", "sp", [-1, 16]], ["tile_ow", "sp", [-1, 5]], ["unroll_kw", "ot", true]]}], "r": [[8.90895976825029e-05], 0, 2.738696575164795, 1579945204.1264424], "v": 0.1}
{"i": ["llvm -mcpu=cascadelake", "topi_x86_conv2d_NCHWc_int8", [["TENSOR", [1, 192, 27, 27], "uint8"], ["TENSOR", [64, 192, 1, 1], "int8"], [1, 1], [0, 0], [1, 1], "NCHW", "int32"], {}, ["conv2d", [1, 192, 27, 27, "uint8"], [64, 192, 1, 1, "int8"], [1, 1], [0, 0], [1, 1], "NCHW", "int32"], {"i": 92, "t": "direct", "c": null, "e": [["tile_ic", "sp", [-1, 12]], ["tile_oc", "sp", [-1, 16]], ["tile_ow", "sp", [-1, 27]], ["tile_oh", "ot", 1]]}], "r": [[5.997305310836993e-06], 0, 3.5013859272003174, 1579945339.261671], "v": 0.1}
{"i": ["llvm -mcpu=cascadelake", "topi_x86_conv2d_NCHWc_int8", [["TENSOR", [1, 64, 29, 29], "uint8"], ["TENSOR", [64, 64, 3, 3], "int8"], [1, 1], [0, 0], [1, 1], "NCHW", "int32"], {}, ["conv2d", [1, 64, 29, 29, "uint8"], [64, 64, 3, 3, "int8"], [1, 1], [0, 0], [1, 1], "NCHW", "int32"], {"i": 33, "t": "direct", "c": null, "e": [["tile_ic", "sp", [-1, 32]], ["tile_oc", "sp", [-1, 16]], ["tile_ow", "sp", [-1, 9]], ["unroll_kw", "ot", true]]}], "r": [[1.029751724033968e-05], 0, 1.9405403137207031, 1579945875.35727], "v": 0.1}
{"i": ["llvm -mcpu=cascadelake", "topi_x86_conv2d_NCHWc_int8", [["TENSOR", [1, 64, 29, 29], "uint8"], ["TENSOR", [96, 64, 3, 3], "int8"], [1, 1], [0, 0], [1, 1], "NCHW", "int32"], {}, ["conv2d", [1, 64, 29, 29, "uint8"], [96, 64, 3, 3, "int8"], [1, 1], [0, 0], [1, 1], "NCHW", "int32"], {"i": 21, "t": "direct", "c": null, "e": [["tile_ic", "sp", [-1, 8]], ["tile_oc", "sp", [-1, 16]], ["tile_ow", "sp", [-1, 3]], ["unroll_kw", "ot", true]]}], "r": [[1.3180464280514437e-05], 0, 2.009869337081909, 1579946296.6633885], "v": 0.1}
{"i": ["llvm -mcpu=cascadelake", "topi_x86_conv2d_NCHWc_int8", [["TENSOR", [1, 96, 29, 29], "uint8"], ["TENSOR", [96, 96, 3, 3], "int8"], [1, 1], [0, 0], [1, 1], "NCHW", "int32"], {}, ["conv2d", [1, 96, 29, 29, "uint8"], [96, 96, 3, 3, "int8"], [1, 1], [0, 0], [1, 1], "NCHW", "int32"], {"i": 33, "t": "direct", "c": null, "e": [["tile_ic", "sp", [-1, 8]], ["tile_oc", "sp", [-1, 16]], ["tile_ow", "sp", [-1, 3]], ["unroll_kw", "ot", true]]}], "r": [[1.852365896101552e-05], 0, 2.234365463256836, 1579946720.842738], "v": 0.1}
{"i": ["llvm -mcpu=cascadelake", "topi_x86_conv2d_NCHWc_int8", [["TENSOR", [1, 192, 27, 27], "uint8"], ["TENSOR", [32, 192, 1, 1], "int8"], [1, 1], [0, 0], [1, 1], "NCHW", "int32"], {}, ["conv2d", [1, 192, 27, 27, "uint8"], [32, 192, 1, 1, "int8"], [1, 1], [0, 0], [1, 1], "NCHW", "int32"], {"i": 43, "t": "direct", "c": null, "e": [["tile_ic", "sp", [-1, 16]], ["tile_oc", "sp", [-1, 16]], ["tile_ow", "sp", [-1, 9]], ["tile_oh", "ot", 1]]}], "r": [[4.479003052862729e-06], 0, 3.2814385890960693, 1579947257.1071942], "v": 0.1}
{"i": ["llvm -mcpu=cascadelake", "topi_x86_conv2d_NCHWc_int8", [["TENSOR", [1, 256, 27, 27], "uint8"], ["TENSOR", [64, 256, 1, 1], "int8"], [1, 1], [0, 0], [1, 1], "NCHW", "int32"], {}, ["conv2d", [1, 256, 27, 27, "uint8"], [64, 256, 1, 1, "int8"], [1, 1], [0, 0], [1, 1], "NCHW", "int32"], {"i": 66, "t": "direct", "c": null, "e": [["tile_ic", "sp", [-1, 32]], ["tile_oc", "sp", [-1, 16]], ["tile_ow", "sp", [-1, 27]], ["tile_oh", "ot", 1]]}], "r": [[6.933459604915013e-06], 0, 1.7738292217254639, 1579947794.38204], "v": 0.1}
{"i": ["llvm -mcpu=cascadelake", "topi_x86_conv2d_NCHWc_int8", [["TENSOR", [1, 320, 27, 27], "uint8"], ["TENSOR", [128, 320, 1, 1], "int8"], [1, 1], [0, 0], [1, 1], "NCHW", "int32"], {}, ["conv2d", [1, 320, 27, 27, "uint8"], [128, 320, 1, 1, "int8"], [1, 1], [0, 0], [1, 1], "NCHW", "int32"], {"i": 129, "t": "direct", "c": null, "e": [["tile_ic", "sp", [-1, 320]], ["tile_oc", "sp", [-1, 16]], ["tile_ow", "sp", [-1, 27]], ["tile_oh", "ot", 1]]}], "r": [[1.1651908255493388e-05], 0, 1.8735265731811523, 1579948160.908923], "v": 0.1}
{"i": ["llvm -mcpu=cascadelake", "topi_x86_conv2d_NCHWc_int8", [["TENSOR", [1, 128, 29, 29], "uint8"], ["TENSOR", [160, 128, 3, 3], "int8"], [2, 2], [0, 0], [1, 1], "NCHW", "int32"], {}, ["conv2d", [1, 128, 29, 29, "uint8"], [160, 128, 3, 3, "int8"], [2, 2], [0, 0], [1, 1], "NCHW", "int32"], {"i": 176, "t": "direct", "c": null, "e": [["tile_ic", "sp", [-1, 16]], ["tile_oc", "sp", [-1, 32]], ["tile_ow", "sp", [-1, 14]], ["unroll_kw", "ot", false]]}], "r": [[1.2451374567942364e-05], 0, 2.2376136779785156, 1579948997.4283957], "v": 0.1}
{"i": ["llvm -mcpu=cascadelake", "topi_x86_conv2d_NCHWc_int8", [["TENSOR", [1, 320, 27, 27], "uint8"], ["TENSOR", [64, 320, 1, 1], "int8"], [1, 1], [0, 0], [1, 1], "NCHW", "int32"], {}, ["conv2d", [1, 320, 27, 27, "uint8"], [64, 320, 1, 1, "int8"], [1, 1], [0, 0], [1, 1], "NCHW", "int32"], {"i": 67, "t": "direct", "c": null, "e": [["tile_ic", "sp", [-1, 80]], ["tile_oc", "sp", [-1, 16]], ["tile_ow", "sp", [-1, 9]], ["tile_oh", "ot", 1]]}], "r": [[7.8196498098063e-06], 0, 3.4717164039611816, 1579949606.2089767], "v": 0.1}
{"i": ["llvm -mcpu=cascadelake", "topi_x86_conv2d_NCHWc_int8", [["TENSOR", [1, 96, 29, 29], "uint8"], ["TENSOR", [96, 96, 3, 3], "int8"], [2, 2], [0, 0], [1, 1], "NCHW", "int32"], {}, ["conv2d", [1, 96, 29, 29, "uint8"], [96, 96, 3, 3, "int8"], [2, 2], [0, 0], [1, 1], "NCHW", "int32"], {"i": 46, "t": "direct", "c": null, "e": [["tile_ic", "sp", [-1, 48]], ["tile_oc", "sp", [-1, 32]], ["tile_ow", "sp", [-1, 2]], ["unroll_kw", "ot", true]]}], "r": [[7.38337090629702e-06], 0, 3.3510897159576416, 1579950207.9044077], "v": 0.1}
{"i": ["llvm -mcpu=cascadelake", "topi_x86_conv2d_NCHWc_int8", [["TENSOR", [1, 576, 14, 14], "uint8"], ["TENSOR", [224, 576, 1, 1], "int8"], [1, 1], [0, 0], [1, 1], "NCHW", "int32"], {}, ["conv2d", [1, 576, 14, 14, "uint8"], [224, 576, 1, 1, "int8"], [1, 1], [0, 0], [1, 1], "NCHW", "int32"], {"i": 124, "t": "direct", "c": null, "e": [["tile_ic", "sp", [-1, 24]], ["tile_oc", "sp", [-1, 16]], ["tile_ow", "sp", [-1, 7]], ["tile_oh", "ot", 1]]}], "r": [[1.0299670228960524e-05], 0, 1.8436012268066406, 1579950969.1701796], "v": 0.1}
{"i": ["llvm -mcpu=cascadelake", "topi_x86_conv2d_NCHWc_int8", [["TENSOR", [1, 576, 14, 14], "uint8"], ["TENSOR", [64, 576, 1, 1], "int8"], [1, 1], [0, 0], [1, 1], "NCHW", "int32"], {}, ["conv2d", [1, 576, 14, 14, "uint8"], [64, 576, 1, 1, "int8"], [1, 1], [0, 0], [1, 1], "NCHW", "int32"], {"i": 145, "t": "direct", "c": null, "e": [["tile_ic", "sp", [-1, 96]], ["tile_oc", "sp", [-1, 16]], ["tile_ow", "sp", [-1, 14]], ["tile_oh", "ot", 1]]}], "r": [[5.135779595226202e-06], 0, 3.245551347732544, 1579951841.1980672], "v": 0.1}
{"i": ["llvm -mcpu=cascadelake", "topi_x86_conv2d_NCHWc_int8", [["TENSOR", [1, 64, 16, 16], "uint8"], ["TENSOR", [96, 64, 3, 3], "int8"], [1, 1], [0, 0], [1, 1], "NCHW", "int32"], {}, ["conv2d", [1, 64, 16, 16, "uint8"], [96, 64, 3, 3, "int8"], [1, 1], [0, 0], [1, 1], "NCHW", "int32"], {"i": 41, "t": "direct", "c": null, "e": [["tile_ic", "sp", [-1, 8]], ["tile_oc", "sp", [-1, 16]], ["tile_ow", "sp", [-1, 7]], ["unroll_kw", "ot", true]]}], "r": [[5.811615402251999e-06], 0, 3.27659010887146, 1579952725.8401442], "v": 0.1}
{"i": ["llvm -mcpu=cascadelake", "topi_x86_conv2d_NCHWc_int8", [["TENSOR", [1, 576, 14, 14], "uint8"], ["TENSOR", [96, 576, 1, 1], "int8"], [1, 1], [0, 0], [1, 1], "NCHW", "int32"], {}, ["conv2d", [1, 576, 14, 14, "uint8"], [96, 576, 1, 1, "int8"], [1, 1], [0, 0], [1, 1], "NCHW", "int32"], {"i": 148, "t": "direct", "c": null, "e": [["tile_ic", "sp", [-1, 288]], ["tile_oc", "sp", [-1, 32]], ["tile_ow", "sp", [-1, 7]], ["tile_oh", "ot", 1]]}], "r": [[5.909251533016689e-06], 0, 3.2877187728881836, 1579954112.8661273], "v": 0.1}
{"i": ["llvm -mcpu=cascadelake", "topi_x86_conv2d_NCHWc_int8", [["TENSOR", [1, 96, 16, 16], "uint8"], ["TENSOR", [128, 96, 3, 3], "int8"], [1, 1], [0, 0], [1, 1], "NCHW", "int32"], {}, ["conv2d", [1, 96, 16, 16, "uint8"], [128, 96, 3, 3, "int8"], [1, 1], [0, 0], [1, 1], "NCHW", "int32"], {"i": 231, "t": "direct", "c": null, "e": [["tile_ic", "sp", [-1, 96]], ["tile_oc", "sp", [-1, 16]], ["tile_ow", "sp", [-1, 14]], ["unroll_kw", "ot", false]]}], "r": [[9.009766776616373e-06], 0, 3.4254660606384277, 1579954348.0841784], "v": 0.1}
{"i": ["llvm -mcpu=cascadelake", "topi_x86_conv2d_NCHWc_int8", [["TENSOR", [1, 128, 16, 16], "uint8"], ["TENSOR", [128, 128, 3, 3], "int8"], [1, 1], [0, 0], [1, 1], "NCHW", "int32"], {}, ["conv2d", [1, 128, 16, 16, "uint8"], [128, 128, 3, 3, "int8"], [1, 1], [0, 0], [1, 1], "NCHW", "int32"], {"i": 144, "t": "direct", "c": null, "e": [["tile_ic", "sp", [-1, 4]], ["tile_oc", "sp", [-1, 16]], ["tile_ow", "sp", [-1, 7]], ["unroll_kw", "ot", false]]}], "r": [[1.0850041413955103e-05], 0, 1.7767887115478516, 1579955246.9440894], "v": 0.1}
{"i": ["llvm -mcpu=cascadelake", "topi_x86_conv2d_NCHWc_int8", [["TENSOR", [1, 576, 14, 14], "uint8"], ["TENSOR", [128, 576, 1, 1], "int8"], [1, 1], [0, 0], [1, 1], "NCHW", "int32"], {}, ["conv2d", [1, 576, 14, 14, "uint8"], [128, 576, 1, 1, "int8"], [1, 1], [0, 0], [1, 1], "NCHW", "int32"], {"i": 187, "t": "direct", "c": null, "e": [["tile_ic", "sp", [-1, 48]], ["tile_oc", "sp", [-1, 16]], ["tile_ow", "sp", [-1, 14]], ["tile_oh", "ot", 1]]}], "r": [[7.0888739121484606e-06], 0, 3.39267897605896, 1579955366.2536058], "v": 0.1}
{"i": ["llvm -mcpu=cascadelake", "topi_x86_conv2d_NCHWc_int8", [["TENSOR", [1, 576, 14, 14], "uint8"], ["TENSOR", [192, 576, 1, 1], "int8"], [1, 1], [0, 0], [1, 1], "NCHW", "int32"], {}, ["conv2d", [1, 576, 14, 14, "uint8"], [192, 576, 1, 1, "int8"], [1, 1], [0, 0], [1, 1], "NCHW", "int32"], {"i": 270, "t": "direct", "c": null, "e": [["tile_ic", "sp", [-1, 4]], ["tile_oc", "sp", [-1, 16]], ["tile_ow", "sp", [-1, 14]], ["tile_oh", "ot", 1]]}], "r": [[8.989163735129067e-06], 0, 1.8020825386047363, 1579957497.8745868], "v": 0.1}
{"i": ["llvm -mcpu=cascadelake", "topi_x86_conv2d_NCHWc_int8", [["TENSOR", [1, 576, 14, 14], "uint8"], ["TENSOR", [160, 576, 1, 1], "int8"], [1, 1], [0, 0], [1, 1], "NCHW", "int32"], {}, ["conv2d", [1, 576, 14, 14, "uint8"], [160, 576, 1, 1, "int8"], [1, 1], [0, 0], [1, 1], "NCHW", "int32"], {"i": 207, "t": "direct", "c": null, "e": [["tile_ic", "sp", [-1, 192]], ["tile_oc", "sp", [-1, 32]], ["tile_ow", "sp", [-1, 14]], ["tile_oh", "ot", 1]]}], "r": [[7.679721261927722e-06], 0, 3.38124942779541, 1579958910.222812], "v": 0.1}
{"i": ["llvm -mcpu=cascadelake", "topi_x86_conv2d_NCHWc_int8", [["TENSOR", [1, 128, 16, 16], "uint8"], ["TENSOR", [160, 128, 3, 3], "int8"], [1, 1], [0, 0], [1, 1], "NCHW", "int32"], {}, ["conv2d", [1, 128, 16, 16, "uint8"], [160, 128, 3, 3, "int8"], [1, 1], [0, 0], [1, 1], "NCHW", "int32"], {"i": 51, "t": "direct", "c": null, "e": [["tile_ic", "sp", [-1, 32]], ["tile_oc", "sp", [-1, 16]], ["tile_ow", "sp", [-1, 7]], ["unroll_kw", "ot", true]]}], "r": [[1.2051900684579254e-05], 0, 1.9875030517578125, 1579959838.4889998], "v": 0.1}
{"i": ["llvm -mcpu=cascadelake", "topi_x86_conv2d_NCHWc_int8", [["TENSOR", [1, 160, 16, 16], "uint8"], ["TENSOR", [160, 160, 3, 3], "int8"], [1, 1], [0, 0], [1, 1], "NCHW", "int32"], {}, ["conv2d", [1, 160, 16, 16, "uint8"], [160, 160, 3, 3, "int8"], [1, 1], [0, 0], [1, 1], "NCHW", "int32"], {"i": 192, "t": "direct", "c": null, "e": [["tile_ic", "sp", [-1, 4]], ["tile_oc", "sp", [-1, 16]], ["tile_ow", "sp", [-1, 7]], ["unroll_kw", "ot", false]]}], "r": [[1.4464153900826237e-05], 0, 2.0756866931915283, 1579960156.2730422], "v": 0.1}
{"i": ["llvm -mcpu=cascadelake", "topi_x86_conv2d_NCHWc_int8", [["TENSOR", [1, 608, 14, 14], "uint8"], ["TENSOR", [96, 608, 1, 1], "int8"], [1, 1], [0, 0], [1, 1], "NCHW", "int32"], {}, ["conv2d", [1, 608, 14, 14, "uint8"], [96, 608, 1, 1, "int8"], [1, 1], [0, 0], [1, 1], "NCHW", "int32"], {"i": 207, "t": "direct", "c": null, "e": [["tile_ic", "sp", [-1, 608]], ["tile_oc", "sp", [-1, 32]], ["tile_ow", "sp", [-1, 7]], ["tile_oh", "ot", 2]]}], "r": [[6.2337081564001575e-06], 0, 3.279090166091919, 1579960585.5909302], "v": 0.1}
{"i": ["llvm -mcpu=cascadelake", "topi_x86_conv2d_NCHWc_int8", [["TENSOR", [1, 608, 14, 14], "uint8"], ["TENSOR", [128, 608, 1, 1], "int8"], [1, 1], [0, 0], [1, 1], "NCHW", "int32"], {}, ["conv2d", [1, 608, 14, 14, "uint8"], [128, 608, 1, 1, "int8"], [1, 1], [0, 0], [1, 1], "NCHW", "int32"], {"i": 78, "t": "direct", "c": null, "e": [["tile_ic", "sp", [-1, 304]], ["tile_oc", "sp", [-1, 32]], ["tile_ow", "sp", [-1, 7]], ["tile_oh", "ot", 1]]}], "r": [[7.807540818068734e-06], 0, 3.360809326171875, 1579961657.1188874], "v": 0.1}
{"i": ["llvm -mcpu=cascadelake", "topi_x86_conv2d_NCHWc_int8", [["TENSOR", [1, 128, 16, 16], "uint8"], ["TENSOR", [192, 128, 3, 3], "int8"], [1, 1], [0, 0], [1, 1], "NCHW", "int32"], {}, ["conv2d", [1, 128, 16, 16, "uint8"], [192, 128, 3, 3, "int8"], [1, 1], [0, 0], [1, 1], "NCHW", "int32"], {"i": 220, "t": "direct", "c": null, "e": [["tile_ic", "sp", [-1, 64]], ["tile_oc", "sp", [-1, 16]], ["tile_ow", "sp", [-1, 7]], ["unroll_kw", "ot", false]]}], "r": [[1.5244720533169754e-05], 0, 2.178683042526245, 1579961858.0685833], "v": 0.1}
{"i": ["llvm -mcpu=cascadelake", "topi_x86_conv2d_NCHWc_int8", [["TENSOR", [1, 608, 14, 14], "uint8"], ["TENSOR", [160, 608, 1, 1], "int8"], [1, 1], [0, 0], [1, 1], "NCHW", "int32"], {}, ["conv2d", [1, 608, 14, 14, "uint8"], [160, 608, 1, 1, "int8"], [1, 1], [0, 0], [1, 1], "NCHW", "int32"], {"i": 103, "t": "direct", "c": null, "e": [["tile_ic", "sp", [-1, 608]], ["tile_oc", "sp", [-1, 16]], ["tile_ow", "sp", [-1, 14]], ["tile_oh", "ot", 1]]}], "r": [[8.074755169785585e-06], 0, 3.3305606842041016, 1579962827.6799037], "v": 0.1}
{"i": ["llvm -mcpu=cascadelake", "topi_x86_conv2d_NCHWc_int8", [["TENSOR", [1, 160, 16, 16], "uint8"], ["TENSOR", [192, 160, 3, 3], "int8"], [1, 1], [0, 0], [1, 1], "NCHW", "int32"], {}, ["conv2d", [1, 160, 16, 16, "uint8"], [192, 160, 3, 3, "int8"], [1, 1], [0, 0], [1, 1], "NCHW", "int32"], {"i": 99, "t": "direct", "c": null, "e": [["tile_ic", "sp", [-1, 20]], ["tile_oc", "sp", [-1, 16]], ["tile_ow", "sp", [-1, 7]], ["unroll_kw", "ot", true]]}], "r": [[1.6379031479388158e-05], 0, 2.1430208683013916, 1579963973.4975533], "v": 0.1}
{"i": ["llvm -mcpu=cascadelake", "topi_x86_conv2d_NCHWc_int8", [["TENSOR", [1, 192, 16, 16], "uint8"], ["TENSOR", [192, 192, 3, 3], "int8"], [1, 1], [0, 0], [1, 1], "NCHW", "int32"], {}, ["conv2d", [1, 192, 16, 16, "uint8"], [192, 192, 3, 3, "int8"], [1, 1], [0, 0], [1, 1], "NCHW", "int32"], {"i": 122, "t": "direct", "c": null, "e": [["tile_ic", "sp", [-1, 12]], ["tile_oc", "sp", [-1, 16]], ["tile_ow", "sp", [-1, 7]], ["unroll_kw", "ot", true]]}], "r": [[1.9160021798789115e-05], 0, 2.4541547298431396, 1579964048.9282694], "v": 0.1}
{"i": ["llvm -mcpu=cascadelake", "topi_x86_conv2d_NCHWc_int8", [["TENSOR", [1, 128, 16, 16], "uint8"], ["TENSOR", [192, 128, 3, 3], "int8"], [2, 2], [0, 0], [1, 1], "NCHW", "int32"], {}, ["conv2d", [1, 128, 16, 16, "uint8"], [192, 128, 3, 3, "int8"], [2, 2], [0, 0], [1, 1], "NCHW", "int32"], {"i": 112, "t": "direct", "c": null, "e": [["tile_ic", "sp", [-1, 64]], ["tile_oc", "sp", [-1, 16]], ["tile_ow", "sp", [-1, 7]], ["unroll_kw", "ot", false]]}], "r": [[6.257767466564977e-06], 0, 3.3636324405670166, 1579965429.374102], "v": 0.1}
{"i": ["llvm -mcpu=cascadelake", "topi_x86_conv2d_NCHWc_int8", [["TENSOR", [1, 608, 14, 14], "uint8"], ["TENSOR", [192, 608, 1, 1], "int8"], [1, 1], [0, 0], [1, 1], "NCHW", "int32"], {}, ["conv2d", [1, 608, 14, 14, "uint8"], [192, 608, 1, 1, "int8"], [1, 1], [0, 0], [1, 1], "NCHW", "int32"], {"i": 145, "t": "direct", "c": null, "e": [["tile_ic", "sp", [-1, 8]], ["tile_oc", "sp", [-1, 16]], ["tile_ow", "sp", [-1, 14]], ["tile_oh", "ot", 1]]}], "r": [[9.179221197946117e-06], 0, 3.4270665645599365, 1579966113.1568139], "v": 0.1}
{"i": ["llvm -mcpu=cascadelake", "topi_x86_conv2d_NCHWc_int8", [["TENSOR", [1, 192, 16, 16], "uint8"], ["TENSOR", [256, 192, 3, 3], "int8"], [1, 1], [0, 0], [1, 1], "NCHW", "int32"], {}, ["conv2d", [1, 192, 16, 16, "uint8"], [256, 192, 3, 3, "int8"], [1, 1], [0, 0], [1, 1], "NCHW", "int32"], {"i": 102, "t": "direct", "c": null, "e": [["tile_ic", "sp", [-1, 12]], ["tile_oc", "sp", [-1, 16]], ["tile_ow", "sp", [-1, 7]], ["unroll_kw", "ot", true]]}], "r": [[2.6118951397980593e-05], 0, 2.6185338497161865, 1579966767.4053907], "v": 0.1}
{"i": ["llvm -mcpu=cascadelake", "topi_x86_conv2d_NCHWc_int8", [["TENSOR", [1, 256, 16, 16], "uint8"], ["TENSOR", [256, 256, 3, 3], "int8"], [2, 2], [0, 0], [1, 1], "NCHW", "int32"], {}, ["conv2d", [1, 256, 16, 16, "uint8"], [256, 256, 3, 3, "int8"], [2, 2], [0, 0], [1, 1], "NCHW", "int32"], {"i": 118, "t": "direct", "c": null, "e": [["tile_ic", "sp", [-1, 256]], ["tile_oc", "sp", [-1, 32]], ["tile_ow", "sp", [-1, 7]], ["unroll_kw", "ot", false]]}], "r": [[1.202976904158593e-05], 0, 3.471848964691162, 1579967535.6271074], "v": 0.1}
{"i": ["llvm -mcpu=cascadelake", "topi_x86_conv2d_NCHWc_int8", [["TENSOR", [1, 1056, 7, 7], "uint8"], ["TENSOR", [352, 1056, 1, 1], "int8"], [1, 1], [0, 0], [1, 1], "NCHW", "int32"], {}, ["conv2d", [1, 1056, 7, 7, "uint8"], [352, 1056, 1, 1, "int8"], [1, 1], [0, 0], [1, 1], "NCHW", "int32"], {"i": 71, "t": "direct", "c": null, "e": [["tile_ic", "sp", [-1, 48]], ["tile_oc", "sp", [-1, 16]], ["tile_ow", "sp", [-1, 7]], ["tile_oh", "ot", 1]]}], "r": [[8.477899512683403e-06], 0, 3.411741256713867, 1579968394.7706172], "v": 0.1}
{"i": ["llvm -mcpu=cascadelake", "topi_x86_conv2d_NCHWc_int8", [["TENSOR", [1, 1056, 7, 7], "uint8"], ["TENSOR", [192, 1056, 1, 1], "int8"], [1, 1], [0, 0], [1, 1], "NCHW", "int32"], {}, ["conv2d", [1, 1056, 7, 7, "uint8"], [192, 1056, 1, 1, "int8"], [1, 1], [0, 0], [1, 1], "NCHW", "int32"], {"i": 118, "t": "direct", "c": null, "e": [["tile_ic", "sp", [-1, 44]], ["tile_oc", "sp", [-1, 32]], ["tile_ow", "sp", [-1, 7]], ["tile_oh", "ot", 1]]}], "r": [[5.5706218825505435e-06], 0, 3.303215980529785, 1579968819.8421557], "v": 0.1}
{"i": ["llvm -mcpu=cascadelake", "topi_x86_conv2d_NCHWc_int8", [["TENSOR", [1, 192, 9, 9], "uint8"], ["TENSOR", [320, 192, 3, 3], "int8"], [1, 1], [0, 0], [1, 1], "NCHW", "int32"], {}, ["conv2d", [1, 192, 9, 9, "uint8"], [320, 192, 3, 3, "int8"], [1, 1], [0, 0], [1, 1], "NCHW", "int32"], {"i": 199, "t": "direct", "c": null, "e": [["tile_ic", "sp", [-1, 192]], ["tile_oc", "sp", [-1, 32]], ["tile_ow", "sp", [-1, 7]], ["unroll_kw", "ot", false]]}], "r": [[9.739925212615381e-06], 0, 3.539799451828003, 1579969527.3747642], "v": 0.1}
{"i": ["llvm -mcpu=cascadelake", "topi_x86_conv2d_NCHWc_int8", [["TENSOR", [1, 1056, 7, 7], "uint8"], ["TENSOR", [160, 1056, 1, 1], "int8"], [1, 1], [0, 0], [1, 1], "NCHW", "int32"], {}, ["conv2d", [1, 1056, 7, 7, "uint8"], [160, 1056, 1, 1, "int8"], [1, 1], [0, 0], [1, 1], "NCHW", "int32"], {"i": 75, "t": "direct", "c": null, "e": [["tile_ic", "sp", [-1, 176]], ["tile_oc", "sp", [-1, 16]], ["tile_ow", "sp", [-1, 7]], ["tile_oh", "ot", 1]]}], "r": [[5.248614176581496e-06], 0, 3.333256721496582, 1579970072.5022933], "v": 0.1}
{"i": ["llvm -mcpu=cascadelake", "topi_x86_conv2d_NCHWc_int8", [["TENSOR", [1, 160, 9, 9], "uint8"], ["TENSOR", [224, 160, 3, 3], "int8"], [1, 1], [0, 0], [1, 1], "NCHW", "int32"], {}, ["conv2d", [1, 160, 9, 9, "uint8"], [224, 160, 3, 3, "int8"], [1, 1], [0, 0], [1, 1], "NCHW", "int32"], {"i": 107, "t": "direct", "c": null, "e": [["tile_ic", "sp", [-1, 20]], ["tile_oc", "sp", [-1, 32]], ["tile_ow", "sp", [-1, 7]], ["unroll_kw", "ot", false]]}], "r": [[8.556667247940806e-06], 0, 3.4145259857177734, 1579970750.2370834], "v": 0.1}
{"i": ["llvm -mcpu=cascadelake", "topi_x86_conv2d_NCHWc_int8", [["TENSOR", [1, 224, 9, 9], "uint8"], ["TENSOR", [224, 224, 3, 3], "int8"], [1, 1], [0, 0], [1, 1], "NCHW", "int32"], {}, ["conv2d", [1, 224, 9, 9, "uint8"], [224, 224, 3, 3, "int8"], [1, 1], [0, 0], [1, 1], "NCHW", "int32"], {"i": 35, "t": "direct", "c": null, "e": [["tile_ic", "sp", [-1, 28]], ["tile_oc", "sp", [-1, 16]], ["tile_ow", "sp", [-1, 7]], ["unroll_kw", "ot", true]]}], "r": [[9.679149320752911e-06], 0, 3.4483959674835205, 1579970999.2859101], "v": 0.1}
{"i": ["llvm -mcpu=cascadelake", "topi_x86_conv2d_NCHWc_int8", [["TENSOR", [1, 1056, 7, 7], "uint8"], ["TENSOR", [128, 1056, 1, 1], "int8"], [1, 1], [0, 0], [1, 1], "NCHW", "int32"], {}, ["conv2d", [1, 1056, 7, 7, "uint8"], [128, 1056, 1, 1, "int8"], [1, 1], [0, 0], [1, 1], "NCHW", "int32"], {"i": 67, "t": "direct", "c": null, "e": [["tile_ic", "sp", [-1, 16]], ["tile_oc", "sp", [-1, 16]], ["tile_ow", "sp", [-1, 7]], ["tile_oh", "ot", 1]]}], "r": [[4.9249918224227826e-06], 0, 3.2943336963653564, 1579971679.5001705], "v": 0.1}
{"i": ["llvm -mcpu=cascadelake", "topi_x86_conv2d_NCHWc_int8", [["TENSOR", [1, 1024, 7, 7], "uint8"], ["TENSOR", [352, 1024, 1, 1], "int8"], [1, 1], [0, 0], [1, 1], "NCHW", "int32"], {}, ["conv2d", [1, 1024, 7, 7, "uint8"], [352, 1024, 1, 1, "int8"], [1, 1], [0, 0], [1, 1], "NCHW", "int32"], {"i": 113, "t": "direct", "c": null, "e": [["tile_ic", "sp", [-1, 128]], ["tile_oc", "sp", [-1, 16]], ["tile_ow", "sp", [-1, 7]], ["tile_oh", "ot", 2]]}], "r": [[7.972412380139365e-06], 0, 3.326080322265625, 1579972067.4220624], "v": 0.1}
{"i": ["llvm -mcpu=cascadelake", "topi_x86_conv2d_NCHWc_int8", [["TENSOR", [1, 1024, 7, 7], "uint8"], ["TENSOR", [192, 1024, 1, 1], "int8"], [1, 1], [0, 0], [1, 1], "NCHW", "int32"], {}, ["conv2d", [1, 1024, 7, 7, "uint8"], [192, 1024, 1, 1, "int8"], [1, 1], [0, 0], [1, 1], "NCHW", "int32"], {"i": 163, "t": "direct", "c": null, "e": [["tile_ic", "sp", [-1, 8]], ["tile_oc", "sp", [-1, 16]], ["tile_ow", "sp", [-1, 7]], ["tile_oh", "ot", 2]]}], "r": [[5.605335600344073e-06], 0, 3.3072004318237305, 1579972422.9738967], "v": 0.1}
{"i": ["llvm -mcpu=cascadelake", "topi_x86_conv2d_NCHWc_int8", [["TENSOR", [1, 192, 9, 9], "uint8"], ["TENSOR", [224, 192, 3, 3], "int8"], [1, 1], [0, 0], [1, 1], "NCHW", "int32"], {}, ["conv2d", [1, 192, 9, 9, "uint8"], [224, 192, 3, 3, "int8"], [1, 1], [0, 0], [1, 1], "NCHW", "int32"], {"i": 46, "t": "direct", "c": null, "e": [["tile_ic", "sp", [-1, 48]], ["tile_oc", "sp", [-1, 16]], ["tile_ow", "sp", [-1, 7]], ["unroll_kw", "ot", true]]}], "r": [[8.644628411077473e-06], 0, 3.4142963886260986, 1579972875.2610297], "v": 0.1}
{"i": ["llvm -mcpu=cascadelake", "topi_x86_conv2d_NCHWc_int8", [["TENSOR", [1, 1024, 7, 7], "uint8"], ["TENSOR", [128, 1024, 1, 1], "int8"], [1, 1], [0, 0], [1, 1], "NCHW", "int32"], {}, ["conv2d", [1, 1024, 7, 7, "uint8"], [128, 1024, 1, 1, "int8"], [1, 1], [0, 0], [1, 1], "NCHW", "int32"], {"i": 113, "t": "direct", "c": null, "e": [["tile_ic", "sp", [-1, 128]], ["tile_oc", "sp", [-1, 16]], ["tile_ow", "sp", [-1, 7]], ["tile_oh", "ot", 2]]}], "r": [[5.358194676651282e-06], 0, 3.2622945308685303, 1579973375.1701565], "v": 0.1}
