scripts_paper/tuned_logs_g4/imagenet1k-resnet-152-quantized-5batches-naive-symbol.log
{"i": ["cuda", "topi_nn_conv2d", [["TENSOR", [1, 512, 9, 9], "int8"], ["TENSOR", [512, 512, 3, 3], "int8"], [1, 1], [0, 0], [1, 1], "NCHW", "int32"], {}, ["conv2d", [1, 512, 9, 9, "int8"], [512, 512, 3, 3, "int8"], [1, 1], [0, 0], [1, 1], "NCHW", "int32"], {"i": 421241, "t": "winograd", "c": null, "e": [["tile_b", "sp", [-1, 1, 1, 1]], ["tile_y", "sp", [-1, 1, 32, 8]], ["tile_x", "sp", [-1, 1, 8, 2]], ["tile_rc", "sp", [-1, 16]], ["auto_unroll_max_step", "ot", 1500], ["unroll_explicit", "ot", 1]]}], "r": [[7.875867929423975e-05], 0, 2.1628668308258057, 1581587619.3069816], "v": 0.1}
{"i": ["cuda", "topi_nn_conv2d", [["TENSOR", [1, 2048, 7, 7], "int8"], ["TENSOR", [512, 2048, 1, 1], "int8"], [1, 1], [0, 0], [1, 1], "NCHW", "int32"], {}, ["conv2d", [1, 2048, 7, 7, "int8"], [512, 2048, 1, 1, "int8"], [1, 1], [0, 0], [1, 1], "NCHW", "int32"], {"i": 1659135, "t": "int8", "c": null, "e": [["tile_n", "sp", [-1, 1, 1, 1]], ["tile_f", "sp", [-1, 1, 4, 1]], ["tile_y", "sp", [-1, 1, 7, 1]], ["tile_x", "sp", [-1, 1, 1, 1]], ["fuse_yx", "ot", 0], ["tile_rc", "sp", [-1, 4]], ["tile_ry", "sp", [-1, 1]], ["tile_rx", "sp", [-1, 1]], ["reorder_inner", "re", [0, 2, 1]], ["AA_double_buffer", "ot", 1], ["WW_double_buffer", "ot", 1], ["auto_unroll_max_step", "ot", 512]]}], "r": [[3.81056206732296e-05], 0, 1.797461986541748, 1581591812.3974888], "v": 0.1}
{"i": ["cuda", "topi_nn_conv2d", [["TENSOR", [1, 512, 7, 7], "int8"], ["TENSOR", [2048, 512, 1, 1], "int8"], [1, 1], [0, 0], [1, 1], "NCHW", "int32"], {}, ["conv2d", [1, 512, 7, 7, "int8"], [2048, 512, 1, 1, "int8"], [1, 1], [0, 0], [1, 1], "NCHW", "int32"], {"i": 2392282, "t": "int8", "c": null, "e": [["tile_n", "sp", [-1, 1, 1, 1]], ["tile_f", "sp", [-1, 4, 1, 1]], ["tile_y", "sp", [-1, 1, 7, 1]], ["tile_x", "sp", [-1, 1, 7, 1]], ["fuse_yx", "ot", 1], ["tile_rc", "sp", [-1, 8]], ["tile_ry", "sp", [-1, 1]], ["tile_rx", "sp", [-1, 1]], ["reorder_inner", "re", [0, 1, 2]], ["AA_double_buffer", "ot", 1], ["WW_double_buffer", "ot", 1], ["auto_unroll_max_step", "ot", 512]]}], "r": [[1.7095933637615012e-05], 0, 1.9276232719421387, 1581600247.4647532], "v": 0.1}
{"i": ["cuda", "topi_nn_conv2d", [["TENSOR", [1, 1024, 14, 14], "int8"], ["TENSOR", [2048, 1024, 1, 1], "int8"], [2, 2], [0, 0], [1, 1], "NCHW", "int32"], {}, ["conv2d", [1, 1024, 14, 14, "int8"], [2048, 1024, 1, 1, "int8"], [2, 2], [0, 0], [1, 1], "NCHW", "int32"], {"i": 1477101, "t": "int8", "c": null, "e": [["tile_n", "sp", [-1, 1, 1, 1]], ["tile_f", "sp", [-1, 4, 4, 1]], ["tile_y", "sp", [-1, 1, 7, 1]], ["tile_x", "sp", [-1, 1, 7, 1]], ["fuse_yx", "ot", 1], ["tile_rc", "sp", [-1, 4]], ["tile_ry", "sp", [-1, 1]], ["tile_rx", "sp", [-1, 1]], ["reorder_inner", "re", [2, 1, 0]], ["AA_double_buffer", "ot", 1], ["WW_double_buffer", "ot", 1], ["auto_unroll_max_step", "ot", 0]]}], "r": [[4.256344499733428e-05], 0, 2.1467409133911133, 1581605297.663779], "v": 0.1}
{"i": ["cuda", "topi_nn_conv2d", [["TENSOR", [1, 512, 16, 16], "int8"], ["TENSOR", [512, 512, 3, 3], "int8"], [2, 2], [0, 0], [1, 1], "NCHW", "int32"], {}, ["conv2d", [1, 512, 16, 16, "int8"], [512, 512, 3, 3, "int8"], [2, 2], [0, 0], [1, 1], "NCHW", "int32"], {"i": 8209264, "t": "int8", "c": null, "e": [["tile_n", "sp", [-1, 1, 1, 1]], ["tile_f", "sp", [-1, 1, 1, 4]], ["tile_y", "sp", [-1, 1, 7, 1]], ["tile_x", "sp", [-1, 1, 7, 1]], ["fuse_yx", "ot", 1], ["tile_rc", "sp", [-1, 2]], ["tile_ry", "sp", [-1, 3]], ["tile_rx", "sp", [-1, 3]], ["reorder_inner", "re", [0, 1, 2]], ["AA_double_buffer", "ot", 1], ["WW_double_buffer", "ot", 1], ["auto_unroll_max_step", "ot", 1500]]}], "r": [[4.9645480229461174e-05], 0, 2.4851486682891846, 1581610526.2776752], "v": 0.1}
{"i": ["cuda", "topi_nn_conv2d", [["TENSOR", [1, 1024, 14, 14], "int8"], ["TENSOR", [512, 1024, 1, 1], "int8"], [1, 1], [0, 0], [1, 1], "NCHW", "int32"], {}, ["conv2d", [1, 1024, 14, 14, "int8"], [512, 1024, 1, 1, "int8"], [1, 1], [0, 0], [1, 1], "NCHW", "int32"], {"i": 16856470, "t": "int8", "c": null, "e": [["tile_n", "sp", [-1, 1, 1, 1]], ["tile_f", "sp", [-1, 1, 2, 4]], ["tile_y", "sp", [-1, 1, 7, 1]], ["tile_x", "sp", [-1, 1, 7, 2]], ["fuse_yx", "ot", 0], ["tile_rc", "sp", [-1, 16]], ["tile_ry", "sp", [-1, 1]], ["tile_rx", "sp", [-1, 1]], ["reorder_inner", "re", [0, 1, 2]], ["AA_double_buffer", "ot", 1], ["WW_double_buffer", "ot", 0], ["auto_unroll_max_step", "ot", 512]]}], "r": [[2.657756891787333e-05], 0, 2.277203321456909, 1581624159.6131546], "v": 0.1}
{"i": ["cuda", "topi_nn_conv2d", [["TENSOR", [1, 256, 16, 16], "int8"], ["TENSOR", [256, 256, 3, 3], "int8"], [1, 1], [0, 0], [1, 1], "NCHW", "int32"], {}, ["conv2d", [1, 256, 16, 16, "int8"], [256, 256, 3, 3, "int8"], [1, 1], [0, 0], [1, 1], "NCHW", "int32"], {"i": 281304, "t": "winograd", "c": null, "e": [["tile_b", "sp", [-1, 1, 1, 1]], ["tile_y", "sp", [-1, 1, 16, 16]], ["tile_x", "sp", [-1, 1, 8, 2]], ["tile_rc", "sp", [-1, 8]], ["auto_unroll_max_step", "ot", 1500], ["unroll_explicit", "ot", 1]]}], "r": [[5.46926186396677e-05], 0, 3.9390180110931396, 1581631175.961334], "v": 0.1}
{"i": ["cuda", "topi_nn_conv2d", [["TENSOR", [1, 1024, 14, 14], "int8"], ["TENSOR", [256, 1024, 1, 1], "int8"], [1, 1], [0, 0], [1, 1], "NCHW", "int32"], {}, ["conv2d", [1, 1024, 14, 14, "int8"], [256, 1024, 1, 1, "int8"], [1, 1], [0, 0], [1, 1], "NCHW", "int32"], {"i": 26916826, "t": "int8", "c": null, "e": [["tile_n", "sp", [-1, 1, 1, 1]], ["tile_f", "sp", [-1, 1, 2, 2]], ["tile_y", "sp", [-1, 1, 7, 1]], ["tile_x", "sp", [-1, 1, 7, 2]], ["fuse_yx", "ot", 1], ["tile_rc", "sp", [-1, 16]], ["tile_ry", "sp", [-1, 1]], ["tile_rx", "sp", [-1, 1]], ["reorder_inner", "re", [1, 2, 0]], ["AA_double_buffer", "ot", 1], ["WW_double_buffer", "ot", 1], ["auto_unroll_max_step", "ot", 1500]]}], "r": [[1.7284718686428365e-05], 0, 2.558969736099243, 1581641300.187896], "v": 0.1}
{"i": ["cuda", "topi_nn_conv2d", [["TENSOR", [1, 256, 14, 14], "int8"], ["TENSOR", [1024, 256, 1, 1], "int8"], [1, 1], [0, 0], [1, 1], "NCHW", "int32"], {}, ["conv2d", [1, 256, 14, 14, "int8"], [1024, 256, 1, 1, "int8"], [1, 1], [0, 0], [1, 1], "NCHW", "int32"], {"i": 27393963, "t": "int8", "c": null, "e": [["tile_n", "sp", [-1, 1, 1, 1]], ["tile_f", "sp", [-1, 8, 1, 1]], ["tile_y", "sp", [-1, 1, 14, 1]], ["tile_x", "sp", [-1, 1, 14, 1]], ["fuse_yx", "ot", 0], ["tile_rc", "sp", [-1, 4]], ["tile_ry", "sp", [-1, 1]], ["tile_rx", "sp", [-1, 1]], ["reorder_inner", "re", [2, 0, 1]], ["AA_double_buffer", "ot", 1], ["WW_double_buffer", "ot", 1], ["auto_unroll_max_step", "ot", 512]]}], "r": [[1.4106080213582914e-05], 0, 2.4696803092956543, 1581648785.222358], "v": 0.1}
{"i": ["cuda", "topi_nn_conv2d", [["TENSOR", [1, 512, 28, 28], "int8"], ["TENSOR", [1024, 512, 1, 1], "int8"], [2, 2], [0, 0], [1, 1], "NCHW", "int32"], {}, ["conv2d", [1, 512, 28, 28, "int8"], [1024, 512, 1, 1, "int8"], [2, 2], [0, 0], [1, 1], "NCHW", "int32"], {"i": 27266922, "t": "int8", "c": null, "e": [["tile_n", "sp", [-1, 1, 1, 1]], ["tile_f", "sp", [-1, 8, 2, 1]], ["tile_y", "sp", [-1, 1, 7, 1]], ["tile_x", "sp", [-1, 1, 14, 1]], ["fuse_yx", "ot", 1], ["tile_rc", "sp", [-1, 4]], ["tile_ry", "sp", [-1, 1]], ["tile_rx", "sp", [-1, 1]], ["reorder_inner", "re", [2, 0, 1]], ["AA_double_buffer", "ot", 0], ["WW_double_buffer", "ot", 1], ["auto_unroll_max_step", "ot", 512]]}], "r": [[3.390746422438466e-05], 0, 2.1889262199401855, 1581662141.493394], "v": 0.1}
{"i": ["cuda", "topi_nn_conv2d", [["TENSOR", [1, 256, 30, 30], "int8"], ["TENSOR", [256, 256, 3, 3], "int8"], [2, 2], [0, 0], [1, 1], "NCHW", "int32"], {}, ["conv2d", [1, 256, 30, 30, "int8"], [256, 256, 3, 3, "int8"], [2, 2], [0, 0], [1, 1], "NCHW", "int32"], {"i": 80461786, "t": "int8", "c": null, "e": [["tile_n", "sp", [-1, 1, 1, 1]], ["tile_f", "sp", [-1, 1, 2, 2]], ["tile_y", "sp", [-1, 1, 7, 1]], ["tile_x", "sp", [-1, 1, 7, 2]], ["fuse_yx", "ot", 1], ["tile_rc", "sp", [-1, 2]], ["tile_ry", "sp", [-1, 3]], ["tile_rx", "sp", [-1, 3]], ["reorder_inner", "re", [0, 1, 2]], ["AA_double_buffer", "ot", 1], ["WW_double_buffer", "ot", 1], ["auto_unroll_max_step", "ot", 1500]]}], "r": [[3.3176127017250974e-05], 0, 2.7135095596313477, 1581669881.344808], "v": 0.1}
{"i": ["cuda", "topi_nn_conv2d", [["TENSOR", [1, 512, 28, 28], "int8"], ["TENSOR", [256, 512, 1, 1], "int8"], [1, 1], [0, 0], [1, 1], "NCHW", "int32"], {}, ["conv2d", [1, 512, 28, 28, "int8"], [256, 512, 1, 1, "int8"], [1, 1], [0, 0], [1, 1], "NCHW", "int32"], {"i": 147491603, "t": "int8", "c": null, "e": [["tile_n", "sp", [-1, 1, 1, 1]], ["tile_f", "sp", [-1, 2, 2, 2]], ["tile_y", "sp", [-1, 1, 7, 1]], ["tile_x", "sp", [-1, 2, 14, 1]], ["fuse_yx", "ot", 1], ["tile_rc", "sp", [-1, 16]], ["tile_ry", "sp", [-1, 1]], ["tile_rx", "sp", [-1, 1]], ["reorder_inner", "re", [1, 0, 2]], ["AA_double_buffer", "ot", 1], ["WW_double_buffer", "ot", 1], ["auto_unroll_max_step", "ot", 1500]]}], "r": [[2.2911435780705153e-05], 0, 2.756286144256592, 1581679887.376856], "v": 0.1}
{"i": ["cuda", "topi_nn_conv2d", [["TENSOR", [1, 128, 30, 30], "int8"], ["TENSOR", [128, 128, 3, 3], "int8"], [1, 1], [0, 0], [1, 1], "NCHW", "int32"], {}, ["conv2d", [1, 128, 30, 30, "int8"], [128, 128, 3, 3, "int8"], [1, 1], [0, 0], [1, 1], "NCHW", "int32"], {"i": 531219, "t": "winograd", "c": null, "e": [["tile_b", "sp", [-1, 1, 1, 1]], ["tile_y", "sp", [-1, 1, 16, 8]], ["tile_x", "sp", [-1, 7, 14, 1]], ["tile_rc", "sp", [-1, 16]], ["auto_unroll_max_step", "ot", 1500], ["unroll_explicit", "ot", 1]]}], "r": [[4.2661616883116885e-05], 0, 3.268312931060791, 1581687685.6292527], "v": 0.1}
{"i": ["cuda", "topi_nn_conv2d", [["TENSOR", [1, 512, 28, 28], "int8"], ["TENSOR", [128, 512, 1, 1], "int8"], [1, 1], [0, 0], [1, 1], "NCHW", "int32"], {}, ["conv2d", [1, 512, 28, 28, "int8"], [128, 512, 1, 1, "int8"], [1, 1], [0, 0], [1, 1], "NCHW", "int32"], {"i": 66720983, "t": "int8", "c": null, "e": [["tile_n", "sp", [-1, 1, 1, 1]], ["tile_f", "sp", [-1, 2, 2, 1]], ["tile_y", "sp", [-1, 1, 2, 1]], ["tile_x", "sp", [-1, 1, 14, 2]], ["fuse_yx", "ot", 0], ["tile_rc", "sp", [-1, 16]], ["tile_ry", "sp", [-1, 1]], ["tile_rx", "sp", [-1, 1]], ["reorder_inner", "re", [2, 0, 1]], ["AA_double_buffer", "ot", 1], ["WW_double_buffer", "ot", 1], ["auto_unroll_max_step", "ot", 512]]}], "r": [[1.368586826804487e-05], 0, 2.2384233474731445, 1581695846.5509076], "v": 0.1}
{"i": ["cuda", "topi_nn_conv2d", [["TENSOR", [1, 128, 28, 28], "int8"], ["TENSOR", [512, 128, 1, 1], "int8"], [1, 1], [0, 0], [1, 1], "NCHW", "int32"], {}, ["conv2d", [1, 128, 28, 28, "int8"], [512, 128, 1, 1, "int8"], [1, 1], [0, 0], [1, 1], "NCHW", "int32"], {"i": 117204889, "t": "int8", "c": null, "e": [["tile_n", "sp", [-1, 1, 1, 1]], ["tile_f", "sp", [-1, 1, 4, 2]], ["tile_y", "sp", [-1, 1, 1, 4]], ["tile_x", "sp", [-1, 1, 28, 1]], ["fuse_yx", "ot", 0], ["tile_rc", "sp", [-1, 32]], ["tile_ry", "sp", [-1, 1]], ["tile_rx", "sp", [-1, 1]], ["reorder_inner", "re", [1, 0, 2]], ["AA_double_buffer", "ot", 0], ["WW_double_buffer", "ot", 0], ["auto_unroll_max_step", "ot", 1500]]}], "r": [[1.0236471983761153e-05], 0, 3.0586318969726562, 1581721928.3141475], "v": 0.1}
{"i": ["cuda", "topi_nn_conv2d", [["TENSOR", [1, 256, 56, 56], "int8"], ["TENSOR", [512, 256, 1, 1], "int8"], [2, 2], [0, 0], [1, 1], "NCHW", "int32"], {}, ["conv2d", [1, 256, 56, 56, "int8"], [512, 256, 1, 1, "int8"], [2, 2], [0, 0], [1, 1], "NCHW", "int32"], {"i": 173267839, "t": "int8", "c": null, "e": [["tile_n", "sp", [-1, 1, 1, 1]], ["tile_f", "sp", [-1, 1, 8, 4]], ["tile_y", "sp", [-1, 1, 1, 2]], ["tile_x", "sp", [-1, 1, 28, 1]], ["fuse_yx", "ot", 0], ["tile_rc", "sp", [-1, 8]], ["tile_ry", "sp", [-1, 1]], ["tile_rx", "sp", [-1, 1]], ["reorder_inner", "re", [2, 0, 1]], ["AA_double_buffer", "ot", 0], ["WW_double_buffer", "ot", 1], ["auto_unroll_max_step", "ot", 1500]]}], "r": [[2.442005722014149e-05], 0, 2.450122833251953, 1581729680.0614605], "v": 0.1}
{"i": ["cuda", "topi_nn_conv2d", [["TENSOR", [1, 128, 58, 58], "int8"], ["TENSOR", [128, 128, 3, 3], "int8"], [2, 2], [0, 0], [1, 1], "NCHW", "int32"], {}, ["conv2d", [1, 128, 58, 58, "int8"], [128, 128, 3, 3, "int8"], [2, 2], [0, 0], [1, 1], "NCHW", "int32"], {"i": 235683127, "t": "int8", "c": null, "e": [["tile_n", "sp", [-1, 1, 1, 1]], ["tile_f", "sp", [-1, 1, 8, 1]], ["tile_y", "sp", [-1, 1, 1, 4]], ["tile_x", "sp", [-1, 1, 14, 1]], ["fuse_yx", "ot", 0], ["tile_rc", "sp", [-1, 2]], ["tile_ry", "sp", [-1, 3]], ["tile_rx", "sp", [-1, 3]], ["reorder_inner", "re", [0, 1, 2]], ["AA_double_buffer", "ot", 1], ["WW_double_buffer", "ot", 0], ["auto_unroll_max_step", "ot", 1500]]}], "r": [[2.2847526398276032e-05], 0, 2.880186080932617, 1581744401.2686825], "v": 0.1}
{"i": ["cuda", "topi_nn_conv2d", [["TENSOR", [1, 256, 56, 56], "int8"], ["TENSOR", [128, 256, 1, 1], "int8"], [1, 1], [0, 0], [1, 1], "NCHW", "int32"], {}, ["conv2d", [1, 256, 56, 56, "int8"], [128, 256, 1, 1, "int8"], [1, 1], [0, 0], [1, 1], "NCHW", "int32"], {"i": 128438840, "t": "int8", "c": null, "e": [["tile_n", "sp", [-1, 1, 1, 1]], ["tile_f", "sp", [-1, 1, 2, 4]], ["tile_y", "sp", [-1, 1, 1, 2]], ["tile_x", "sp", [-1, 1, 56, 1]], ["fuse_yx", "ot", 0], ["tile_rc", "sp", [-1, 16]], ["tile_ry", "sp", [-1, 1]], ["tile_rx", "sp", [-1, 1]], ["reorder_inner", "re", [0, 2, 1]], ["AA_double_buffer", "ot", 0], ["WW_double_buffer", "ot", 0], ["auto_unroll_max_step", "ot", 512]]}], "r": [[1.7481072553805192e-05], 0, 2.295192241668701, 1581754759.2636435], "v": 0.1}
{"i": ["cuda", "topi_nn_conv2d", [["TENSOR", [1, 256, 56, 56], "int8"], ["TENSOR", [64, 256, 1, 1], "int8"], [1, 1], [0, 0], [1, 1], "NCHW", "int32"], {}, ["conv2d", [1, 256, 56, 56, "int8"], [64, 256, 1, 1, "int8"], [1, 1], [0, 0], [1, 1], "NCHW", "int32"], {"i": 162258278, "t": "int8", "c": null, "e": [["tile_n", "sp", [-1, 1, 1, 1]], ["tile_f", "sp", [-1, 1, 2, 4]], ["tile_y", "sp", [-1, 1, 1, 2]], ["tile_x", "sp", [-1, 1, 56, 1]], ["fuse_yx", "ot", 0], ["tile_rc", "sp", [-1, 32]], ["tile_ry", "sp", [-1, 1]], ["tile_rx", "sp", [-1, 1]], ["reorder_inner", "re", [1, 2, 0]], ["AA_double_buffer", "ot", 0], ["WW_double_buffer", "ot", 0], ["auto_unroll_max_step", "ot", 1500]]}], "r": [[1.0860495321557351e-05], 0, 3.2757785320281982, 1581764489.7432442], "v": 0.1}
{"i": ["cuda", "topi_nn_conv2d", [["TENSOR", [1, 64, 56, 56], "int8"], ["TENSOR", [256, 64, 1, 1], "int8"], [1, 1], [0, 0], [1, 1], "NCHW", "int32"], {}, ["conv2d", [1, 64, 56, 56, "int8"], [256, 64, 1, 1, "int8"], [1, 1], [0, 0], [1, 1], "NCHW", "int32"], {"i": 57722166, "t": "int8", "c": null, "e": [["tile_n", "sp", [-1, 1, 1, 1]], ["tile_f", "sp", [-1, 1, 2, 4]], ["tile_y", "sp", [-1, 1, 1, 4]], ["tile_x", "sp", [-1, 1, 56, 1]], ["fuse_yx", "ot", 1], ["tile_rc", "sp", [-1, 8]], ["tile_ry", "sp", [-1, 1]], ["tile_rx", "sp", [-1, 1]], ["reorder_inner", "re", [2, 0, 1]], ["AA_double_buffer", "ot", 1], ["WW_double_buffer", "ot", 0], ["auto_unroll_max_step", "ot", 0]]}], "r": [[1.22154964511041e-05], 0, 1.8837480545043945, 1581774289.444896], "v": 0.1}
{"i": ["cuda", "topi_nn_conv2d", [["TENSOR", [1, 64, 58, 58], "int8"], ["TENSOR", [64, 64, 3, 3], "int8"], [1, 1], [0, 0], [1, 1], "NCHW", "int32"], {}, ["conv2d", [1, 64, 58, 58, "int8"], [64, 64, 3, 3, "int8"], [1, 1], [0, 0], [1, 1], "NCHW", "int32"], {"i": 1123557, "t": "winograd", "c": null, "e": [["tile_b", "sp", [-1, 1, 1, 1]], ["tile_y", "sp", [-1, 8, 2, 4]], ["tile_x", "sp", [-1, 2, 56, 1]], ["tile_rc", "sp", [-1, 8]], ["auto_unroll_max_step", "ot", 1500], ["unroll_explicit", "ot", 1]]}], "r": [[5.564595341159208e-05], 0, 2.682401180267334, 1581780885.6062467], "v": 0.1}
{"i": ["cuda", "topi_nn_conv2d", [["TENSOR", [1, 64, 56, 56], "int8"], ["TENSOR", [64, 64, 1, 1], "int8"], [1, 1], [0, 0], [1, 1], "NCHW", "int32"], {}, ["conv2d", [1, 64, 56, 56, "int8"], [64, 64, 1, 1, "int8"], [1, 1], [0, 0], [1, 1], "NCHW", "int32"], {"i": 62130278, "t": "int8", "c": null, "e": [["tile_n", "sp", [-1, 1, 1, 1]], ["tile_f", "sp", [-1, 1, 2, 4]], ["tile_y", "sp", [-1, 1, 1, 2]], ["tile_x", "sp", [-1, 1, 56, 1]], ["fuse_yx", "ot", 1], ["tile_rc", "sp", [-1, 8]], ["tile_ry", "sp", [-1, 1]], ["tile_rx", "sp", [-1, 1]], ["reorder_inner", "re", [1, 2, 0]], ["AA_double_buffer", "ot", 0], ["WW_double_buffer", "ot", 0], ["auto_unroll_max_step", "ot", 512]]}], "r": [[4.648312114084093e-06], 0, 1.9812493324279785, 1581791733.8736997], "v": 0.1}
{"i": ["cuda", "topi_nn_conv2d", [["TENSOR", [1, 3, 230, 230], "int8"], ["TENSOR", [64, 3, 7, 7], "int8"], [2, 2], [0, 0], [1, 1], "NCHW", "int32"], {}, ["conv2d", [1, 3, 230, 230, "int8"], [64, 3, 7, 7, "int8"], [2, 2], [0, 0], [1, 1], "NCHW", "int32"], {"i": 78235405, "t": "direct", "c": null, "e": [["tile_f", "sp", [-1, 1, 8, 8]], ["tile_y", "sp", [-1, 1, 1, 7]], ["tile_x", "sp", [-1, 1, 28, 2]], ["tile_rc", "sp", [-1, 3]], ["tile_ry", "sp", [-1, 7]], ["tile_rx", "sp", [-1, 7]], ["auto_unroll_max_step", "ot", 1500], ["unroll_explicit", "ot", 1]]}], "r": [[3.034598829305136e-05], 0, 3.869424819946289, 1581806667.4550736], "v": 0.1}
{"i": ["llvm -mcpu=cascadelake", "topi_x86_conv2d_NCHWc_int8", [["TENSOR", [1, 4, 230, 230], "uint8"], ["TENSOR", [64, 4, 7, 7], "int8"], [2, 2], [0, 0], [1, 1], "NCHW", "int32"], {}, ["conv2d", [1, 4, 230, 230, "uint8"], [64, 4, 7, 7, "int8"], [2, 2], [0, 0], [1, 1], "NCHW", "int32"], {"i": 6, "t": "direct", "c": null, "e": [["tile_ic", "sp", [-1, 4]], ["tile_oc", "sp", [-1, 16]], ["tile_ow", "sp", [-1, 4]], ["unroll_kw", "ot", true]]}], "r": [[4.4320648206150345e-05], 0, 2.8936100006103516, 1580024811.489318], "v": 0.1}
{"i": ["llvm -mcpu=cascadelake", "topi_x86_conv2d_NCHWc_int8", [["TENSOR", [1, 64, 56, 56], "uint8"], ["TENSOR", [64, 64, 1, 1], "int8"], [1, 1], [0, 0], [1, 1], "NCHW", "int32"], {}, ["conv2d", [1, 64, 56, 56, "uint8"], [64, 64, 1, 1, "int8"], [1, 1], [0, 0], [1, 1], "NCHW", "int32"], {"i": 123, "t": "direct", "c": null, "e": [["tile_ic", "sp", [-1, 32]], ["tile_oc", "sp", [-1, 16]], ["tile_ow", "sp", [-1, 1]], ["tile_oh", "ot", 2]]}], "r": [[7.28085008698382e-06], 0, 2.0913071632385254, 1580025192.137698], "v": 0.1}
{"i": ["llvm -mcpu=cascadelake", "topi_x86_conv2d_NCHWc_int8", [["TENSOR", [1, 64, 58, 58], "uint8"], ["TENSOR", [64, 64, 3, 3], "int8"], [1, 1], [0, 0], [1, 1], "NCHW", "int32"], {}, ["conv2d", [1, 64, 58, 58, "uint8"], [64, 64, 3, 3, "int8"], [1, 1], [0, 0], [1, 1], "NCHW", "int32"], {"i": 37, "t": "direct", "c": null, "e": [["tile_ic", "sp", [-1, 16]], ["tile_oc", "sp", [-1, 32]], ["tile_ow", "sp", [-1, 4]], ["unroll_kw", "ot", true]]}], "r": [[3.388669034210119e-05], 0, 2.8281919956207275, 1580025572.0057197], "v": 0.1}
{"i": ["llvm -mcpu=cascadelake", "topi_x86_conv2d_NCHWc_int8", [["TENSOR", [1, 64, 56, 56], "uint8"], ["TENSOR", [256, 64, 1, 1], "int8"], [1, 1], [0, 0], [1, 1], "NCHW", "int32"], {}, ["conv2d", [1, 64, 56, 56, "uint8"], [256, 64, 1, 1, "int8"], [1, 1], [0, 0], [1, 1], "NCHW", "int32"], {"i": 29, "t": "direct", "c": null, "e": [["tile_ic", "sp", [-1, 64]], ["tile_oc", "sp", [-1, 16]], ["tile_ow", "sp", [-1, 2]], ["tile_oh", "ot", 1]]}], "r": [[2.004737515665945e-05], 0, 2.56368088722229, 1580026694.3638427], "v": 0.1}
{"i": ["llvm -mcpu=cascadelake", "topi_x86_conv2d_NCHWc_int8", [["TENSOR", [1, 256, 56, 56], "uint8"], ["TENSOR", [64, 256, 1, 1], "int8"], [1, 1], [0, 0], [1, 1], "NCHW", "int32"], {}, ["conv2d", [1, 256, 56, 56, "uint8"], [64, 256, 1, 1, "int8"], [1, 1], [0, 0], [1, 1], "NCHW", "int32"], {"i": 234, "t": "direct", "c": null, "e": [["tile_ic", "sp", [-1, 32]], ["tile_oc", "sp", [-1, 16]], ["tile_ow", "sp", [-1, 7]], ["tile_oh", "ot", 2]]}], "r": [[1.8405736491096168e-05], 0, 2.5006844997406006, 1580027745.980114], "v": 0.1}
{"i": ["llvm -mcpu=cascadelake", "topi_x86_conv2d_NCHWc_int8", [["TENSOR", [1, 256, 56, 56], "uint8"], ["TENSOR", [128, 256, 1, 1], "int8"], [1, 1], [0, 0], [1, 1], "NCHW", "int32"], {}, ["conv2d", [1, 256, 56, 56, "uint8"], [128, 256, 1, 1, "int8"], [1, 1], [0, 0], [1, 1], "NCHW", "int32"], {"i": 173, "t": "direct", "c": null, "e": [["tile_ic", "sp", [-1, 128]], ["tile_oc", "sp", [-1, 16]], ["tile_ow", "sp", [-1, 28]], ["tile_oh", "ot", 1]]}], "r": [[3.270123418638339e-05], 0, 2.803572654724121, 1580028280.7105694], "v": 0.1}
{"i": ["llvm -mcpu=cascadelake", "topi_x86_conv2d_NCHWc_int8", [["TENSOR", [1, 128, 58, 58], "uint8"], ["TENSOR", [128, 128, 3, 3], "int8"], [2, 2], [0, 0], [1, 1], "NCHW", "int32"], {}, ["conv2d", [1, 128, 58, 58, "uint8"], [128, 128, 3, 3, "int8"], [2, 2], [0, 0], [1, 1], "NCHW", "int32"], {"i": 200, "t": "direct", "c": null, "e": [["tile_ic", "sp", [-1, 16]], ["tile_oc", "sp", [-1, 32]], ["tile_ow", "sp", [-1, 4]], ["unroll_kw", "ot", false]]}], "r": [[3.5506553922934073e-05], 0, 2.7742059230804443, 1580029558.3448632], "v": 0.1}
{"i": ["llvm -mcpu=cascadelake", "topi_x86_conv2d_NCHWc_int8", [["TENSOR", [1, 256, 56, 56], "uint8"], ["TENSOR", [512, 256, 1, 1], "int8"], [2, 2], [0, 0], [1, 1], "NCHW", "int32"], {}, ["conv2d", [1, 256, 56, 56, "uint8"], [512, 256, 1, 1, "int8"], [2, 2], [0, 0], [1, 1], "NCHW", "int32"], {"i": 180, "t": "direct", "c": null, "e": [["tile_ic", "sp", [-1, 128]], ["tile_oc", "sp", [-1, 32]], ["tile_ow", "sp", [-1, 14]], ["tile_oh", "ot", 1]]}], "r": [[3.1943913110309344e-05], 0, 2.8320605754852295, 1580030669.974551], "v": 0.1}
{"i": ["llvm -mcpu=cascadelake", "topi_x86_conv2d_NCHWc_int8", [["TENSOR", [1, 128, 28, 28], "uint8"], ["TENSOR", [512, 128, 1, 1], "int8"], [1, 1], [0, 0], [1, 1], "NCHW", "int32"], {}, ["conv2d", [1, 128, 28, 28, "uint8"], [512, 128, 1, 1, "int8"], [1, 1], [0, 0], [1, 1], "NCHW", "int32"], {"i": 114, "t": "direct", "c": null, "e": [["tile_ic", "sp", [-1, 4]], ["tile_oc", "sp", [-1, 32]], ["tile_ow", "sp", [-1, 7]], ["tile_oh", "ot", 1]]}], "r": [[1.9106259613371484e-05], 0, 2.529520273208618, 1580031821.3940957], "v": 0.1}
{"i": ["llvm -mcpu=cascadelake", "topi_x86_conv2d_NCHWc_int8", [["TENSOR", [1, 512, 28, 28], "uint8"], ["TENSOR", [128, 512, 1, 1], "int8"], [1, 1], [0, 0], [1, 1], "NCHW", "int32"], {}, ["conv2d", [1, 512, 28, 28, "uint8"], [128, 512, 1, 1, "int8"], [1, 1], [0, 0], [1, 1], "NCHW", "int32"], {"i": 109, "t": "direct", "c": null, "e": [["tile_ic", "sp", [-1, 128]], ["tile_oc", "sp", [-1, 32]], ["tile_ow", "sp", [-1, 7]], ["tile_oh", "ot", 1]]}], "r": [[1.729578794654532e-05], 0, 2.4651713371276855, 1580032679.5929017], "v": 0.1}
{"i": ["llvm -mcpu=cascadelake", "topi_x86_conv2d_NCHWc_int8", [["TENSOR", [1, 128, 30, 30], "uint8"], ["TENSOR", [128, 128, 3, 3], "int8"], [1, 1], [0, 0], [1, 1], "NCHW", "int32"], {}, ["conv2d", [1, 128, 30, 30, "uint8"], [128, 128, 3, 3, "int8"], [1, 1], [0, 0], [1, 1], "NCHW", "int32"], {"i": 53, "t": "direct", "c": null, "e": [["tile_ic", "sp", [-1, 128]], ["tile_oc", "sp", [-1, 16]], ["tile_ow", "sp", [-1, 4]], ["unroll_kw", "ot", true]]}], "r": [[3.311019890349457e-05], 0, 2.774730920791626, 1580033998.9977117], "v": 0.1}
{"i": ["llvm -mcpu=cascadelake", "topi_x86_conv2d_NCHWc_int8", [["TENSOR", [1, 512, 28, 28], "uint8"], ["TENSOR", [256, 512, 1, 1], "int8"], [1, 1], [0, 0], [1, 1], "NCHW", "int32"], {}, ["conv2d", [1, 512, 28, 28, "uint8"], [256, 512, 1, 1, "int8"], [1, 1], [0, 0], [1, 1], "NCHW", "int32"], {"i": 294, "t": "direct", "c": null, "e": [["tile_ic", "sp", [-1, 256]], ["tile_oc", "sp", [-1, 32]], ["tile_ow", "sp", [-1, 2]], ["tile_oh", "ot", 2]]}], "r": [[3.179383889132203e-05], 0, 2.775465965270996, 1580035007.0635962], "v": 0.1}
{"i": ["llvm -mcpu=cascadelake", "topi_x86_conv2d_NCHWc_int8", [["TENSOR", [1, 256, 30, 30], "uint8"], ["TENSOR", [256, 256, 3, 3], "int8"], [2, 2], [0, 0], [1, 1], "NCHW", "int32"], {}, ["conv2d", [1, 256, 30, 30, "uint8"], [256, 256, 3, 3, "int8"], [2, 2], [0, 0], [1, 1], "NCHW", "int32"], {"i": 251, "t": "direct", "c": null, "e": [["tile_ic", "sp", [-1, 256]], ["tile_oc", "sp", [-1, 16]], ["tile_ow", "sp", [-1, 14]], ["unroll_kw", "ot", false]]}], "r": [[3.6671690683229815e-05], 0, 2.7357211112976074, 1580035623.8456988], "v": 0.1}
{"i": ["llvm -mcpu=cascadelake", "topi_x86_conv2d_NCHWc_int8", [["TENSOR", [1, 512, 28, 28], "uint8"], ["TENSOR", [1024, 512, 1, 1], "int8"], [2, 2], [0, 0], [1, 1], "NCHW", "int32"], {}, ["conv2d", [1, 512, 28, 28, "uint8"], [1024, 512, 1, 1, "int8"], [2, 2], [0, 0], [1, 1], "NCHW", "int32"], {"i": 290, "t": "direct", "c": null, "e": [["tile_ic", "sp", [-1, 16]], ["tile_oc", "sp", [-1, 32]], ["tile_ow", "sp", [-1, 2]], ["tile_oh", "ot", 2]]}], "r": [[3.28614012937863e-05], 0, 2.7442924976348877, 1580036602.4957995], "v": 0.1}
{"i": ["llvm -mcpu=cascadelake", "topi_x86_conv2d_NCHWc_int8", [["TENSOR", [1, 256, 14, 14], "uint8"], ["TENSOR", [1024, 256, 1, 1], "int8"], [1, 1], [0, 0], [1, 1], "NCHW", "int32"], {}, ["conv2d", [1, 256, 14, 14, "uint8"], [1024, 256, 1, 1, "int8"], [1, 1], [0, 0], [1, 1], "NCHW", "int32"], {"i": 154, "t": "direct", "c": null, "e": [["tile_ic", "sp", [-1, 4]], ["tile_oc", "sp", [-1, 32]], ["tile_ow", "sp", [-1, 14]], ["tile_oh", "ot", 1]]}], "r": [[1.7621498965430896e-05], 0, 2.5128731727600098, 1580037658.3328936], "v": 0.1}
{"i": ["llvm -mcpu=cascadelake", "topi_x86_conv2d_NCHWc_int8", [["TENSOR", [1, 1024, 14, 14], "uint8"], ["TENSOR", [256, 1024, 1, 1], "int8"], [1, 1], [0, 0], [1, 1], "NCHW", "int32"], {}, ["conv2d", [1, 1024, 14, 14, "uint8"], [256, 1024, 1, 1, "int8"], [1, 1], [0, 0], [1, 1], "NCHW", "int32"], {"i": 149, "t": "direct", "c": null, "e": [["tile_ic", "sp", [-1, 128]], ["tile_oc", "sp", [-1, 32]], ["tile_ow", "sp", [-1, 14]], ["tile_oh", "ot", 1]]}], "r": [[1.71243853123877e-05], 0, 2.51108717918396, 1580038901.6737494], "v": 0.1}
{"i": ["llvm -mcpu=cascadelake", "topi_x86_conv2d_NCHWc_int8", [["TENSOR", [1, 256, 16, 16], "uint8"], ["TENSOR", [256, 256, 3, 3], "int8"], [1, 1], [0, 0], [1, 1], "NCHW", "int32"], {}, ["conv2d", [1, 256, 16, 16, "uint8"], [256, 256, 3, 3, "int8"], [1, 1], [0, 0], [1, 1], "NCHW", "int32"], {"i": 71, "t": "direct", "c": null, "e": [["tile_ic", "sp", [-1, 8]], ["tile_oc", "sp", [-1, 16]], ["tile_ow", "sp", [-1, 7]], ["unroll_kw", "ot", true]]}], "r": [[3.4293522016563336e-05], 0, 2.8529462814331055, 1580039771.4458978], "v": 0.1}
{"i": ["llvm -mcpu=cascadelake", "topi_x86_conv2d_NCHWc_int8", [["TENSOR", [1, 1024, 14, 14], "uint8"], ["TENSOR", [512, 1024, 1, 1], "int8"], [1, 1], [0, 0], [1, 1], "NCHW", "int32"], {}, ["conv2d", [1, 1024, 14, 14, "uint8"], [512, 1024, 1, 1, "int8"], [1, 1], [0, 0], [1, 1], "NCHW", "int32"], {"i": 341, "t": "direct", "c": null, "e": [["tile_ic", "sp", [-1, 1024]], ["tile_oc", "sp", [-1, 32]], ["tile_ow", "sp", [-1, 7]], ["tile_oh", "ot", 2]]}], "r": [[3.150179338282079e-05], 0, 2.7905890941619873, 1580040553.526402], "v": 0.1}
{"i": ["llvm -mcpu=cascadelake", "topi_x86_conv2d_NCHWc_int8", [["TENSOR", [1, 512, 16, 16], "uint8"], ["TENSOR", [512, 512, 3, 3], "int8"], [2, 2], [0, 0], [1, 1], "NCHW", "int32"], {}, ["conv2d", [1, 512, 16, 16, "uint8"], [512, 512, 3, 3, "int8"], [2, 2], [0, 0], [1, 1], "NCHW", "int32"], {"i": 159, "t": "direct", "c": null, "e": [["tile_ic", "sp", [-1, 512]], ["tile_oc", "sp", [-1, 32]], ["tile_ow", "sp", [-1, 7]], ["unroll_kw", "ot", false]]}], "r": [[3.3520260407656306e-05], 0, 2.7497782707214355, 1580041506.8966784], "v": 0.1}
{"i": ["llvm -mcpu=cascadelake", "topi_x86_conv2d_NCHWc_int8", [["TENSOR", [1, 1024, 14, 14], "uint8"], ["TENSOR", [2048, 1024, 1, 1], "int8"], [2, 2], [0, 0], [1, 1], "NCHW", "int32"], {}, ["conv2d", [1, 1024, 14, 14, "uint8"], [2048, 1024, 1, 1, "int8"], [2, 2], [0, 0], [1, 1], "NCHW", "int32"], {"i": 87, "t": "direct", "c": null, "e": [["tile_ic", "sp", [-1, 256]], ["tile_oc", "sp", [-1, 32]], ["tile_ow", "sp", [-1, 7]], ["tile_oh", "ot", 1]]}], "r": [[3.0224727088824865e-05], 0, 2.702601909637451, 1580042115.1392453], "v": 0.1}
{"i": ["llvm -mcpu=cascadelake", "topi_x86_conv2d_NCHWc_int8", [["TENSOR", [1, 512, 7, 7], "uint8"], ["TENSOR", [2048, 512, 1, 1], "int8"], [1, 1], [0, 0], [1, 1], "NCHW", "int32"], {}, ["conv2d", [1, 512, 7, 7, "uint8"], [2048, 512, 1, 1, "int8"], [1, 1], [0, 0], [1, 1], "NCHW", "int32"], {"i": 79, "t": "direct", "c": null, "e": [["tile_ic", "sp", [-1, 512]], ["tile_oc", "sp", [-1, 32]], ["tile_ow", "sp", [-1, 7]], ["tile_oh", "ot", 1]]}], "r": [[1.6571207645919472e-05], 0, 2.2344956398010254, 1580042716.8359313], "v": 0.1}
{"i": ["llvm -mcpu=cascadelake", "topi_x86_conv2d_NCHWc_int8", [["TENSOR", [1, 2048, 7, 7], "uint8"], ["TENSOR", [512, 2048, 1, 1], "int8"], [1, 1], [0, 0], [1, 1], "NCHW", "int32"], {}, ["conv2d", [1, 2048, 7, 7, "uint8"], [512, 2048, 1, 1, "int8"], [1, 1], [0, 0], [1, 1], "NCHW", "int32"], {"i": 77, "t": "direct", "c": null, "e": [["tile_ic", "sp", [-1, 512]], ["tile_oc", "sp", [-1, 32]], ["tile_ow", "sp", [-1, 7]], ["tile_oh", "ot", 1]]}], "r": [[1.662432863823628e-05], 0, 2.2565793991088867, 1580043157.520429], "v": 0.1}
{"i": ["llvm -mcpu=cascadelake", "topi_x86_conv2d_NCHWc_int8", [["TENSOR", [1, 512, 9, 9], "uint8"], ["TENSOR", [512, 512, 3, 3], "int8"], [1, 1], [0, 0], [1, 1], "NCHW", "int32"], {}, ["conv2d", [1, 512, 9, 9, "uint8"], [512, 512, 3, 3, "int8"], [1, 1], [0, 0], [1, 1], "NCHW", "int32"], {"i": 153, "t": "direct", "c": null, "e": [["tile_ic", "sp", [-1, 8]], ["tile_oc", "sp", [-1, 32]], ["tile_ow", "sp", [-1, 7]], ["unroll_kw", "ot", false]]}], "r": [[3.37984877383592e-05], 0, 2.7674431800842285, 1580043877.2337422], "v": 0.1}
