scripts_paper/tuned_logs_g4/inceptionv3-symbol.log
{"i": ["cuda", "topi_nn_conv2d", [["TENSOR", [1, 2048, 8, 8], "float32"], ["TENSOR", [192, 2048, 1, 1], "float32"], [1, 1], [0, 0], [1, 1], "NCHW", "float32"], {}, ["conv2d", [1, 2048, 8, 8, "float32"], [192, 2048, 1, 1, "float32"], [1, 1], [0, 0], [1, 1], "NCHW", "float32"], {"i": 7186076, "t": "direct", "c": null, "e": [["tile_f", "sp", [-1, 2, 6, 1]], ["tile_y", "sp", [-1, 1, 4, 1]], ["tile_x", "sp", [-1, 1, 8, 1]], ["tile_rc", "sp", [-1, 32]], ["tile_ry", "sp", [-1, 1]], ["tile_rx", "sp", [-1, 1]], ["auto_unroll_max_step", "ot", 512], ["unroll_explicit", "ot", 1]]}], "r": [[5.796032489146165e-05], 0, 1.6067121028900146, 1582197500.5455565], "v": 0.1}
{"i": ["cuda", "topi_nn_conv2d", [["TENSOR", [1, 2048, 8, 8], "float32"], ["TENSOR", [448, 2048, 1, 1], "float32"], [1, 1], [0, 0], [1, 1], "NCHW", "float32"], {}, ["conv2d", [1, 2048, 8, 8, "float32"], [448, 2048, 1, 1, "float32"], [1, 1], [0, 0], [1, 1], "NCHW", "float32"], {"i": 8839267, "t": "direct", "c": null, "e": [["tile_f", "sp", [-1, 2, 7, 2]], ["tile_y", "sp", [-1, 1, 4, 1]], ["tile_x", "sp", [-1, 1, 4, 2]], ["tile_rc", "sp", [-1, 32]], ["tile_ry", "sp", [-1, 1]], ["tile_rx", "sp", [-1, 1]], ["auto_unroll_max_step", "ot", 1500], ["unroll_explicit", "ot", 1]]}], "r": [[9.3489493592233e-05], 0, 1.8093690872192383, 1582200554.4997926], "v": 0.1}
{"i": ["cuda", "topi_nn_conv2d", [["TENSOR", [1, 2048, 8, 8], "float32"], ["TENSOR", [384, 2048, 1, 1], "float32"], [1, 1], [0, 0], [1, 1], "NCHW", "float32"], {}, ["conv2d", [1, 2048, 8, 8, "float32"], [384, 2048, 1, 1, "float32"], [1, 1], [0, 0], [1, 1], "NCHW", "float32"], {"i": 8019578, "t": "direct", "c": null, "e": [["tile_f", "sp", [-1, 1, 16, 3]], ["tile_y", "sp", [-1, 1, 4, 1]], ["tile_x", "sp", [-1, 1, 4, 2]], ["tile_rc", "sp", [-1, 32]], ["tile_ry", "sp", [-1, 1]], ["tile_rx", "sp", [-1, 1]], ["auto_unroll_max_step", "ot", 0], ["unroll_explicit", "ot", 1]]}], "r": [[7.740767853705486e-05], 0, 1.60115647315979, 1582206749.9705257], "v": 0.1}
{"i": ["cuda", "topi_nn_conv2d", [["TENSOR", [1, 2048, 8, 8], "float32"], ["TENSOR", [320, 2048, 1, 1], "float32"], [1, 1], [0, 0], [1, 1], "NCHW", "float32"], {}, ["conv2d", [1, 2048, 8, 8, "float32"], [320, 2048, 1, 1, "float32"], [1, 1], [0, 0], [1, 1], "NCHW", "float32"], {"i": 8839283, "t": "direct", "c": null, "e": [["tile_f", "sp", [-1, 1, 16, 2]], ["tile_y", "sp", [-1, 1, 4, 1]], ["tile_x", "sp", [-1, 1, 4, 2]], ["tile_rc", "sp", [-1, 32]], ["tile_ry", "sp", [-1, 1]], ["tile_rx", "sp", [-1, 1]], ["auto_unroll_max_step", "ot", 1500], ["unroll_explicit", "ot", 1]]}], "r": [[6.575511920349154e-05], 0, 1.7122406959533691, 1582212789.8109543], "v": 0.1}
{"i": ["cuda", "topi_nn_conv2d", [["TENSOR", [1, 1280, 8, 8], "float32"], ["TENSOR", [192, 1280, 1, 1], "float32"], [1, 1], [0, 0], [1, 1], "NCHW", "float32"], {}, ["conv2d", [1, 1280, 8, 8, "float32"], [192, 1280, 1, 1, "float32"], [1, 1], [0, 0], [1, 1], "NCHW", "float32"], {"i": 10680467, "t": "direct", "c": null, "e": [["tile_f", "sp", [-1, 3, 4, 1]], ["tile_y", "sp", [-1, 1, 4, 1]], ["tile_x", "sp", [-1, 1, 8, 1]], ["tile_rc", "sp", [-1, 20]], ["tile_ry", "sp", [-1, 1]], ["tile_rx", "sp", [-1, 1]], ["auto_unroll_max_step", "ot", 512], ["unroll_explicit", "ot", 1]]}], "r": [[3.580843082232893e-05], 0, 1.8589246273040771, 1582221679.4501927], "v": 0.1}
{"i": ["cuda", "topi_nn_conv2d", [["TENSOR", [1, 448, 8, 8], "float32"], ["TENSOR", [384, 448, 3, 3], "float32"], [1, 1], [1, 1], [1, 1], "NCHW", "float32"], {}, ["conv2d", [1, 448, 8, 8, "float32"], [384, 448, 3, 3, "float32"], [1, 1], [1, 1], [1, 1], "NCHW", "float32"], {"i": 367388, "t": "winograd", "c": null, "e": [["tile_b", "sp", [-1, 1, 1, 1]], ["tile_y", "sp", [-1, 3, 64, 2]], ["tile_x", "sp", [-1, 1, 4, 1]], ["tile_rc", "sp", [-1, 16]], ["auto_unroll_max_step", "ot", 1500], ["unroll_explicit", "ot", 1]]}], "r": [[0.00010433735062689148], 0, 3.299417018890381, 1582230216.1758833], "v": 0.1}
{"i": ["cuda", "topi_nn_conv2d", [["TENSOR", [1, 1280, 8, 8], "float32"], ["TENSOR", [448, 1280, 1, 1], "float32"], [1, 1], [0, 0], [1, 1], "NCHW", "float32"], {}, ["conv2d", [1, 1280, 8, 8, "float32"], [448, 1280, 1, 1, "float32"], [1, 1], [0, 0], [1, 1], "NCHW", "float32"], {"i": 10989596, "t": "direct", "c": null, "e": [["tile_f", "sp", [-1, 2, 8, 1]], ["tile_y", "sp", [-1, 1, 4, 1]], ["tile_x", "sp", [-1, 1, 4, 2]], ["tile_rc", "sp", [-1, 40]], ["tile_ry", "sp", [-1, 1]], ["tile_rx", "sp", [-1, 1]], ["auto_unroll_max_step", "ot", 512], ["unroll_explicit", "ot", 1]]}], "r": [[5.4892751823154055e-05], 0, 1.7360963821411133, 1582234367.3537343], "v": 0.1}
{"i": ["cuda", "topi_nn_conv2d", [["TENSOR", [1, 384, 8, 8], "float32"], ["TENSOR", [384, 384, 3, 1], "float32"], [1, 1], [1, 0], [1, 1], "NCHW", "float32"], {}, ["conv2d", [1, 384, 8, 8, "float32"], [384, 384, 3, 1, "float32"], [1, 1], [1, 0], [1, 1], "NCHW", "float32"], {"i": 29332360, "t": "direct", "c": null, "e": [["tile_f", "sp", [-1, 3, 4, 1]], ["tile_y", "sp", [-1, 1, 8, 1]], ["tile_x", "sp", [-1, 1, 4, 2]], ["tile_rc", "sp", [-1, 24]], ["tile_ry", "sp", [-1, 3]], ["tile_rx", "sp", [-1, 1]], ["auto_unroll_max_step", "ot", 512], ["unroll_explicit", "ot", 1]]}], "r": [[3.3163749823720205e-05], 0, 2.0039913654327393, 1582241478.010889], "v": 0.1}
{"i": ["cuda", "topi_nn_conv2d", [["TENSOR", [1, 384, 8, 8], "float32"], ["TENSOR", [384, 384, 1, 3], "float32"], [1, 1], [0, 1], [1, 1], "NCHW", "float32"], {}, ["conv2d", [1, 384, 8, 8, "float32"], [384, 384, 1, 3, "float32"], [1, 1], [0, 1], [1, 1], "NCHW", "float32"], {"i": 16688228, "t": "direct", "c": null, "e": [["tile_f", "sp", [-1, 2, 12, 1]], ["tile_y", "sp", [-1, 1, 4, 1]], ["tile_x", "sp", [-1, 1, 2, 4]], ["tile_rc", "sp", [-1, 12]], ["tile_ry", "sp", [-1, 1]], ["tile_rx", "sp", [-1, 3]], ["auto_unroll_max_step", "ot", 1500], ["unroll_explicit", "ot", 0]]}], "r": [[3.5925599001663896e-05], 0, 1.6687383651733398, 1582247420.3704772], "v": 0.1}
{"i": ["cuda", "topi_nn_conv2d", [["TENSOR", [1, 1280, 8, 8], "float32"], ["TENSOR", [384, 1280, 1, 1], "float32"], [1, 1], [0, 0], [1, 1], "NCHW", "float32"], {}, ["conv2d", [1, 1280, 8, 8, "float32"], [384, 1280, 1, 1, "float32"], [1, 1], [0, 0], [1, 1], "NCHW", "float32"], {"i": 1491573, "t": "direct", "c": null, "e": [["tile_f", "sp", [-1, 1, 8, 3]], ["tile_y", "sp", [-1, 1, 4, 1]], ["tile_x", "sp", [-1, 1, 4, 2]], ["tile_rc", "sp", [-1, 20]], ["tile_ry", "sp", [-1, 1]], ["tile_rx", "sp", [-1, 1]], ["auto_unroll_max_step", "ot", 0], ["unroll_explicit", "ot", 0]]}], "r": [[4.652021592920354e-05], 0, 1.572554588317871, 1582254656.3903253], "v": 0.1}
{"i": ["cuda", "topi_nn_conv2d", [["TENSOR", [1, 1280, 8, 8], "float32"], ["TENSOR", [320, 1280, 1, 1], "float32"], [1, 1], [0, 0], [1, 1], "NCHW", "float32"], {}, ["conv2d", [1, 1280, 8, 8, "float32"], [320, 1280, 1, 1, "float32"], [1, 1], [0, 0], [1, 1], "NCHW", "float32"], {"i": 1044072, "t": "direct", "c": null, "e": [["tile_f", "sp", [-1, 1, 8, 2]], ["tile_y", "sp", [-1, 1, 4, 1]], ["tile_x", "sp", [-1, 1, 4, 2]], ["tile_rc", "sp", [-1, 20]], ["tile_ry", "sp", [-1, 1]], ["tile_rx", "sp", [-1, 1]], ["auto_unroll_max_step", "ot", 0], ["unroll_explicit", "ot", 0]]}], "r": [[3.813437739494445e-05], 0, 1.6518139839172363, 1582259933.237722], "v": 0.1}
{"i": ["cuda", "topi_nn_conv2d", [["TENSOR", [1, 192, 17, 17], "float32"], ["TENSOR", [192, 192, 3, 3], "float32"], [2, 2], [0, 0], [1, 1], "NCHW", "float32"], {}, ["conv2d", [1, 192, 17, 17, "float32"], [192, 192, 3, 3, "float32"], [2, 2], [0, 0], [1, 1], "NCHW", "float32"], {"i": 21296409, "t": "direct", "c": null, "e": [["tile_f", "sp", [-1, 1, 12, 1]], ["tile_y", "sp", [-1, 4, 1, 1]], ["tile_x", "sp", [-1, 1, 8, 1]], ["tile_rc", "sp", [-1, 6]], ["tile_ry", "sp", [-1, 3]], ["tile_rx", "sp", [-1, 3]], ["auto_unroll_max_step", "ot", 1500], ["unroll_explicit", "ot", 0]]}], "r": [[4.3798157625570775e-05], 0, 1.6688668727874756, 1582270596.9041712], "v": 0.1}
{"i": ["cuda", "topi_nn_conv2d", [["TENSOR", [1, 192, 17, 17], "float32"], ["TENSOR", [320, 192, 3, 3], "float32"], [2, 2], [0, 0], [1, 1], "NCHW", "float32"], {}, ["conv2d", [1, 192, 17, 17, "float32"], [320, 192, 3, 3, "float32"], [2, 2], [0, 0], [1, 1], "NCHW", "float32"], {"i": 36277032, "t": "direct", "c": null, "e": [["tile_f", "sp", [-1, 1, 8, 2]], ["tile_y", "sp", [-1, 1, 4, 1]], ["tile_x", "sp", [-1, 1, 2, 4]], ["tile_rc", "sp", [-1, 4]], ["tile_ry", "sp", [-1, 3]], ["tile_rx", "sp", [-1, 3]], ["auto_unroll_max_step", "ot", 512], ["unroll_explicit", "ot", 1]]}], "r": [[4.963677832817337e-05], 0, 1.8087222576141357, 1582276513.93173], "v": 0.1}
{"i": ["cuda", "topi_nn_conv2d", [["TENSOR", [1, 192, 17, 17], "float32"], ["TENSOR", [192, 192, 7, 1], "float32"], [1, 1], [3, 0], [1, 1], "NCHW", "float32"], {}, ["conv2d", [1, 192, 17, 17, "float32"], [192, 192, 7, 1, "float32"], [1, 1], [3, 0], [1, 1], "NCHW", "float32"], {"i": 696364, "t": "direct", "c": null, "e": [["tile_f", "sp", [-1, 1, 32, 3]], ["tile_y", "sp", [-1, 1, 1, 1]], ["tile_x", "sp", [-1, 1, 17, 1]], ["tile_rc", "sp", [-1, 4]], ["tile_ry", "sp", [-1, 7]], ["tile_rx", "sp", [-1, 1]], ["auto_unroll_max_step", "ot", 512], ["unroll_explicit", "ot", 1]]}], "r": [[0.00016754651800554018], 0, 1.696049690246582, 1582281362.807855], "v": 0.1}
{"i": ["cuda", "topi_nn_conv2d", [["TENSOR", [1, 192, 17, 17], "float32"], ["TENSOR", [192, 192, 1, 7], "float32"], [1, 1], [0, 3], [1, 1], "NCHW", "float32"], {}, ["conv2d", [1, 192, 17, 17, "float32"], [192, 192, 1, 7, "float32"], [1, 1], [0, 3], [1, 1], "NCHW", "float32"], {"i": 572986, "t": "direct", "c": null, "e": [["tile_f", "sp", [-1, 1, 3, 2]], ["tile_y", "sp", [-1, 17, 1, 1]], ["tile_x", "sp", [-1, 1, 17, 1]], ["tile_rc", "sp", [-1, 24]], ["tile_ry", "sp", [-1, 1]], ["tile_rx", "sp", [-1, 7]], ["auto_unroll_max_step", "ot", 0], ["unroll_explicit", "ot", 1]]}], "r": [[0.00014540465724594107], 0, 1.6924011707305908, 1582283128.8020942], "v": 0.1}
{"i": ["cuda", "topi_nn_conv2d", [["TENSOR", [1, 160, 17, 17], "float32"], ["TENSOR", [192, 160, 1, 7], "float32"], [1, 1], [0, 3], [1, 1], "NCHW", "float32"], {}, ["conv2d", [1, 160, 17, 17, "float32"], [192, 160, 1, 7, "float32"], [1, 1], [0, 3], [1, 1], "NCHW", "float32"], {"i": 605478, "t": "direct", "c": null, "e": [["tile_f", "sp", [-1, 12, 1, 1]], ["tile_y", "sp", [-1, 1, 17, 1]], ["tile_x", "sp", [-1, 1, 17, 1]], ["tile_rc", "sp", [-1, 8]], ["tile_ry", "sp", [-1, 1]], ["tile_rx", "sp", [-1, 7]], ["auto_unroll_max_step", "ot", 512], ["unroll_explicit", "ot", 1]]}], "r": [[8.966653551506136e-05], 0, 1.7186956405639648, 1582287604.5285842], "v": 0.1}
{"i": ["cuda", "topi_nn_conv2d", [["TENSOR", [1, 160, 17, 17], "float32"], ["TENSOR", [160, 160, 7, 1], "float32"], [1, 1], [3, 0], [1, 1], "NCHW", "float32"], {}, ["conv2d", [1, 160, 17, 17, "float32"], [160, 160, 7, 1, "float32"], [1, 1], [3, 0], [1, 1], "NCHW", "float32"], {"i": 403650, "t": "direct", "c": null, "e": [["tile_f", "sp", [-1, 4, 1, 1]], ["tile_y", "sp", [-1, 1, 17, 1]], ["tile_x", "sp", [-1, 1, 17, 1]], ["tile_rc", "sp", [-1, 8]], ["tile_ry", "sp", [-1, 7]], ["tile_rx", "sp", [-1, 1]], ["auto_unroll_max_step", "ot", 512], ["unroll_explicit", "ot", 1]]}], "r": [[6.591351228942281e-05], 0, 1.8666863441467285, 1582291010.6133018], "v": 0.1}
{"i": ["cuda", "topi_nn_conv2d", [["TENSOR", [1, 160, 17, 17], "float32"], ["TENSOR", [192, 160, 7, 1], "float32"], [1, 1], [3, 0], [1, 1], "NCHW", "float32"], {}, ["conv2d", [1, 160, 17, 17, "float32"], [192, 160, 7, 1, "float32"], [1, 1], [3, 0], [1, 1], "NCHW", "float32"], {"i": 734582, "t": "direct", "c": null, "e": [["tile_f", "sp", [-1, 3, 1, 2]], ["tile_y", "sp", [-1, 1, 17, 1]], ["tile_x", "sp", [-1, 1, 17, 1]], ["tile_rc", "sp", [-1, 8]], ["tile_ry", "sp", [-1, 7]], ["tile_rx", "sp", [-1, 1]], ["auto_unroll_max_step", "ot", 1500], ["unroll_explicit", "ot", 1]]}], "r": [[7.988451527224436e-05], 0, 2.0226523876190186, 1582293063.5986333], "v": 0.1}
{"i": ["cuda", "topi_nn_conv2d", [["TENSOR", [1, 160, 17, 17], "float32"], ["TENSOR", [160, 160, 1, 7], "float32"], [1, 1], [0, 3], [1, 1], "NCHW", "float32"], {}, ["conv2d", [1, 160, 17, 17, "float32"], [160, 160, 1, 7, "float32"], [1, 1], [0, 3], [1, 1], "NCHW", "float32"], {"i": 407391, "t": "direct", "c": null, "e": [["tile_f", "sp", [-1, 1, 1, 8]], ["tile_y", "sp", [-1, 1, 17, 1]], ["tile_x", "sp", [-1, 1, 17, 1]], ["tile_rc", "sp", [-1, 10]], ["tile_ry", "sp", [-1, 1]], ["tile_rx", "sp", [-1, 7]], ["auto_unroll_max_step", "ot", 512], ["unroll_explicit", "ot", 1]]}], "r": [[7.465598282859819e-05], 0, 1.732069730758667, 1582295830.3293827], "v": 0.1}
{"i": ["cuda", "topi_nn_conv2d", [["TENSOR", [1, 768, 17, 17], "float32"], ["TENSOR", [160, 768, 1, 1], "float32"], [1, 1], [0, 0], [1, 1], "NCHW", "float32"], {}, ["conv2d", [1, 768, 17, 17, "float32"], [160, 768, 1, 1, "float32"], [1, 1], [0, 0], [1, 1], "NCHW", "float32"], {"i": 16753, "t": "direct", "c": null, "e": [["tile_f", "sp", [-1, 1, 1, 10]], ["tile_y", "sp", [-1, 1, 17, 1]], ["tile_x", "sp", [-1, 1, 17, 1]], ["tile_rc", "sp", [-1, 6]], ["tile_ry", "sp", [-1, 1]], ["tile_rx", "sp", [-1, 1]], ["auto_unroll_max_step", "ot", 0], ["unroll_explicit", "ot", 0]]}], "r": [[7.532117057902973e-05], 0, 2.6758337020874023, 1582298722.0276453], "v": 0.1}
{"i": ["cuda", "topi_nn_conv2d", [["TENSOR", [1, 128, 17, 17], "float32"], ["TENSOR", [192, 128, 1, 7], "float32"], [1, 1], [0, 3], [1, 1], "NCHW", "float32"], {}, ["conv2d", [1, 128, 17, 17, "float32"], [192, 128, 1, 7, "float32"], [1, 1], [0, 3], [1, 1], "NCHW", "float32"], {"i": 235921, "t": "direct", "c": null, "e": [["tile_f", "sp", [-1, 1, 8, 1]], ["tile_y", "sp", [-1, 1, 17, 1]], ["tile_x", "sp", [-1, 1, 1, 17]], ["tile_rc", "sp", [-1, 8]], ["tile_ry", "sp", [-1, 1]], ["tile_rx", "sp", [-1, 7]], ["auto_unroll_max_step", "ot", 1500], ["unroll_explicit", "ot", 0]]}], "r": [[6.185187683209051e-05], 0, 1.8432538509368896, 1582302746.1954753], "v": 0.1}
{"i": ["cuda", "topi_nn_conv2d", [["TENSOR", [1, 128, 17, 17], "float32"], ["TENSOR", [128, 128, 7, 1], "float32"], [1, 1], [3, 0], [1, 1], "NCHW", "float32"], {}, ["conv2d", [1, 128, 17, 17, "float32"], [128, 128, 7, 1, "float32"], [1, 1], [3, 0], [1, 1], "NCHW", "float32"], {"i": 81735, "t": "direct", "c": null, "e": [["tile_f", "sp", [-1, 1, 4, 1]], ["tile_y", "sp", [-1, 17, 1, 1]], ["tile_x", "sp", [-1, 1, 17, 1]], ["tile_rc", "sp", [-1, 4]], ["tile_ry", "sp", [-1, 7]], ["tile_rx", "sp", [-1, 1]], ["auto_unroll_max_step", "ot", 1500], ["unroll_explicit", "ot", 0]]}], "r": [[4.64855417468257e-05], 0, 1.8983056545257568, 1582306368.6520014], "v": 0.1}
{"i": ["cuda", "topi_nn_conv2d", [["TENSOR", [1, 128, 17, 17], "float32"], ["TENSOR", [192, 128, 7, 1], "float32"], [1, 1], [3, 0], [1, 1], "NCHW", "float32"], {}, ["conv2d", [1, 128, 17, 17, "float32"], [192, 128, 7, 1, "float32"], [1, 1], [3, 0], [1, 1], "NCHW", "float32"], {"i": 492283, "t": "direct", "c": null, "e": [["tile_f", "sp", [-1, 1, 6, 1]], ["tile_y", "sp", [-1, 17, 1, 1]], ["tile_x", "sp", [-1, 1, 17, 1]], ["tile_rc", "sp", [-1, 8]], ["tile_ry", "sp", [-1, 7]], ["tile_rx", "sp", [-1, 1]], ["auto_unroll_max_step", "ot", 1500], ["unroll_explicit", "ot", 1]]}], "r": [[6.380440267022697e-05], 0, 2.793494462966919, 1582308441.1130059], "v": 0.1}
{"i": ["cuda", "topi_nn_conv2d", [["TENSOR", [1, 128, 17, 17], "float32"], ["TENSOR", [128, 128, 1, 7], "float32"], [1, 1], [0, 3], [1, 1], "NCHW", "float32"], {}, ["conv2d", [1, 128, 17, 17, "float32"], [128, 128, 1, 7, "float32"], [1, 1], [0, 3], [1, 1], "NCHW", "float32"], {"i": 174495, "t": "direct", "c": null, "e": [["tile_f", "sp", [-1, 1, 4, 1]], ["tile_y", "sp", [-1, 1, 17, 1]], ["tile_x", "sp", [-1, 1, 1, 17]], ["tile_rc", "sp", [-1, 4]], ["tile_ry", "sp", [-1, 1]], ["tile_rx", "sp", [-1, 7]], ["auto_unroll_max_step", "ot", 1500], ["unroll_explicit", "ot", 1]]}], "r": [[4.219176806547101e-05], 0, 1.8218350410461426, 1582311381.61474], "v": 0.1}
{"i": ["cuda", "topi_nn_conv2d", [["TENSOR", [1, 768, 17, 17], "float32"], ["TENSOR", [128, 768, 1, 1], "float32"], [1, 1], [0, 0], [1, 1], "NCHW", "float32"], {}, ["conv2d", [1, 768, 17, 17, "float32"], [128, 768, 1, 1, "float32"], [1, 1], [0, 0], [1, 1], "NCHW", "float32"], {"i": 154591, "t": "direct", "c": null, "e": [["tile_f", "sp", [-1, 2, 32, 1]], ["tile_y", "sp", [-1, 1, 1, 1]], ["tile_x", "sp", [-1, 1, 17, 1]], ["tile_rc", "sp", [-1, 24]], ["tile_ry", "sp", [-1, 1]], ["tile_rx", "sp", [-1, 1]], ["auto_unroll_max_step", "ot", 512], ["unroll_explicit", "ot", 1]]}], "r": [[7.424157236227824e-05], 0, 1.8135745525360107, 1582313944.955588], "v": 0.1}
{"i": ["cuda", "topi_nn_conv2d", [["TENSOR", [1, 768, 17, 17], "float32"], ["TENSOR", [192, 768, 1, 1], "float32"], [1, 1], [0, 0], [1, 1], "NCHW", "float32"], {}, ["conv2d", [1, 768, 17, 17, "float32"], [192, 768, 1, 1, "float32"], [1, 1], [0, 0], [1, 1], "NCHW", "float32"], {"i": 25041, "t": "direct", "c": null, "e": [["tile_f", "sp", [-1, 3, 1, 4]], ["tile_y", "sp", [-1, 1, 17, 1]], ["tile_x", "sp", [-1, 1, 17, 1]], ["tile_rc", "sp", [-1, 6]], ["tile_ry", "sp", [-1, 1]], ["tile_rx", "sp", [-1, 1]], ["auto_unroll_max_step", "ot", 0], ["unroll_explicit", "ot", 0]]}], "r": [[8.231120676691729e-05], 0, 3.1081340312957764, 1582315629.5530434], "v": 0.1}
{"i": ["cuda", "topi_nn_conv2d", [["TENSOR", [1, 96, 35, 35], "float32"], ["TENSOR", [96, 96, 3, 3], "float32"], [2, 2], [0, 0], [1, 1], "NCHW", "float32"], {}, ["conv2d", [1, 96, 35, 35, "float32"], [96, 96, 3, 3, "float32"], [2, 2], [0, 0], [1, 1], "NCHW", "float32"], {"i": 134852, "t": "direct", "c": null, "e": [["tile_f", "sp", [-1, 6, 1, 1]], ["tile_y", "sp", [-1, 1, 17, 1]], ["tile_x", "sp", [-1, 1, 17, 1]], ["tile_rc", "sp", [-1, 2]], ["tile_ry", "sp", [-1, 3]], ["tile_rx", "sp", [-1, 3]], ["auto_unroll_max_step", "ot", 0], ["unroll_explicit", "ot", 0]]}], "r": [[5.348927250500111e-05], 0, 2.4395787715911865, 1582318361.997609], "v": 0.1}
{"i": ["cuda", "topi_nn_conv2d", [["TENSOR", [1, 288, 35, 35], "float32"], ["TENSOR", [384, 288, 3, 3], "float32"], [2, 2], [0, 0], [1, 1], "NCHW", "float32"], {}, ["conv2d", [1, 288, 35, 35, "float32"], [384, 288, 3, 3, "float32"], [2, 2], [0, 0], [1, 1], "NCHW", "float32"], {"i": 427564, "t": "direct", "c": null, "e": [["tile_f", "sp", [-1, 1, 1, 12]], ["tile_y", "sp", [-1, 1, 17, 1]], ["tile_x", "sp", [-1, 1, 17, 1]], ["tile_rc", "sp", [-1, 2]], ["tile_ry", "sp", [-1, 3]], ["tile_rx", "sp", [-1, 3]], ["auto_unroll_max_step", "ot", 0], ["unroll_explicit", "ot", 0]]}], "r": [[0.0003646882526799387], 0, 1.8266122341156006, 1582322289.8527339], "v": 0.1}
{"i": ["cuda", "topi_nn_conv2d", [["TENSOR", [1, 288, 35, 35], "float32"], ["TENSOR", [48, 288, 1, 1], "float32"], [1, 1], [0, 0], [1, 1], "NCHW", "float32"], {}, ["conv2d", [1, 288, 35, 35, "float32"], [48, 288, 1, 1, "float32"], [1, 1], [0, 0], [1, 1], "NCHW", "float32"], {"i": 2882916, "t": "direct", "c": null, "e": [["tile_f", "sp", [-1, 6, 8, 1]], ["tile_y", "sp", [-1, 1, 1, 1]], ["tile_x", "sp", [-1, 5, 7, 1]], ["tile_rc", "sp", [-1, 16]], ["tile_ry", "sp", [-1, 1]], ["tile_rx", "sp", [-1, 1]], ["auto_unroll_max_step", "ot", 512], ["unroll_explicit", "ot", 1]]}], "r": [[2.9694890715181934e-05], 0, 1.9442675113677979, 1582329411.8316183], "v": 0.1}
{"i": ["cuda", "topi_nn_conv2d", [["TENSOR", [1, 288, 35, 35], "float32"], ["TENSOR", [64, 288, 1, 1], "float32"], [1, 1], [0, 0], [1, 1], "NCHW", "float32"], {}, ["conv2d", [1, 288, 35, 35, "float32"], [64, 288, 1, 1, "float32"], [1, 1], [0, 0], [1, 1], "NCHW", "float32"], {"i": 1321215, "t": "direct", "c": null, "e": [["tile_f", "sp", [-1, 1, 16, 4]], ["tile_y", "sp", [-1, 1, 1, 1]], ["tile_x", "sp", [-1, 5, 7, 1]], ["tile_rc", "sp", [-1, 12]], ["tile_ry", "sp", [-1, 1]], ["tile_rx", "sp", [-1, 1]], ["auto_unroll_max_step", "ot", 0], ["unroll_explicit", "ot", 1]]}], "r": [[3.290252973048069e-05], 0, 1.6169960498809814, 1582336097.830266], "v": 0.1}
{"i": ["cuda", "topi_nn_conv2d", [["TENSOR", [1, 256, 35, 35], "float32"], ["TENSOR", [48, 256, 1, 1], "float32"], [1, 1], [0, 0], [1, 1], "NCHW", "float32"], {}, ["conv2d", [1, 256, 35, 35, "float32"], [48, 256, 1, 1, "float32"], [1, 1], [0, 0], [1, 1], "NCHW", "float32"], {"i": 1126809, "t": "direct", "c": null, "e": [["tile_f", "sp", [-1, 1, 16, 3]], ["tile_y", "sp", [-1, 1, 1, 1]], ["tile_x", "sp", [-1, 5, 7, 1]], ["tile_rc", "sp", [-1, 16]], ["tile_ry", "sp", [-1, 1]], ["tile_rx", "sp", [-1, 1]], ["auto_unroll_max_step", "ot", 0], ["unroll_explicit", "ot", 1]]}], "r": [[2.191469572049173e-05], 0, 1.6205484867095947, 1582340575.3076046], "v": 0.1}
{"i": ["cuda", "topi_nn_conv2d", [["TENSOR", [1, 256, 35, 35], "float32"], ["TENSOR", [64, 256, 1, 1], "float32"], [1, 1], [0, 0], [1, 1], "NCHW", "float32"], {}, ["conv2d", [1, 256, 35, 35, "float32"], [64, 256, 1, 1, "float32"], [1, 1], [0, 0], [1, 1], "NCHW", "float32"], {"i": 1063128, "t": "direct", "c": null, "e": [["tile_f", "sp", [-1, 4, 16, 1]], ["tile_y", "sp", [-1, 1, 1, 1]], ["tile_x", "sp", [-1, 5, 7, 1]], ["tile_rc", "sp", [-1, 16]], ["tile_ry", "sp", [-1, 1]], ["tile_rx", "sp", [-1, 1]], ["auto_unroll_max_step", "ot", 1500], ["unroll_explicit", "ot", 1]]}], "r": [[2.7679288716043647e-05], 0, 1.8735876083374023, 1582343922.9315658], "v": 0.1}
{"i": ["cuda", "topi_nn_conv2d", [["TENSOR", [1, 192, 35, 35], "float32"], ["TENSOR", [32, 192, 1, 1], "float32"], [1, 1], [0, 0], [1, 1], "NCHW", "float32"], {}, ["conv2d", [1, 192, 35, 35, "float32"], [32, 192, 1, 1, "float32"], [1, 1], [0, 0], [1, 1], "NCHW", "float32"], {"i": 480273, "t": "direct", "c": null, "e": [["tile_f", "sp", [-1, 4, 8, 1]], ["tile_y", "sp", [-1, 1, 1, 1]], ["tile_x", "sp", [-1, 1, 35, 1]], ["tile_rc", "sp", [-1, 8]], ["tile_ry", "sp", [-1, 1]], ["tile_rx", "sp", [-1, 1]], ["auto_unroll_max_step", "ot", 1500], ["unroll_explicit", "ot", 0]]}], "r": [[1.4785553072979303e-05], 0, 1.8592941761016846, 1582347030.9242074], "v": 0.1}
{"i": ["cuda", "topi_nn_conv2d", [["TENSOR", [1, 96, 35, 35], "float32"], ["TENSOR", [96, 96, 3, 3], "float32"], [1, 1], [1, 1], [1, 1], "NCHW", "float32"], {}, ["conv2d", [1, 96, 35, 35, "float32"], [96, 96, 3, 3, "float32"], [1, 1], [1, 1], [1, 1], "NCHW", "float32"], {"i": 3469497, "t": "winograd", "c": null, "e": [["tile_b", "sp", [-1, 1, 1, 1]], ["tile_y", "sp", [-1, 2, 3, 8]], ["tile_x", "sp", [-1, 2, 162, 1]], ["tile_rc", "sp", [-1, 24]], ["auto_unroll_max_step", "ot", 0], ["unroll_explicit", "ot", 1]]}], "r": [[4.6363628610460576e-05], 0, 1.8964552879333496, 1582352047.7952332], "v": 0.1}
{"i": ["cuda", "topi_nn_conv2d", [["TENSOR", [1, 64, 35, 35], "float32"], ["TENSOR", [96, 64, 3, 3], "float32"], [1, 1], [1, 1], [1, 1], "NCHW", "float32"], {}, ["conv2d", [1, 64, 35, 35, "float32"], [96, 64, 3, 3, "float32"], [1, 1], [1, 1], [1, 1], "NCHW", "float32"], {"i": 3074832, "t": "winograd", "c": null, "e": [["tile_b", "sp", [-1, 1, 1, 1]], ["tile_y", "sp", [-1, 1, 3, 16]], ["tile_x", "sp", [-1, 3, 36, 1]], ["tile_rc", "sp", [-1, 16]], ["auto_unroll_max_step", "ot", 1500], ["unroll_explicit", "ot", 1]]}], "r": [[3.060230033993202e-05], 0, 2.3372581005096436, 1582367713.9602058], "v": 0.1}
{"i": ["cuda", "topi_nn_conv2d", [["TENSOR", [1, 48, 35, 35], "float32"], ["TENSOR", [64, 48, 5, 5], "float32"], [1, 1], [2, 2], [1, 1], "NCHW", "float32"], {}, ["conv2d", [1, 48, 35, 35, "float32"], [64, 48, 5, 5, "float32"], [1, 1], [2, 2], [1, 1], "NCHW", "float32"], {"i": 5004270, "t": "direct", "c": null, "e": [["tile_f", "sp", [-1, 1, 2, 4]], ["tile_y", "sp", [-1, 1, 7, 1]], ["tile_x", "sp", [-1, 1, 7, 5]], ["tile_rc", "sp", [-1, 3]], ["tile_ry", "sp", [-1, 5]], ["tile_rx", "sp", [-1, 5]], ["auto_unroll_max_step", "ot", 1500], ["unroll_explicit", "ot", 1]]}], "r": [[6.654007197614992e-05], 0, 3.446953058242798, 1582378491.1457353], "v": 0.1}
{"i": ["cuda", "topi_nn_conv2d", [["TENSOR", [1, 192, 35, 35], "float32"], ["TENSOR", [48, 192, 1, 1], "float32"], [1, 1], [0, 0], [1, 1], "NCHW", "float32"], {}, ["conv2d", [1, 192, 35, 35, "float32"], [48, 192, 1, 1, "float32"], [1, 1], [0, 0], [1, 1], "NCHW", "float32"], {"i": 2775449, "t": "direct", "c": null, "e": [["tile_f", "sp", [-1, 1, 16, 3]], ["tile_y", "sp", [-1, 1, 1, 1]], ["tile_x", "sp", [-1, 5, 7, 1]], ["tile_rc", "sp", [-1, 16]], ["tile_ry", "sp", [-1, 1]], ["tile_rx", "sp", [-1, 1]], ["auto_unroll_max_step", "ot", 1500], ["unroll_explicit", "ot", 1]]}], "r": [[1.7935942619827784e-05], 0, 1.8560361862182617, 1582383374.8010404], "v": 0.1}
{"i": ["cuda", "topi_nn_conv2d", [["TENSOR", [1, 192, 35, 35], "float32"], ["TENSOR", [64, 192, 1, 1], "float32"], [1, 1], [0, 0], [1, 1], "NCHW", "float32"], {}, ["conv2d", [1, 192, 35, 35, "float32"], [64, 192, 1, 1, "float32"], [1, 1], [0, 0], [1, 1], "NCHW", "float32"], {"i": 418028, "t": "direct", "c": null, "e": [["tile_f", "sp", [-1, 2, 8, 2]], ["tile_y", "sp", [-1, 1, 1, 1]], ["tile_x", "sp", [-1, 5, 7, 1]], ["tile_rc", "sp", [-1, 8]], ["tile_ry", "sp", [-1, 1]], ["tile_rx", "sp", [-1, 1]], ["auto_unroll_max_step", "ot", 512], ["unroll_explicit", "ot", 0]]}], "r": [[2.2823493190101668e-05], 0, 1.7389247417449951, 1582388065.4225323], "v": 0.1}
{"i": ["cuda", "topi_nn_conv2d", [["TENSOR", [1, 80, 73, 73], "float32"], ["TENSOR", [192, 80, 3, 3], "float32"], [1, 1], [0, 0], [1, 1], "NCHW", "float32"], {}, ["conv2d", [1, 80, 73, 73, "float32"], [192, 80, 3, 3, "float32"], [1, 1], [0, 0], [1, 1], "NCHW", "float32"], {"i": 22286397, "t": "winograd", "c": null, "e": [["tile_b", "sp", [-1, 1, 1, 1]], ["tile_y", "sp", [-1, 6, 2, 4]], ["tile_x", "sp", [-1, 3, 48, 1]], ["tile_rc", "sp", [-1, 8]], ["auto_unroll_max_step", "ot", 1500], ["unroll_explicit", "ot", 1]]}], "r": [[0.0002691906853146853], 0, 2.0768094062805176, 1582407554.0836062], "v": 0.1}
{"i": ["cuda", "topi_nn_conv2d", [["TENSOR", [1, 64, 73, 73], "float32"], ["TENSOR", [80, 64, 1, 1], "float32"], [1, 1], [0, 0], [1, 1], "NCHW", "float32"], {}, ["conv2d", [1, 64, 73, 73, "float32"], [80, 64, 1, 1, "float32"], [1, 1], [0, 0], [1, 1], "NCHW", "float32"], {"i": 86302, "t": "direct", "c": null, "e": [["tile_f", "sp", [-1, 10, 4, 2]], ["tile_y", "sp", [-1, 1, 1, 1]], ["tile_x", "sp", [-1, 1, 73, 1]], ["tile_rc", "sp", [-1, 8]], ["tile_ry", "sp", [-1, 1]], ["tile_rx", "sp", [-1, 1]], ["auto_unroll_max_step", "ot", 1500], ["unroll_explicit", "ot", 1]]}], "r": [[2.9648715442092154e-05], 0, 3.0961709022521973, 1582416230.3903706], "v": 0.1}
{"i": ["cuda", "topi_nn_conv2d", [["TENSOR", [1, 32, 147, 147], "float32"], ["TENSOR", [64, 32, 3, 3], "float32"], [1, 1], [1, 1], [1, 1], "NCHW", "float32"], {}, ["conv2d", [1, 32, 147, 147, "float32"], [64, 32, 3, 3, "float32"], [1, 1], [1, 1], [1, 1], "NCHW", "float32"], {"i": 18729199, "t": "direct", "c": null, "e": [["tile_f", "sp", [-1, 2, 2, 4]], ["tile_y", "sp", [-1, 1, 3, 1]], ["tile_x", "sp", [-1, 7, 21, 1]], ["tile_rc", "sp", [-1, 2]], ["tile_ry", "sp", [-1, 3]], ["tile_rx", "sp", [-1, 3]], ["auto_unroll_max_step", "ot", 1500], ["unroll_explicit", "ot", 1]]}], "r": [[0.00019200302917152858], 0, 2.5934836864471436, 1582423558.1028457], "v": 0.1}
{"i": ["cuda", "topi_nn_conv2d", [["TENSOR", [1, 32, 149, 149], "float32"], ["TENSOR", [32, 32, 3, 3], "float32"], [1, 1], [0, 0], [1, 1], "NCHW", "float32"], {}, ["conv2d", [1, 32, 149, 149, "float32"], [32, 32, 3, 3, "float32"], [1, 1], [0, 0], [1, 1], "NCHW", "float32"], {"i": 12485137, "t": "direct", "c": null, "e": [["tile_f", "sp", [-1, 1, 2, 8]], ["tile_y", "sp", [-1, 1, 3, 7]], ["tile_x", "sp", [-1, 1, 21, 1]], ["tile_rc", "sp", [-1, 2]], ["tile_ry", "sp", [-1, 3]], ["tile_rx", "sp", [-1, 3]], ["auto_unroll_max_step", "ot", 1500], ["unroll_explicit", "ot", 1]]}], "r": [[0.00010500127313915858], 0, 2.5902605056762695, 1582428776.4575825], "v": 0.1}
{"i": ["cuda", "topi_nn_conv2d", [["TENSOR", [1, 3, 299, 299], "float32"], ["TENSOR", [32, 3, 3, 3], "float32"], [2, 2], [0, 0], [1, 1], "NCHW", "float32"], {}, ["conv2d", [1, 3, 299, 299, "float32"], [32, 3, 3, 3, "float32"], [2, 2], [0, 0], [1, 1], "NCHW", "float32"], {"i": 20208, "t": "direct", "c": null, "e": [["tile_f", "sp", [-1, 4, 1, 8]], ["tile_y", "sp", [-1, 1, 1, 1]], ["tile_x", "sp", [-1, 1, 149, 1]], ["tile_rc", "sp", [-1, 1]], ["tile_ry", "sp", [-1, 3]], ["tile_rx", "sp", [-1, 3]], ["auto_unroll_max_step", "ot", 1500], ["unroll_explicit", "ot", 0]]}], "r": [[2.177723904647756e-05], 0, 1.6357049942016602, 1582433458.8522074], "v": 0.1}
