scripts_paper/tuned_logs_g4/resnet101_v1-quantized-5batches-naive-symbol.log
{"i": ["cuda", "topi_nn_conv2d", [["TENSOR", [1, 2048, 7, 7], "int8"], ["TENSOR", [512, 2048, 1, 1], "int8"], [1, 1], [0, 0], [1, 1], "NCHW", "int32"], {}, ["conv2d", [1, 2048, 7, 7, "int8"], [512, 2048, 1, 1, "int8"], [1, 1], [0, 0], [1, 1], "NCHW", "int32"], {"i": 701055, "t": "int8", "c": null, "e": [["tile_n", "sp", [-1, 1, 1, 1]], ["tile_f", "sp", [-1, 1, 4, 1]], ["tile_y", "sp", [-1, 1, 7, 1]], ["tile_x", "sp", [-1, 1, 1, 1]], ["fuse_yx", "ot", 1], ["tile_rc", "sp", [-1, 4]], ["tile_ry", "sp", [-1, 1]], ["tile_rx", "sp", [-1, 1]], ["reorder_inner", "re", [0, 1, 2]], ["AA_double_buffer", "ot", 1], ["WW_double_buffer", "ot", 1], ["auto_unroll_max_step", "ot", 0]]}], "r": [[3.789258922022006e-05], 0, 1.906123399734497, 1581388862.492553], "v": 0.1}
{"i": ["cuda", "topi_nn_conv2d", [["TENSOR", [1, 512, 7, 7], "int8"], ["TENSOR", [2048, 512, 1, 1], "int8"], [1, 1], [0, 0], [1, 1], "NCHW", "int32"], {}, ["conv2d", [1, 512, 7, 7, "int8"], [2048, 512, 1, 1, "int8"], [1, 1], [0, 0], [1, 1], "NCHW", "int32"], {"i": 3405847, "t": "int8", "c": null, "e": [["tile_n", "sp", [-1, 1, 1, 1]], ["tile_f", "sp", [-1, 1, 8, 1]], ["tile_y", "sp", [-1, 7, 1, 1]], ["tile_x", "sp", [-1, 1, 7, 1]], ["fuse_yx", "ot", 1], ["tile_rc", "sp", [-1, 8]], ["tile_ry", "sp", [-1, 1]], ["tile_rx", "sp", [-1, 1]], ["reorder_inner", "re", [0, 1, 2]], ["AA_double_buffer", "ot", 0], ["WW_double_buffer", "ot", 1], ["auto_unroll_max_step", "ot", 1500]]}], "r": [[1.7106135131195335e-05], 0, 1.979856014251709, 1581400548.4875832], "v": 0.1}
{"i": ["cuda", "topi_nn_conv2d", [["TENSOR", [1, 1024, 14, 14], "int8"], ["TENSOR", [2048, 1024, 1, 1], "int8"], [2, 2], [0, 0], [1, 1], "NCHW", "int32"], {}, ["conv2d", [1, 1024, 14, 14, "int8"], [2048, 1024, 1, 1, "int8"], [2, 2], [0, 0], [1, 1], "NCHW", "int32"], {"i": 3328414, "t": "int8", "c": null, "e": [["tile_n", "sp", [-1, 1, 1, 1]], ["tile_f", "sp", [-1, 1, 16, 1]], ["tile_y", "sp", [-1, 7, 1, 1]], ["tile_x", "sp", [-1, 1, 7, 1]], ["fuse_yx", "ot", 1], ["tile_rc", "sp", [-1, 16]], ["tile_ry", "sp", [-1, 1]], ["tile_rx", "sp", [-1, 1]], ["reorder_inner", "re", [2, 0, 1]], ["AA_double_buffer", "ot", 0], ["WW_double_buffer", "ot", 0], ["auto_unroll_max_step", "ot", 1500]]}], "r": [[3.572427404063206e-05], 0, 2.280242919921875, 1581404496.7051332], "v": 0.1}
{"i": ["cuda", "topi_nn_conv2d", [["TENSOR", [1, 1024, 14, 14], "int8"], ["TENSOR", [512, 1024, 1, 1], "int8"], [2, 2], [0, 0], [1, 1], "NCHW", "int32"], {}, ["conv2d", [1, 1024, 14, 14, "int8"], [512, 1024, 1, 1, "int8"], [2, 2], [0, 0], [1, 1], "NCHW", "int32"], {"i": 1634901, "t": "int8", "c": null, "e": [["tile_n", "sp", [-1, 1, 1, 1]], ["tile_f", "sp", [-1, 1, 8, 1]], ["tile_y", "sp", [-1, 1, 1, 1]], ["tile_x", "sp", [-1, 1, 7, 1]], ["fuse_yx", "ot", 1], ["tile_rc", "sp", [-1, 4]], ["tile_ry", "sp", [-1, 1]], ["tile_rx", "sp", [-1, 1]], ["reorder_inner", "re", [2, 1, 0]], ["AA_double_buffer", "ot", 1], ["WW_double_buffer", "ot", 1], ["auto_unroll_max_step", "ot", 512]]}], "r": [[2.0113647667514843e-05], 0, 1.8636510372161865, 1581414658.0606704], "v": 0.1}
{"i": ["cuda", "topi_nn_conv2d", [["TENSOR", [1, 1024, 14, 14], "int8"], ["TENSOR", [256, 1024, 1, 1], "int8"], [1, 1], [0, 0], [1, 1], "NCHW", "int32"], {}, ["conv2d", [1, 1024, 14, 14, "int8"], [256, 1024, 1, 1, "int8"], [1, 1], [0, 0], [1, 1], "NCHW", "int32"], {"i": 18401404, "t": "int8", "c": null, "e": [["tile_n", "sp", [-1, 1, 1, 1]], ["tile_f", "sp", [-1, 1, 1, 2]], ["tile_y", "sp", [-1, 1, 14, 1]], ["tile_x", "sp", [-1, 1, 7, 2]], ["fuse_yx", "ot", 1], ["tile_rc", "sp", [-1, 16]], ["tile_ry", "sp", [-1, 1]], ["tile_rx", "sp", [-1, 1]], ["reorder_inner", "re", [2, 1, 0]], ["AA_double_buffer", "ot", 1], ["WW_double_buffer", "ot", 1], ["auto_unroll_max_step", "ot", 512]]}], "r": [[1.8711552268244575e-05], 0, 2.3093740940093994, 1581424174.3981674], "v": 0.1}
{"i": ["cuda", "topi_nn_conv2d", [["TENSOR", [1, 256, 14, 14], "int8"], ["TENSOR", [1024, 256, 1, 1], "int8"], [1, 1], [0, 0], [1, 1], "NCHW", "int32"], {}, ["conv2d", [1, 256, 14, 14, "int8"], [1024, 256, 1, 1, "int8"], [1, 1], [0, 0], [1, 1], "NCHW", "int32"], {"i": 40614120, "t": "int8", "c": null, "e": [["tile_n", "sp", [-1, 1, 1, 1]], ["tile_f", "sp", [-1, 1, 16, 1]], ["tile_y", "sp", [-1, 7, 1, 1]], ["tile_x", "sp", [-1, 1, 14, 1]], ["fuse_yx", "ot", 1], ["tile_rc", "sp", [-1, 16]], ["tile_ry", "sp", [-1, 1]], ["tile_rx", "sp", [-1, 1]], ["reorder_inner", "re", [1, 0, 2]], ["AA_double_buffer", "ot", 1], ["WW_double_buffer", "ot", 1], ["auto_unroll_max_step", "ot", 1500]]}], "r": [[1.2771032077115783e-05], 0, 2.7940258979797363, 1581435368.0885944], "v": 0.1}
{"i": ["cuda", "topi_nn_conv2d", [["TENSOR", [1, 512, 28, 28], "int8"], ["TENSOR", [1024, 512, 1, 1], "int8"], [2, 2], [0, 0], [1, 1], "NCHW", "int32"], {}, ["conv2d", [1, 512, 28, 28, "int8"], [1024, 512, 1, 1, "int8"], [2, 2], [0, 0], [1, 1], "NCHW", "int32"], {"i": 19198344, "t": "int8", "c": null, "e": [["tile_n", "sp", [-1, 1, 1, 1]], ["tile_f", "sp", [-1, 1, 8, 4]], ["tile_y", "sp", [-1, 2, 1, 1]], ["tile_x", "sp", [-1, 1, 14, 1]], ["fuse_yx", "ot", 0], ["tile_rc", "sp", [-1, 8]], ["tile_ry", "sp", [-1, 1]], ["tile_rx", "sp", [-1, 1]], ["reorder_inner", "re", [2, 0, 1]], ["AA_double_buffer", "ot", 0], ["WW_double_buffer", "ot", 0], ["auto_unroll_max_step", "ot", 512]]}], "r": [[2.7928925904041596e-05], 0, 2.131326198577881, 1581445557.8202155], "v": 0.1}
{"i": ["cuda", "topi_nn_conv2d", [["TENSOR", [1, 512, 28, 28], "int8"], ["TENSOR", [256, 512, 1, 1], "int8"], [2, 2], [0, 0], [1, 1], "NCHW", "int32"], {}, ["conv2d", [1, 512, 28, 28, "int8"], [256, 512, 1, 1, "int8"], [2, 2], [0, 0], [1, 1], "NCHW", "int32"], {"i": 23493894, "t": "int8", "c": null, "e": [["tile_n", "sp", [-1, 1, 1, 1]], ["tile_f", "sp", [-1, 1, 8, 1]], ["tile_y", "sp", [-1, 1, 1, 2]], ["tile_x", "sp", [-1, 1, 14, 1]], ["fuse_yx", "ot", 0], ["tile_rc", "sp", [-1, 4]], ["tile_ry", "sp", [-1, 1]], ["tile_rx", "sp", [-1, 1]], ["reorder_inner", "re", [1, 0, 2]], ["AA_double_buffer", "ot", 1], ["WW_double_buffer", "ot", 1], ["auto_unroll_max_step", "ot", 1500]]}], "r": [[1.0997388292030751e-05], 0, 2.808953046798706, 1581462706.5222387], "v": 0.1}
{"i": ["cuda", "topi_nn_conv2d", [["TENSOR", [1, 512, 28, 28], "int8"], ["TENSOR", [128, 512, 1, 1], "int8"], [1, 1], [0, 0], [1, 1], "NCHW", "int32"], {}, ["conv2d", [1, 512, 28, 28, "int8"], [128, 512, 1, 1, "int8"], [1, 1], [0, 0], [1, 1], "NCHW", "int32"], {"i": 82739279, "t": "int8", "c": null, "e": [["tile_n", "sp", [-1, 1, 1, 1]], ["tile_f", "sp", [-1, 2, 2, 1]], ["tile_y", "sp", [-1, 2, 2, 1]], ["tile_x", "sp", [-1, 1, 28, 1]], ["fuse_yx", "ot", 1], ["tile_rc", "sp", [-1, 32]], ["tile_ry", "sp", [-1, 1]], ["tile_rx", "sp", [-1, 1]], ["reorder_inner", "re", [1, 2, 0]], ["AA_double_buffer", "ot", 1], ["WW_double_buffer", "ot", 0], ["auto_unroll_max_step", "ot", 1500]]}], "r": [[1.3479549997101618e-05], 0, 2.6332597732543945, 1581472465.9415226], "v": 0.1}
{"i": ["cuda", "topi_nn_conv2d", [["TENSOR", [1, 128, 28, 28], "int8"], ["TENSOR", [512, 128, 1, 1], "int8"], [1, 1], [0, 0], [1, 1], "NCHW", "int32"], {}, ["conv2d", [1, 128, 28, 28, "int8"], [512, 128, 1, 1, "int8"], [1, 1], [0, 0], [1, 1], "NCHW", "int32"], {"i": 153300856, "t": "int8", "c": null, "e": [["tile_n", "sp", [-1, 1, 1, 1]], ["tile_f", "sp", [-1, 2, 4, 1]], ["tile_y", "sp", [-1, 1, 1, 4]], ["tile_x", "sp", [-1, 1, 28, 1]], ["fuse_yx", "ot", 0], ["tile_rc", "sp", [-1, 8]], ["tile_ry", "sp", [-1, 1]], ["tile_rx", "sp", [-1, 1]], ["reorder_inner", "re", [0, 1, 2]], ["AA_double_buffer", "ot", 1], ["WW_double_buffer", "ot", 1], ["auto_unroll_max_step", "ot", 1500]]}], "r": [[1.0401837410460874e-05], 0, 2.6695313453674316, 1581488661.1509168], "v": 0.1}
{"i": ["cuda", "topi_nn_conv2d", [["TENSOR", [1, 256, 56, 56], "int8"], ["TENSOR", [512, 256, 1, 1], "int8"], [2, 2], [0, 0], [1, 1], "NCHW", "int32"], {}, ["conv2d", [1, 256, 56, 56, "int8"], [512, 256, 1, 1, "int8"], [2, 2], [0, 0], [1, 1], "NCHW", "int32"], {"i": 100307778, "t": "int8", "c": null, "e": [["tile_n", "sp", [-1, 1, 1, 1]], ["tile_f", "sp", [-1, 8, 4, 1]], ["tile_y", "sp", [-1, 1, 1, 2]], ["tile_x", "sp", [-1, 1, 28, 1]], ["fuse_yx", "ot", 0], ["tile_rc", "sp", [-1, 4]], ["tile_ry", "sp", [-1, 1]], ["tile_rx", "sp", [-1, 1]], ["reorder_inner", "re", [0, 2, 1]], ["AA_double_buffer", "ot", 0], ["WW_double_buffer", "ot", 1], ["auto_unroll_max_step", "ot", 512]]}], "r": [[2.1633260252654704e-05], 0, 2.20021653175354, 1581504540.2242773], "v": 0.1}
{"i": ["cuda", "topi_nn_conv2d", [["TENSOR", [1, 256, 56, 56], "int8"], ["TENSOR", [128, 256, 1, 1], "int8"], [2, 2], [0, 0], [1, 1], "NCHW", "int32"], {}, ["conv2d", [1, 256, 56, 56, "int8"], [128, 256, 1, 1, "int8"], [2, 2], [0, 0], [1, 1], "NCHW", "int32"], {"i": 84528656, "t": "int8", "c": null, "e": [["tile_n", "sp", [-1, 1, 1, 1]], ["tile_f", "sp", [-1, 2, 8, 1]], ["tile_y", "sp", [-1, 1, 1, 1]], ["tile_x", "sp", [-1, 2, 14, 1]], ["fuse_yx", "ot", 1], ["tile_rc", "sp", [-1, 4]], ["tile_ry", "sp", [-1, 1]], ["tile_rx", "sp", [-1, 1]], ["reorder_inner", "re", [0, 2, 1]], ["AA_double_buffer", "ot", 1], ["WW_double_buffer", "ot", 1], ["auto_unroll_max_step", "ot", 1500]]}], "r": [[8.661084945460073e-06], 0, 2.2383902072906494, 1581525994.7972608], "v": 0.1}
{"i": ["cuda", "topi_nn_conv2d", [["TENSOR", [1, 256, 56, 56], "int8"], ["TENSOR", [64, 256, 1, 1], "int8"], [1, 1], [0, 0], [1, 1], "NCHW", "int32"], {}, ["conv2d", [1, 256, 56, 56, "int8"], [64, 256, 1, 1, "int8"], [1, 1], [0, 0], [1, 1], "NCHW", "int32"], {"i": 159346278, "t": "int8", "c": null, "e": [["tile_n", "sp", [-1, 1, 1, 1]], ["tile_f", "sp", [-1, 1, 2, 4]], ["tile_y", "sp", [-1, 1, 1, 2]], ["tile_x", "sp", [-1, 1, 56, 1]], ["fuse_yx", "ot", 1], ["tile_rc", "sp", [-1, 32]], ["tile_ry", "sp", [-1, 1]], ["tile_rx", "sp", [-1, 1]], ["reorder_inner", "re", [1, 0, 2]], ["AA_double_buffer", "ot", 0], ["WW_double_buffer", "ot", 0], ["auto_unroll_max_step", "ot", 1500]]}], "r": [[1.0873065432492819e-05], 0, 2.918614149093628, 1581533908.7446115], "v": 0.1}
{"i": ["cuda", "topi_nn_conv2d", [["TENSOR", [1, 64, 56, 56], "int8"], ["TENSOR", [256, 64, 1, 1], "int8"], [1, 1], [0, 0], [1, 1], "NCHW", "int32"], {}, ["conv2d", [1, 64, 56, 56, "int8"], [256, 64, 1, 1, "int8"], [1, 1], [0, 0], [1, 1], "NCHW", "int32"], {"i": 239968580, "t": "int8", "c": null, "e": [["tile_n", "sp", [-1, 1, 1, 1]], ["tile_f", "sp", [-1, 1, 2, 8]], ["tile_y", "sp", [-1, 1, 1, 4]], ["tile_x", "sp", [-1, 1, 56, 1]], ["fuse_yx", "ot", 0], ["tile_rc", "sp", [-1, 8]], ["tile_ry", "sp", [-1, 1]], ["tile_rx", "sp", [-1, 1]], ["reorder_inner", "re", [1, 0, 2]], ["AA_double_buffer", "ot", 1], ["WW_double_buffer", "ot", 1], ["auto_unroll_max_step", "ot", 512]]}], "r": [[1.1577844084200338e-05], 0, 2.034646511077881, 1581553560.021806], "v": 0.1}
{"i": ["cuda", "topi_nn_conv2d", [["TENSOR", [1, 64, 56, 56], "int8"], ["TENSOR", [64, 64, 1, 1], "int8"], [1, 1], [0, 0], [1, 1], "NCHW", "int32"], {}, ["conv2d", [1, 64, 56, 56, "int8"], [64, 64, 1, 1, "int8"], [1, 1], [0, 0], [1, 1], "NCHW", "int32"], {"i": 66386278, "t": "int8", "c": null, "e": [["tile_n", "sp", [-1, 1, 1, 1]], ["tile_f", "sp", [-1, 1, 2, 4]], ["tile_y", "sp", [-1, 1, 1, 2]], ["tile_x", "sp", [-1, 1, 56, 1]], ["fuse_yx", "ot", 0], ["tile_rc", "sp", [-1, 8]], ["tile_ry", "sp", [-1, 1]], ["tile_rx", "sp", [-1, 1]], ["reorder_inner", "re", [2, 1, 0]], ["AA_double_buffer", "ot", 0], ["WW_double_buffer", "ot", 0], ["auto_unroll_max_step", "ot", 512]]}], "r": [[4.64694567683388e-06], 0, 2.0863137245178223, 1581568767.5905871], "v": 0.1}
{"i": ["cuda", "topi_nn_conv2d", [["TENSOR", [1, 3, 230, 230], "int8"], ["TENSOR", [64, 3, 7, 7], "int8"], [2, 2], [0, 0], [1, 1], "NCHW", "int32"], {}, ["conv2d", [1, 3, 230, 230, "int8"], [64, 3, 7, 7, "int8"], [2, 2], [0, 0], [1, 1], "NCHW", "int32"], {"i": 34002011, "t": "direct", "c": null, "e": [["tile_f", "sp", [-1, 1, 4, 8]], ["tile_y", "sp", [-1, 1, 1, 2]], ["tile_x", "sp", [-1, 2, 14, 4]], ["tile_rc", "sp", [-1, 1]], ["tile_ry", "sp", [-1, 1]], ["tile_rx", "sp", [-1, 7]], ["auto_unroll_max_step", "ot", 1500], ["unroll_explicit", "ot", 0]]}], "r": [[4.859219560395241e-05], 0, 2.383044719696045, 1581580323.0824764], "v": 0.1}
{"i": ["cuda", "topi_nn_conv2d", [["TENSOR", [1, 512, 9, 9], "int8"], ["TENSOR", [512, 512, 3, 3], "int8"], [1, 1], [0, 0], [1, 1], "NCHW", "int32"], {}, ["conv2d", [1, 512, 9, 9, "int8"], [512, 512, 3, 3, "int8"], [1, 1], [0, 0], [1, 1], "NCHW", "int32"], {"i": 5263929, "t": "int8", "c": null, "e": [["tile_n", "sp", [-1, 1, 1, 1]], ["tile_f", "sp", [-1, 2, 2, 1]], ["tile_y", "sp", [-1, 1, 7, 1]], ["tile_x", "sp", [-1, 1, 7, 1]], ["fuse_yx", "ot", 1], ["tile_rc", "sp", [-1, 4]], ["tile_ry", "sp", [-1, 3]], ["tile_rx", "sp", [-1, 3]], ["reorder_inner", "re", [0, 1, 2]], ["AA_double_buffer", "ot", 1], ["WW_double_buffer", "ot", 1], ["auto_unroll_max_step", "ot", 512]]}], "r": [[4.508491320176279e-05], 0, 2.1880581378936768, 1582684736.361104], "v": 0.1}
{"i": ["cuda", "topi_nn_conv2d", [["TENSOR", [1, 256, 16, 16], "int8"], ["TENSOR", [256, 256, 3, 3], "int8"], [1, 1], [0, 0], [1, 1], "NCHW", "int32"], {}, ["conv2d", [1, 256, 16, 16, "int8"], [256, 256, 3, 3, "int8"], [1, 1], [0, 0], [1, 1], "NCHW", "int32"], {"i": 44973860, "t": "int8", "c": null, "e": [["tile_n", "sp", [-1, 1, 1, 1]], ["tile_f", "sp", [-1, 2, 2, 1]], ["tile_y", "sp", [-1, 1, 7, 2]], ["tile_x", "sp", [-1, 1, 7, 1]], ["fuse_yx", "ot", 1], ["tile_rc", "sp", [-1, 4]], ["tile_ry", "sp", [-1, 3]], ["tile_rx", "sp", [-1, 1]], ["reorder_inner", "re", [0, 2, 1]], ["AA_double_buffer", "ot", 0], ["WW_double_buffer", "ot", 1], ["auto_unroll_max_step", "ot", 512]]}], "r": [[3.126647197679019e-05], 0, 2.5343263149261475, 1582688331.6617315], "v": 0.1}
{"i": ["cuda", "topi_nn_conv2d", [["TENSOR", [1, 128, 30, 30], "int8"], ["TENSOR", [128, 128, 3, 3], "int8"], [1, 1], [0, 0], [1, 1], "NCHW", "int32"], {}, ["conv2d", [1, 128, 30, 30, "int8"], [128, 128, 3, 3, "int8"], [1, 1], [0, 0], [1, 1], "NCHW", "int32"], {"i": 259790171, "t": "int8", "c": null, "e": [["tile_n", "sp", [-1, 1, 1, 1]], ["tile_f", "sp", [-1, 1, 4, 1]], ["tile_y", "sp", [-1, 1, 1, 7]], ["tile_x", "sp", [-1, 1, 28, 1]], ["fuse_yx", "ot", 1], ["tile_rc", "sp", [-1, 8]], ["tile_ry", "sp", [-1, 3]], ["tile_rx", "sp", [-1, 1]], ["reorder_inner", "re", [0, 1, 2]], ["AA_double_buffer", "ot", 0], ["WW_double_buffer", "ot", 1], ["auto_unroll_max_step", "ot", 1500]]}], "r": [[1.8303065953654187e-05], 0, 3.358682155609131, 1582708907.3653867], "v": 0.1}
{"i": ["cuda", "topi_nn_conv2d", [["TENSOR", [1, 64, 58, 58], "int8"], ["TENSOR", [64, 64, 3, 3], "int8"], [1, 1], [0, 0], [1, 1], "NCHW", "int32"], {}, ["conv2d", [1, 64, 58, 58, "int8"], [64, 64, 3, 3, "int8"], [1, 1], [0, 0], [1, 1], "NCHW", "int32"], {"i": 541491204, "t": "int8", "c": null, "e": [["tile_n", "sp", [-1, 1, 1, 1]], ["tile_f", "sp", [-1, 1, 4, 1]], ["tile_y", "sp", [-1, 1, 1, 7]], ["tile_x", "sp", [-1, 1, 56, 1]], ["fuse_yx", "ot", 1], ["tile_rc", "sp", [-1, 8]], ["tile_ry", "sp", [-1, 3]], ["tile_rx", "sp", [-1, 1]], ["reorder_inner", "re", [0, 1, 2]], ["AA_double_buffer", "ot", 0], ["WW_double_buffer", "ot", 1], ["auto_unroll_max_step", "ot", 1500]]}], "r": [[1.7420566033552585e-05], 0, 3.2959747314453125, 1582732691.189245], "v": 0.1}
