scripts_paper/backup_tuned_logs_g4/inceptionv3-quantized-5batches-naive-symbol.log
{"i": ["cuda", "topi_nn_conv2d", [["TENSOR", [1, 2048, 8, 8], "int8"], ["TENSOR", [192, 2048, 1, 1], "int8"], [1, 1], [0, 0], [1, 1], "NCHW", "int32"], {}, ["conv2d", [1, 2048, 8, 8, "int8"], [192, 2048, 1, 1, "int8"], [1, 1], [0, 0], [1, 1], "NCHW", "int32"], {"i": 78033789, "t": "int8", "c": null, "e": [["tile_n", "sp", [-1, 1, 1, 1]], ["tile_f", "sp", [-1, 1, 6, 1]], ["tile_y", "sp", [-1, 1, 2, 1]], ["tile_x", "sp", [-1, 1, 8, 1]], ["fuse_yx", "ot", 1], ["tile_rc", "sp", [-1, 64]], ["tile_ry", "sp", [-1, 1]], ["tile_rx", "sp", [-1, 1]], ["reorder_inner", "re", [1, 2, 0]], ["AA_double_buffer", "ot", 1], ["WW_double_buffer", "ot", 1], ["auto_unroll_max_step", "ot", 1500]]}], "r": [[1.1740305474781912e-05], 0, 1.8606815338134766, 1581367690.6370149], "v": 0.1}
{"i": ["cuda", "topi_nn_conv2d", [["TENSOR", [1, 2048, 8, 8], "int8"], ["TENSOR", [448, 2048, 1, 1], "int8"], [1, 1], [0, 0], [1, 1], "NCHW", "int32"], {}, ["conv2d", [1, 2048, 8, 8, "int8"], [448, 2048, 1, 1, "int8"], [1, 1], [0, 0], [1, 1], "NCHW", "int32"], {"i": 49994998, "t": "int8", "c": null, "e": [["tile_n", "sp", [-1, 1, 1, 1]], ["tile_f", "sp", [-1, 1, 4, 1]], ["tile_y", "sp", [-1, 1, 4, 1]], ["tile_x", "sp", [-1, 1, 4, 2]], ["fuse_yx", "ot", 0], ["tile_rc", "sp", [-1, 64]], ["tile_ry", "sp", [-1, 1]], ["tile_rx", "sp", [-1, 1]], ["reorder_inner", "re", [1, 0, 2]], ["AA_double_buffer", "ot", 1], ["WW_double_buffer", "ot", 1], ["auto_unroll_max_step", "ot", 512]]}], "r": [[1.77141888502795e-05], 0, 2.8691153526306152, 1581377660.5133054], "v": 0.1}
{"i": ["cuda", "topi_nn_conv2d", [["TENSOR", [1, 2048, 8, 8], "int8"], ["TENSOR", [384, 2048, 1, 1], "int8"], [1, 1], [0, 0], [1, 1], "NCHW", "int32"], {}, ["conv2d", [1, 2048, 8, 8, "int8"], [384, 2048, 1, 1, "int8"], [1, 1], [0, 0], [1, 1], "NCHW", "int32"], {"i": 81873596, "t": "int8", "c": null, "e": [["tile_n", "sp", [-1, 1, 1, 1]], ["tile_f", "sp", [-1, 1, 4, 1]], ["tile_y", "sp", [-1, 1, 4, 1]], ["tile_x", "sp", [-1, 1, 4, 2]], ["fuse_yx", "ot", 1], ["tile_rc", "sp", [-1, 64]], ["tile_ry", "sp", [-1, 1]], ["tile_rx", "sp", [-1, 1]], ["reorder_inner", "re", [1, 2, 0]], ["AA_double_buffer", "ot", 1], ["WW_double_buffer", "ot", 1], ["auto_unroll_max_step", "ot", 512]]}], "r": [[1.7185326744271175e-05], 0, 2.861117124557495, 1581390773.263361], "v": 0.1}
{"i": ["cuda", "topi_nn_conv2d", [["TENSOR", [1, 2048, 8, 8], "int8"], ["TENSOR", [320, 2048, 1, 1], "int8"], [1, 1], [0, 0], [1, 1], "NCHW", "int32"], {}, ["conv2d", [1, 2048, 8, 8, "int8"], [320, 2048, 1, 1, "int8"], [1, 1], [0, 0], [1, 1], "NCHW", "int32"], {"i": 53393918, "t": "int8", "c": null, "e": [["tile_n", "sp", [-1, 1, 1, 1]], ["tile_f", "sp", [-1, 1, 4, 1]], ["tile_y", "sp", [-1, 2, 2, 1]], ["tile_x", "sp", [-1, 1, 8, 1]], ["fuse_yx", "ot", 1], ["tile_rc", "sp", [-1, 64]], ["tile_ry", "sp", [-1, 1]], ["tile_rx", "sp", [-1, 1]], ["reorder_inner", "re", [2, 1, 0]], ["AA_double_buffer", "ot", 1], ["WW_double_buffer", "ot", 1], ["auto_unroll_max_step", "ot", 512]]}], "r": [[1.3510632915817069e-05], 0, 3.105245590209961, 1581399861.1498544], "v": 0.1}
{"i": ["cuda", "topi_nn_conv2d", [["TENSOR", [1, 1280, 8, 8], "int8"], ["TENSOR", [192, 1280, 1, 1], "int8"], [1, 1], [0, 0], [1, 1], "NCHW", "int32"], {}, ["conv2d", [1, 1280, 8, 8, "int8"], [192, 1280, 1, 1, "int8"], [1, 1], [0, 0], [1, 1], "NCHW", "int32"], {"i": 106034203, "t": "int8", "c": null, "e": [["tile_n", "sp", [-1, 1, 1, 1]], ["tile_f", "sp", [-1, 1, 4, 1]], ["tile_y", "sp", [-1, 1, 4, 1]], ["tile_x", "sp", [-1, 1, 8, 1]], ["fuse_yx", "ot", 1], ["tile_rc", "sp", [-1, 32]], ["tile_ry", "sp", [-1, 1]], ["tile_rx", "sp", [-1, 1]], ["reorder_inner", "re", [0, 2, 1]], ["AA_double_buffer", "ot", 1], ["WW_double_buffer", "ot", 1], ["auto_unroll_max_step", "ot", 1500]]}], "r": [[8.281317270235175e-06], 0, 1.9918489456176758, 1581412196.2178867], "v": 0.1}
{"i": ["cuda", "topi_nn_conv2d", [["TENSOR", [1, 448, 10, 10], "int8"], ["TENSOR", [384, 448, 3, 3], "int8"], [1, 1], [0, 0], [1, 1], "NCHW", "int32"], {}, ["conv2d", [1, 448, 10, 10, "int8"], [384, 448, 3, 3, "int8"], [1, 1], [0, 0], [1, 1], "NCHW", "int32"], {"i": 404408068, "t": "int8", "c": null, "e": [["tile_n", "sp", [-1, 1, 1, 1]], ["tile_f", "sp", [-1, 1, 6, 1]], ["tile_y", "sp", [-1, 1, 2, 2]], ["tile_x", "sp", [-1, 1, 8, 1]], ["fuse_yx", "ot", 1], ["tile_rc", "sp", [-1, 16]], ["tile_ry", "sp", [-1, 3]], ["tile_rx", "sp", [-1, 1]], ["reorder_inner", "re", [1, 0, 2]], ["AA_double_buffer", "ot", 1], ["WW_double_buffer", "ot", 0], ["auto_unroll_max_step", "ot", 1500]]}], "r": [[2.243126479809976e-05], 0, 2.8791959285736084, 1581433466.5723758], "v": 0.1}
{"i": ["cuda", "topi_nn_conv2d", [["TENSOR", [1, 1280, 8, 8], "int8"], ["TENSOR", [448, 1280, 1, 1], "int8"], [1, 1], [0, 0], [1, 1], "NCHW", "int32"], {}, ["conv2d", [1, 1280, 8, 8, "int8"], [448, 1280, 1, 1, "int8"], [1, 1], [0, 0], [1, 1], "NCHW", "int32"], {"i": 68571049, "t": "int8", "c": null, "e": [["tile_n", "sp", [-1, 1, 1, 1]], ["tile_f", "sp", [-1, 1, 8, 1]], ["tile_y", "sp", [-1, 1, 2, 2]], ["tile_x", "sp", [-1, 1, 8, 1]], ["fuse_yx", "ot", 0], ["tile_rc", "sp", [-1, 64]], ["tile_ry", "sp", [-1, 1]], ["tile_rx", "sp", [-1, 1]], ["reorder_inner", "re", [0, 2, 1]], ["AA_double_buffer", "ot", 1], ["WW_double_buffer", "ot", 1], ["auto_unroll_max_step", "ot", 512]]}], "r": [[1.1757417666192314e-05], 0, 2.9759836196899414, 1581446097.3757787], "v": 0.1}
{"i": ["cuda", "topi_nn_conv2d", [["TENSOR", [1, 384, 10, 8], "int8"], ["TENSOR", [384, 384, 3, 1], "int8"], [1, 1], [0, 0], [1, 1], "NCHW", "int32"], {}, ["conv2d", [1, 384, 10, 8, "int8"], [384, 384, 3, 1, "int8"], [1, 1], [0, 0], [1, 1], "NCHW", "int32"], {"i": 120196868, "t": "int8", "c": null, "e": [["tile_n", "sp", [-1, 1, 1, 1]], ["tile_f", "sp", [-1, 1, 6, 1]], ["tile_y", "sp", [-1, 1, 2, 2]], ["tile_x", "sp", [-1, 1, 8, 1]], ["fuse_yx", "ot", 1], ["tile_rc", "sp", [-1, 48]], ["tile_ry", "sp", [-1, 3]], ["tile_rx", "sp", [-1, 1]], ["reorder_inner", "re", [1, 2, 0]], ["AA_double_buffer", "ot", 0], ["WW_double_buffer", "ot", 0], ["auto_unroll_max_step", "ot", 512]]}], "r": [[7.874404359459635e-06], 0, 2.2526681423187256, 1581459322.9918773], "v": 0.1}
{"i": ["cuda", "topi_nn_conv2d", [["TENSOR", [1, 384, 8, 10], "int8"], ["TENSOR", [384, 384, 1, 3], "int8"], [1, 1], [0, 0], [1, 1], "NCHW", "int32"], {}, ["conv2d", [1, 384, 8, 10, "int8"], [384, 384, 1, 3, "int8"], [1, 1], [0, 0], [1, 1], "NCHW", "int32"], {"i": 128798468, "t": "int8", "c": null, "e": [["tile_n", "sp", [-1, 1, 1, 1]], ["tile_f", "sp", [-1, 1, 6, 1]], ["tile_y", "sp", [-1, 1, 2, 2]], ["tile_x", "sp", [-1, 1, 8, 1]], ["fuse_yx", "ot", 1], ["tile_rc", "sp", [-1, 48]], ["tile_ry", "sp", [-1, 1]], ["tile_rx", "sp", [-1, 3]], ["reorder_inner", "re", [2, 1, 0]], ["AA_double_buffer", "ot", 0], ["WW_double_buffer", "ot", 0], ["auto_unroll_max_step", "ot", 512]]}], "r": [[8.504257437156032e-06], 0, 2.5444746017456055, 1581467810.9833262], "v": 0.1}
{"i": ["cuda", "topi_nn_conv2d", [["TENSOR", [1, 1280, 8, 8], "int8"], ["TENSOR", [384, 1280, 1, 1], "int8"], [1, 1], [0, 0], [1, 1], "NCHW", "int32"], {}, ["conv2d", [1, 1280, 8, 8, "int8"], [384, 1280, 1, 1, "int8"], [1, 1], [0, 0], [1, 1], "NCHW", "int32"], {"i": 117238281, "t": "int8", "c": null, "e": [["tile_n", "sp", [-1, 1, 1, 1]], ["tile_f", "sp", [-1, 1, 8, 1]], ["tile_y", "sp", [-1, 2, 2, 1]], ["tile_x", "sp", [-1, 1, 8, 1]], ["fuse_yx", "ot", 0], ["tile_rc", "sp", [-1, 64]], ["tile_ry", "sp", [-1, 1]], ["tile_rx", "sp", [-1, 1]], ["reorder_inner", "re", [2, 0, 1]], ["AA_double_buffer", "ot", 1], ["WW_double_buffer", "ot", 1], ["auto_unroll_max_step", "ot", 512]]}], "r": [[1.1969706238456803e-05], 0, 2.6830859184265137, 1581486686.3932102], "v": 0.1}
{"i": ["cuda", "topi_nn_conv2d", [["TENSOR", [1, 1280, 8, 8], "int8"], ["TENSOR", [320, 1280, 1, 1], "int8"], [1, 1], [0, 0], [1, 1], "NCHW", "int32"], {}, ["conv2d", [1, 1280, 8, 8, "int8"], [320, 1280, 1, 1, "int8"], [1, 1], [0, 0], [1, 1], "NCHW", "int32"], {"i": 107098198, "t": "int8", "c": null, "e": [["tile_n", "sp", [-1, 1, 1, 1]], ["tile_f", "sp", [-1, 1, 4, 1]], ["tile_y", "sp", [-1, 1, 4, 1]], ["tile_x", "sp", [-1, 1, 8, 1]], ["fuse_yx", "ot", 0], ["tile_rc", "sp", [-1, 8]], ["tile_ry", "sp", [-1, 1]], ["tile_rx", "sp", [-1, 1]], ["reorder_inner", "re", [1, 0, 2]], ["AA_double_buffer", "ot", 1], ["WW_double_buffer", "ot", 1], ["auto_unroll_max_step", "ot", 1500]]}], "r": [[8.356959862014445e-06], 0, 3.0821921825408936, 1581497347.9831142], "v": 0.1}
{"i": ["cuda", "topi_nn_conv2d", [["TENSOR", [1, 192, 17, 17], "int8"], ["TENSOR", [192, 192, 3, 3], "int8"], [2, 2], [0, 0], [1, 1], "NCHW", "int32"], {}, ["conv2d", [1, 192, 17, 17, "int8"], [192, 192, 3, 3, "int8"], [2, 2], [0, 0], [1, 1], "NCHW", "int32"], {"i": 307314597, "t": "int8", "c": null, "e": [["tile_n", "sp", [-1, 1, 1, 1]], ["tile_f", "sp", [-1, 1, 12, 1]], ["tile_y", "sp", [-1, 1, 2, 1]], ["tile_x", "sp", [-1, 1, 4, 2]], ["fuse_yx", "ot", 1], ["tile_rc", "sp", [-1, 4]], ["tile_ry", "sp", [-1, 1]], ["tile_rx", "sp", [-1, 3]], ["reorder_inner", "re", [1, 0, 2]], ["AA_double_buffer", "ot", 1], ["WW_double_buffer", "ot", 1], ["auto_unroll_max_step", "ot", 1500]]}], "r": [[1.1589406181688782e-05], 0, 3.7807369232177734, 1581513477.1574743], "v": 0.1}
{"i": ["cuda", "topi_nn_conv2d", [["TENSOR", [1, 192, 17, 17], "int8"], ["TENSOR", [320, 192, 3, 3], "int8"], [2, 2], [0, 0], [1, 1], "NCHW", "int32"], {}, ["conv2d", [1, 192, 17, 17, "int8"], [320, 192, 3, 3, "int8"], [2, 2], [0, 0], [1, 1], "NCHW", "int32"], {"i": 321970629, "t": "int8", "c": null, "e": [["tile_n", "sp", [-1, 1, 1, 1]], ["tile_f", "sp", [-1, 1, 8, 1]], ["tile_y", "sp", [-1, 1, 1, 2]], ["tile_x", "sp", [-1, 1, 8, 1]], ["fuse_yx", "ot", 1], ["tile_rc", "sp", [-1, 6]], ["tile_ry", "sp", [-1, 3]], ["tile_rx", "sp", [-1, 3]], ["reorder_inner", "re", [2, 1, 0]], ["AA_double_buffer", "ot", 1], ["WW_double_buffer", "ot", 1], ["auto_unroll_max_step", "ot", 1500]]}], "r": [[1.1493196231640375e-05], 0, 2.835972547531128, 1581530631.517581], "v": 0.1}
{"i": ["cuda", "topi_nn_conv2d", [["TENSOR", [1, 192, 23, 17], "int8"], ["TENSOR", [192, 192, 7, 1], "int8"], [1, 1], [0, 0], [1, 1], "NCHW", "int32"], {}, ["conv2d", [1, 192, 23, 17, "int8"], [192, 192, 7, 1, "int8"], [1, 1], [0, 0], [1, 1], "NCHW", "int32"], {"i": 6382952, "t": "int8", "c": null, "e": [["tile_n", "sp", [-1, 1, 1, 1]], ["tile_f", "sp", [-1, 1, 12, 2]], ["tile_y", "sp", [-1, 1, 1, 1]], ["tile_x", "sp", [-1, 1, 17, 1]], ["fuse_yx", "ot", 1], ["tile_rc", "sp", [-1, 6]], ["tile_ry", "sp", [-1, 1]], ["tile_rx", "sp", [-1, 1]], ["reorder_inner", "re", [2, 1, 0]], ["AA_double_buffer", "ot", 1], ["WW_double_buffer", "ot", 1], ["auto_unroll_max_step", "ot", 1500]]}], "r": [[3.533909634055265e-05], 0, 2.2579073905944824, 1581543668.6216218], "v": 0.1}
{"i": ["cuda", "topi_nn_conv2d", [["TENSOR", [1, 192, 17, 23], "int8"], ["TENSOR", [192, 192, 1, 7], "int8"], [1, 1], [0, 0], [1, 1], "NCHW", "int32"], {}, ["conv2d", [1, 192, 17, 23, "int8"], [192, 192, 1, 7, "int8"], [1, 1], [0, 0], [1, 1], "NCHW", "int32"], {"i": 686579, "t": "int8", "c": null, "e": [["tile_n", "sp", [-1, 1, 1, 1]], ["tile_f", "sp", [-1, 2, 3, 1]], ["tile_y", "sp", [-1, 1, 1, 1]], ["tile_x", "sp", [-1, 1, 17, 1]], ["fuse_yx", "ot", 0], ["tile_rc", "sp", [-1, 4]], ["tile_ry", "sp", [-1, 1]], ["tile_rx", "sp", [-1, 7]], ["reorder_inner", "re", [0, 2, 1]], ["AA_double_buffer", "ot", 1], ["WW_double_buffer", "ot", 0], ["auto_unroll_max_step", "ot", 0]]}], "r": [[3.0037659780828818e-05], 0, 2.011552095413208, 1581554687.5753863], "v": 0.1}
{"i": ["cuda", "topi_nn_conv2d", [["TENSOR", [1, 160, 17, 23], "int8"], ["TENSOR", [192, 160, 1, 7], "int8"], [1, 1], [0, 0], [1, 1], "NCHW", "int32"], {}, ["conv2d", [1, 160, 17, 23, "int8"], [192, 160, 1, 7, "int8"], [1, 1], [0, 0], [1, 1], "NCHW", "int32"], {"i": 547699, "t": "int8", "c": null, "e": [["tile_n", "sp", [-1, 1, 1, 1]], ["tile_f", "sp", [-1, 2, 3, 1]], ["tile_y", "sp", [-1, 1, 1, 1]], ["tile_x", "sp", [-1, 1, 17, 1]], ["fuse_yx", "ot", 0], ["tile_rc", "sp", [-1, 4]], ["tile_ry", "sp", [-1, 1]], ["tile_rx", "sp", [-1, 7]], ["reorder_inner", "re", [0, 2, 1]], ["AA_double_buffer", "ot", 1], ["WW_double_buffer", "ot", 0], ["auto_unroll_max_step", "ot", 0]]}], "r": [[2.5256642456326098e-05], 0, 1.9125697612762451, 1581563258.2490563], "v": 0.1}
{"i": ["cuda", "topi_nn_conv2d", [["TENSOR", [1, 160, 23, 17], "int8"], ["TENSOR", [160, 160, 7, 1], "int8"], [1, 1], [0, 0], [1, 1], "NCHW", "int32"], {}, ["conv2d", [1, 160, 23, 17, "int8"], [160, 160, 7, 1, "int8"], [1, 1], [0, 0], [1, 1], "NCHW", "int32"], {"i": 2818080, "t": "int8", "c": null, "e": [["tile_n", "sp", [-1, 1, 1, 1]], ["tile_f", "sp", [-1, 1, 1, 1]], ["tile_y", "sp", [-1, 1, 17, 1]], ["tile_x", "sp", [-1, 1, 17, 1]], ["fuse_yx", "ot", 1], ["tile_rc", "sp", [-1, 8]], ["tile_ry", "sp", [-1, 7]], ["tile_rx", "sp", [-1, 1]], ["reorder_inner", "re", [1, 0, 2]], ["AA_double_buffer", "ot", 1], ["WW_double_buffer", "ot", 1], ["auto_unroll_max_step", "ot", 1500]]}], "r": [[1.4835490682036504e-05], 0, 2.5804362297058105, 1581578150.3893082], "v": 0.1}
{"i": ["cuda", "topi_nn_conv2d", [["TENSOR", [1, 160, 23, 17], "int8"], ["TENSOR", [192, 160, 7, 1], "int8"], [1, 1], [0, 0], [1, 1], "NCHW", "int32"], {}, ["conv2d", [1, 160, 23, 17, "int8"], [192, 160, 7, 1, "int8"], [1, 1], [0, 0], [1, 1], "NCHW", "int32"], {"i": 3135235, "t": "int8", "c": null, "e": [["tile_n", "sp", [-1, 1, 1, 1]], ["tile_f", "sp", [-1, 1, 1, 3]], ["tile_y", "sp", [-1, 1, 17, 1]], ["tile_x", "sp", [-1, 1, 17, 1]], ["fuse_yx", "ot", 1], ["tile_rc", "sp", [-1, 5]], ["tile_ry", "sp", [-1, 7]], ["tile_rx", "sp", [-1, 1]], ["reorder_inner", "re", [0, 2, 1]], ["AA_double_buffer", "ot", 1], ["WW_double_buffer", "ot", 1], ["auto_unroll_max_step", "ot", 512]]}], "r": [[2.1079980472948764e-05], 0, 2.5852954387664795, 1581582563.348101], "v": 0.1}
{"i": ["cuda", "topi_nn_conv2d", [["TENSOR", [1, 160, 17, 23], "int8"], ["TENSOR", [160, 160, 1, 7], "int8"], [1, 1], [0, 0], [1, 1], "NCHW", "int32"], {}, ["conv2d", [1, 160, 17, 23, "int8"], [160, 160, 1, 7, "int8"], [1, 1], [0, 0], [1, 1], "NCHW", "int32"], {"i": 1957921, "t": "int8", "c": null, "e": [["tile_n", "sp", [-1, 1, 1, 1]], ["tile_f", "sp", [-1, 2, 1, 1]], ["tile_y", "sp", [-1, 1, 17, 1]], ["tile_x", "sp", [-1, 1, 17, 1]], ["fuse_yx", "ot", 1], ["tile_rc", "sp", [-1, 8]], ["tile_ry", "sp", [-1, 1]], ["tile_rx", "sp", [-1, 7]], ["reorder_inner", "re", [2, 1, 0]], ["AA_double_buffer", "ot", 1], ["WW_double_buffer", "ot", 1], ["auto_unroll_max_step", "ot", 512]]}], "r": [[1.6192474282129914e-05], 0, 2.673713207244873, 1581588866.2963064], "v": 0.1}
{"i": ["cuda", "topi_nn_conv2d", [["TENSOR", [1, 768, 17, 17], "int8"], ["TENSOR", [160, 768, 1, 1], "int8"], [1, 1], [0, 0], [1, 1], "NCHW", "int32"], {}, ["conv2d", [1, 768, 17, 17, "int8"], [160, 768, 1, 1, "int8"], [1, 1], [0, 0], [1, 1], "NCHW", "int32"], {"i": 1594259, "t": "int8", "c": null, "e": [["tile_n", "sp", [-1, 1, 1, 1]], ["tile_f", "sp", [-1, 2, 5, 1]], ["tile_y", "sp", [-1, 1, 1, 1]], ["tile_x", "sp", [-1, 1, 17, 1]], ["fuse_yx", "ot", 1], ["tile_rc", "sp", [-1, 12]], ["tile_ry", "sp", [-1, 1]], ["tile_rx", "sp", [-1, 1]], ["reorder_inner", "re", [1, 0, 2]], ["AA_double_buffer", "ot", 1], ["WW_double_buffer", "ot", 1], ["auto_unroll_max_step", "ot", 512]]}], "r": [[1.7568062179248792e-05], 0, 2.10088849067688, 1581596337.3731945], "v": 0.1}
{"i": ["cuda", "topi_nn_conv2d", [["TENSOR", [1, 128, 17, 23], "int8"], ["TENSOR", [192, 128, 1, 7], "int8"], [1, 1], [0, 0], [1, 1], "NCHW", "int32"], {}, ["conv2d", [1, 128, 17, 23, "int8"], [192, 128, 1, 7, "int8"], [1, 1], [0, 0], [1, 1], "NCHW", "int32"], {"i": 1056442, "t": "int8", "c": null, "e": [["tile_n", "sp", [-1, 1, 1, 1]], ["tile_f", "sp", [-1, 3, 1, 1]], ["tile_y", "sp", [-1, 1, 17, 1]], ["tile_x", "sp", [-1, 1, 17, 1]], ["fuse_yx", "ot", 1], ["tile_rc", "sp", [-1, 2]], ["tile_ry", "sp", [-1, 1]], ["tile_rx", "sp", [-1, 7]], ["reorder_inner", "re", [0, 2, 1]], ["AA_double_buffer", "ot", 1], ["WW_double_buffer", "ot", 1], ["auto_unroll_max_step", "ot", 0]]}], "r": [[1.697220358152686e-05], 0, 2.529616594314575, 1581603386.583263], "v": 0.1}
{"i": ["cuda", "topi_nn_conv2d", [["TENSOR", [1, 128, 23, 17], "int8"], ["TENSOR", [128, 128, 7, 1], "int8"], [1, 1], [0, 0], [1, 1], "NCHW", "int32"], {}, ["conv2d", [1, 128, 23, 17, "int8"], [128, 128, 7, 1, "int8"], [1, 1], [0, 0], [1, 1], "NCHW", "int32"], {"i": 1433264, "t": "int8", "c": null, "e": [["tile_n", "sp", [-1, 1, 1, 1]], ["tile_f", "sp", [-1, 1, 1, 1]], ["tile_y", "sp", [-1, 1, 17, 1]], ["tile_x", "sp", [-1, 1, 17, 1]], ["fuse_yx", "ot", 1], ["tile_rc", "sp", [-1, 2]], ["tile_ry", "sp", [-1, 7]], ["tile_rx", "sp", [-1, 1]], ["reorder_inner", "re", [0, 1, 2]], ["AA_double_buffer", "ot", 1], ["WW_double_buffer", "ot", 1], ["auto_unroll_max_step", "ot", 1500]]}], "r": [[1.202589885782211e-05], 0, 2.221611738204956, 1581609319.4228823], "v": 0.1}
{"i": ["cuda", "topi_nn_conv2d", [["TENSOR", [1, 128, 23, 17], "int8"], ["TENSOR", [192, 128, 7, 1], "int8"], [1, 1], [0, 0], [1, 1], "NCHW", "int32"], {}, ["conv2d", [1, 128, 23, 17, "int8"], [192, 128, 7, 1, "int8"], [1, 1], [0, 0], [1, 1], "NCHW", "int32"], {"i": 1215555, "t": "int8", "c": null, "e": [["tile_n", "sp", [-1, 1, 1, 1]], ["tile_f", "sp", [-1, 1, 1, 3]], ["tile_y", "sp", [-1, 1, 17, 1]], ["tile_x", "sp", [-1, 1, 17, 1]], ["fuse_yx", "ot", 0], ["tile_rc", "sp", [-1, 2]], ["tile_ry", "sp", [-1, 7]], ["tile_rx", "sp", [-1, 1]], ["reorder_inner", "re", [2, 0, 1]], ["AA_double_buffer", "ot", 1], ["WW_double_buffer", "ot", 1], ["auto_unroll_max_step", "ot", 0]]}], "r": [[1.6978844111934392e-05], 0, 1.9083833694458008, 1581616068.6071734], "v": 0.1}
{"i": ["cuda", "topi_nn_conv2d", [["TENSOR", [1, 128, 17, 23], "int8"], ["TENSOR", [128, 128, 1, 7], "int8"], [1, 1], [0, 0], [1, 1], "NCHW", "int32"], {}, ["conv2d", [1, 128, 17, 23, "int8"], [128, 128, 1, 7, "int8"], [1, 1], [0, 0], [1, 1], "NCHW", "int32"], {"i": 1455665, "t": "int8", "c": null, "e": [["tile_n", "sp", [-1, 1, 1, 1]], ["tile_f", "sp", [-1, 2, 1, 1]], ["tile_y", "sp", [-1, 1, 17, 1]], ["tile_x", "sp", [-1, 1, 17, 1]], ["fuse_yx", "ot", 0], ["tile_rc", "sp", [-1, 4]], ["tile_ry", "sp", [-1, 1]], ["tile_rx", "sp", [-1, 7]], ["reorder_inner", "re", [0, 2, 1]], ["AA_double_buffer", "ot", 1], ["WW_double_buffer", "ot", 1], ["auto_unroll_max_step", "ot", 1500]]}], "r": [[1.3112198307269773e-05], 0, 2.2211554050445557, 1581621323.5960207], "v": 0.1}
{"i": ["cuda", "topi_nn_conv2d", [["TENSOR", [1, 768, 17, 17], "int8"], ["TENSOR", [128, 768, 1, 1], "int8"], [1, 1], [0, 0], [1, 1], "NCHW", "int32"], {}, ["conv2d", [1, 768, 17, 17, "int8"], [128, 768, 1, 1, "int8"], [1, 1], [0, 0], [1, 1], "NCHW", "int32"], {"i": 1718098, "t": "int8", "c": null, "e": [["tile_n", "sp", [-1, 1, 1, 1]], ["tile_f", "sp", [-1, 1, 16, 1]], ["tile_y", "sp", [-1, 1, 1, 1]], ["tile_x", "sp", [-1, 1, 17, 1]], ["fuse_yx", "ot", 1], ["tile_rc", "sp", [-1, 12]], ["tile_ry", "sp", [-1, 1]], ["tile_rx", "sp", [-1, 1]], ["reorder_inner", "re", [1, 0, 2]], ["AA_double_buffer", "ot", 1], ["WW_double_buffer", "ot", 1], ["auto_unroll_max_step", "ot", 1500]]}], "r": [[1.545234263942718e-05], 0, 2.2907493114471436, 1581628686.688305], "v": 0.1}
{"i": ["cuda", "topi_nn_conv2d", [["TENSOR", [1, 768, 17, 17], "int8"], ["TENSOR", [192, 768, 1, 1], "int8"], [1, 1], [0, 0], [1, 1], "NCHW", "int32"], {}, ["conv2d", [1, 768, 17, 17, "int8"], [192, 768, 1, 1, "int8"], [1, 1], [0, 0], [1, 1], "NCHW", "int32"], {"i": 1347379, "t": "int8", "c": null, "e": [["tile_n", "sp", [-1, 1, 1, 1]], ["tile_f", "sp", [-1, 2, 3, 1]], ["tile_y", "sp", [-1, 1, 1, 1]], ["tile_x", "sp", [-1, 1, 17, 1]], ["fuse_yx", "ot", 1], ["tile_rc", "sp", [-1, 12]], ["tile_ry", "sp", [-1, 1]], ["tile_rx", "sp", [-1, 1]], ["reorder_inner", "re", [1, 2, 0]], ["AA_double_buffer", "ot", 1], ["WW_double_buffer", "ot", 1], ["auto_unroll_max_step", "ot", 0]]}], "r": [[1.9612571369087275e-05], 0, 1.9884278774261475, 1581634852.713344], "v": 0.1}
{"i": ["cuda", "topi_nn_conv2d", [["TENSOR", [1, 96, 35, 35], "int8"], ["TENSOR", [96, 96, 3, 3], "int8"], [2, 2], [0, 0], [1, 1], "NCHW", "int32"], {}, ["conv2d", [1, 96, 35, 35, "int8"], [96, 96, 3, 3, "int8"], [2, 2], [0, 0], [1, 1], "NCHW", "int32"], {"i": 5614760, "t": "int8", "c": null, "e": [["tile_n", "sp", [-1, 1, 1, 1]], ["tile_f", "sp", [-1, 1, 3, 2]], ["tile_y", "sp", [-1, 1, 1, 1]], ["tile_x", "sp", [-1, 1, 17, 1]], ["fuse_yx", "ot", 0], ["tile_rc", "sp", [-1, 2]], ["tile_ry", "sp", [-1, 1]], ["tile_rx", "sp", [-1, 3]], ["reorder_inner", "re", [1, 0, 2]], ["AA_double_buffer", "ot", 1], ["WW_double_buffer", "ot", 1], ["auto_unroll_max_step", "ot", 1500]]}], "r": [[1.368028487759166e-05], 0, 2.3522799015045166, 1581644376.6406689], "v": 0.1}
{"i": ["cuda", "topi_nn_conv2d", [["TENSOR", [1, 288, 35, 35], "int8"], ["TENSOR", [384, 288, 3, 3], "int8"], [2, 2], [0, 0], [1, 1], "NCHW", "int32"], {}, ["conv2d", [1, 288, 35, 35, "int8"], [384, 288, 3, 3, "int8"], [2, 2], [0, 0], [1, 1], "NCHW", "int32"], {"i": 23663916, "t": "int8", "c": null, "e": [["tile_n", "sp", [-1, 1, 1, 1]], ["tile_f", "sp", [-1, 1, 1, 3]], ["tile_y", "sp", [-1, 1, 17, 1]], ["tile_x", "sp", [-1, 1, 17, 1]], ["fuse_yx", "ot", 0], ["tile_rc", "sp", [-1, 2]], ["tile_ry", "sp", [-1, 3]], ["tile_rx", "sp", [-1, 3]], ["reorder_inner", "re", [1, 0, 2]], ["AA_double_buffer", "ot", 1], ["WW_double_buffer", "ot", 1], ["auto_unroll_max_step", "ot", 1500]]}], "r": [[7.717589609530113e-05], 0, 2.421116352081299, 1581651751.3726647], "v": 0.1}
{"i": ["cuda", "topi_nn_conv2d", [["TENSOR", [1, 288, 35, 35], "int8"], ["TENSOR", [48, 288, 1, 1], "int8"], [1, 1], [0, 0], [1, 1], "NCHW", "int32"], {}, ["conv2d", [1, 288, 35, 35, "int8"], [48, 288, 1, 1, "int8"], [1, 1], [0, 0], [1, 1], "NCHW", "int32"], {"i": 17290252, "t": "int8", "c": null, "e": [["tile_n", "sp", [-1, 1, 1, 1]], ["tile_f", "sp", [-1, 4, 3, 1]], ["tile_y", "sp", [-1, 1, 1, 1]], ["tile_x", "sp", [-1, 1, 35, 1]], ["fuse_yx", "ot", 0], ["tile_rc", "sp", [-1, 6]], ["tile_ry", "sp", [-1, 1]], ["tile_rx", "sp", [-1, 1]], ["reorder_inner", "re", [2, 0, 1]], ["AA_double_buffer", "ot", 1], ["WW_double_buffer", "ot", 1], ["auto_unroll_max_step", "ot", 1500]]}], "r": [[6.964536649777369e-06], 0, 2.592222213745117, 1581672687.6813645], "v": 0.1}
{"i": ["cuda", "topi_nn_conv2d", [["TENSOR", [1, 288, 35, 35], "int8"], ["TENSOR", [64, 288, 1, 1], "int8"], [1, 1], [0, 0], [1, 1], "NCHW", "int32"], {}, ["conv2d", [1, 288, 35, 35, "int8"], [64, 288, 1, 1, "int8"], [1, 1], [0, 0], [1, 1], "NCHW", "int32"], {"i": 12772487, "t": "int8", "c": null, "e": [["tile_n", "sp", [-1, 1, 1, 1]], ["tile_f", "sp", [-1, 4, 2, 1]], ["tile_y", "sp", [-1, 1, 1, 1]], ["tile_x", "sp", [-1, 1, 35, 1]], ["fuse_yx", "ot", 1], ["tile_rc", "sp", [-1, 6]], ["tile_ry", "sp", [-1, 1]], ["tile_rx", "sp", [-1, 1]], ["reorder_inner", "re", [2, 1, 0]], ["AA_double_buffer", "ot", 1], ["WW_double_buffer", "ot", 0], ["auto_unroll_max_step", "ot", 1500]]}], "r": [[9.722673165769508e-06], 0, 2.75691294670105, 1581684422.031458], "v": 0.1}
{"i": ["cuda", "topi_nn_conv2d", [["TENSOR", [1, 256, 35, 35], "int8"], ["TENSOR", [48, 256, 1, 1], "int8"], [1, 1], [0, 0], [1, 1], "NCHW", "int32"], {}, ["conv2d", [1, 256, 35, 35, "int8"], [48, 256, 1, 1, "int8"], [1, 1], [0, 0], [1, 1], "NCHW", "int32"], {"i": 8248329, "t": "int8", "c": null, "e": [["tile_n", "sp", [-1, 1, 1, 1]], ["tile_f", "sp", [-1, 6, 2, 1]], ["tile_y", "sp", [-1, 1, 1, 1]], ["tile_x", "sp", [-1, 1, 35, 1]], ["fuse_yx", "ot", 1], ["tile_rc", "sp", [-1, 8]], ["tile_ry", "sp", [-1, 1]], ["tile_rx", "sp", [-1, 1]], ["reorder_inner", "re", [1, 2, 0]], ["AA_double_buffer", "ot", 1], ["WW_double_buffer", "ot", 0], ["auto_unroll_max_step", "ot", 1500]]}], "r": [[7.4470716620897086e-06], 0, 2.6016645431518555, 1581695755.6379082], "v": 0.1}
{"i": ["cuda", "topi_nn_conv2d", [["TENSOR", [1, 256, 35, 35], "int8"], ["TENSOR", [64, 256, 1, 1], "int8"], [1, 1], [0, 0], [1, 1], "NCHW", "int32"], {}, ["conv2d", [1, 256, 35, 35, "int8"], [64, 256, 1, 1, "int8"], [1, 1], [0, 0], [1, 1], "NCHW", "int32"], {"i": 8444807, "t": "int8", "c": null, "e": [["tile_n", "sp", [-1, 1, 1, 1]], ["tile_f", "sp", [-1, 4, 2, 1]], ["tile_y", "sp", [-1, 1, 1, 1]], ["tile_x", "sp", [-1, 1, 35, 1]], ["fuse_yx", "ot", 0], ["tile_rc", "sp", [-1, 4]], ["tile_ry", "sp", [-1, 1]], ["tile_rx", "sp", [-1, 1]], ["reorder_inner", "re", [0, 2, 1]], ["AA_double_buffer", "ot", 1], ["WW_double_buffer", "ot", 1], ["auto_unroll_max_step", "ot", 1500]]}], "r": [[8.992857577768237e-06], 0, 2.5258870124816895, 1581703463.8341582], "v": 0.1}
{"i": ["cuda", "topi_nn_conv2d", [["TENSOR", [1, 192, 35, 35], "int8"], ["TENSOR", [32, 192, 1, 1], "int8"], [1, 1], [0, 0], [1, 1], "NCHW", "int32"], {}, ["conv2d", [1, 192, 35, 35, "int8"], [32, 192, 1, 1, "int8"], [1, 1], [0, 0], [1, 1], "NCHW", "int32"], {"i": 5772806, "t": "int8", "c": null, "e": [["tile_n", "sp", [-1, 1, 1, 1]], ["tile_f", "sp", [-1, 4, 2, 1]], ["tile_y", "sp", [-1, 1, 1, 1]], ["tile_x", "sp", [-1, 1, 35, 1]], ["fuse_yx", "ot", 1], ["tile_rc", "sp", [-1, 4]], ["tile_ry", "sp", [-1, 1]], ["tile_rx", "sp", [-1, 1]], ["reorder_inner", "re", [1, 0, 2]], ["AA_double_buffer", "ot", 1], ["WW_double_buffer", "ot", 0], ["auto_unroll_max_step", "ot", 1500]]}], "r": [[4.548657006920415e-06], 0, 2.1609888076782227, 1581711590.910413], "v": 0.1}
{"i": ["cuda", "topi_nn_conv2d", [["TENSOR", [1, 96, 37, 37], "int8"], ["TENSOR", [96, 96, 3, 3], "int8"], [1, 1], [0, 0], [1, 1], "NCHW", "int32"], {}, ["conv2d", [1, 96, 37, 37, "int8"], [96, 96, 3, 3, "int8"], [1, 1], [0, 0], [1, 1], "NCHW", "int32"], {"i": 88955054, "t": "int8", "c": null, "e": [["tile_n", "sp", [-1, 1, 1, 1]], ["tile_f", "sp", [-1, 1, 3, 1]], ["tile_y", "sp", [-1, 7, 1, 1]], ["tile_x", "sp", [-1, 1, 35, 1]], ["fuse_yx", "ot", 1], ["tile_rc", "sp", [-1, 4]], ["tile_ry", "sp", [-1, 3]], ["tile_rx", "sp", [-1, 3]], ["reorder_inner", "re", [0, 2, 1]], ["AA_double_buffer", "ot", 1], ["WW_double_buffer", "ot", 1], ["auto_unroll_max_step", "ot", 1500]]}], "r": [[1.64050713732667e-05], 0, 3.029700756072998, 1581724822.1702538], "v": 0.1}
{"i": ["cuda", "topi_nn_conv2d", [["TENSOR", [1, 64, 37, 37], "int8"], ["TENSOR", [96, 64, 3, 3], "int8"], [1, 1], [0, 0], [1, 1], "NCHW", "int32"], {}, ["conv2d", [1, 64, 37, 37, "int8"], [96, 64, 3, 3, "int8"], [1, 1], [0, 0], [1, 1], "NCHW", "int32"], {"i": 58072014, "t": "int8", "c": null, "e": [["tile_n", "sp", [-1, 1, 1, 1]], ["tile_f", "sp", [-1, 1, 3, 1]], ["tile_y", "sp", [-1, 1, 1, 7]], ["tile_x", "sp", [-1, 1, 35, 1]], ["fuse_yx", "ot", 1], ["tile_rc", "sp", [-1, 4]], ["tile_ry", "sp", [-1, 3]], ["tile_rx", "sp", [-1, 3]], ["reorder_inner", "re", [2, 0, 1]], ["AA_double_buffer", "ot", 1], ["WW_double_buffer", "ot", 1], ["auto_unroll_max_step", "ot", 1500]]}], "r": [[1.0692318446429366e-05], 0, 3.6946792602539062, 1581739987.9681623], "v": 0.1}
{"i": ["cuda", "topi_nn_conv2d", [["TENSOR", [1, 48, 39, 39], "int8"], ["TENSOR", [64, 48, 5, 5], "int8"], [1, 1], [0, 0], [1, 1], "NCHW", "int32"], {}, ["conv2d", [1, 48, 39, 39, "int8"], [64, 48, 5, 5, "int8"], [1, 1], [0, 0], [1, 1], "NCHW", "int32"], {"i": 29168550, "t": "int8", "c": null, "e": [["tile_n", "sp", [-1, 1, 1, 1]], ["tile_f", "sp", [-1, 1, 2, 1]], ["tile_y", "sp", [-1, 1, 7, 5]], ["tile_x", "sp", [-1, 1, 7, 1]], ["fuse_yx", "ot", 1], ["tile_rc", "sp", [-1, 2]], ["tile_ry", "sp", [-1, 5]], ["tile_rx", "sp", [-1, 5]], ["reorder_inner", "re", [0, 2, 1]], ["AA_double_buffer", "ot", 1], ["WW_double_buffer", "ot", 1], ["auto_unroll_max_step", "ot", 1500]]}], "r": [[1.501101153026695e-05], 0, 3.8328378200531006, 1581750741.2121317], "v": 0.1}
{"i": ["cuda", "topi_nn_conv2d", [["TENSOR", [1, 192, 35, 35], "int8"], ["TENSOR", [48, 192, 1, 1], "int8"], [1, 1], [0, 0], [1, 1], "NCHW", "int32"], {}, ["conv2d", [1, 192, 35, 35, "int8"], [48, 192, 1, 1, "int8"], [1, 1], [0, 0], [1, 1], "NCHW", "int32"], {"i": 3998882, "t": "int8", "c": null, "e": [["tile_n", "sp", [-1, 1, 1, 1]], ["tile_f", "sp", [-1, 3, 1, 1]], ["tile_y", "sp", [-1, 1, 5, 1]], ["tile_x", "sp", [-1, 1, 35, 1]], ["fuse_yx", "ot", 0], ["tile_rc", "sp", [-1, 8]], ["tile_ry", "sp", [-1, 1]], ["tile_rx", "sp", [-1, 1]], ["reorder_inner", "re", [0, 2, 1]], ["AA_double_buffer", "ot", 1], ["WW_double_buffer", "ot", 1], ["auto_unroll_max_step", "ot", 0]]}], "r": [[5.476683178911018e-06], 0, 2.0987865924835205, 1581768700.5410545], "v": 0.1}
{"i": ["cuda", "topi_nn_conv2d", [["TENSOR", [1, 192, 35, 35], "int8"], ["TENSOR", [64, 192, 1, 1], "int8"], [1, 1], [0, 0], [1, 1], "NCHW", "int32"], {}, ["conv2d", [1, 192, 35, 35, "int8"], [64, 192, 1, 1, "int8"], [1, 1], [0, 0], [1, 1], "NCHW", "int32"], {"i": 12288805, "t": "int8", "c": null, "e": [["tile_n", "sp", [-1, 1, 1, 1]], ["tile_f", "sp", [-1, 1, 1, 4]], ["tile_y", "sp", [-1, 1, 5, 1]], ["tile_x", "sp", [-1, 1, 35, 1]], ["fuse_yx", "ot", 1], ["tile_rc", "sp", [-1, 8]], ["tile_ry", "sp", [-1, 1]], ["tile_rx", "sp", [-1, 1]], ["reorder_inner", "re", [1, 0, 2]], ["AA_double_buffer", "ot", 1], ["WW_double_buffer", "ot", 1], ["auto_unroll_max_step", "ot", 1500]]}], "r": [[6.343240245246235e-06], 0, 2.226348638534546, 1581776946.1779332], "v": 0.1}
{"i": ["cuda", "topi_nn_conv2d", [["TENSOR", [1, 80, 73, 73], "int8"], ["TENSOR", [192, 80, 3, 3], "int8"], [1, 1], [0, 0], [1, 1], "NCHW", "int32"], {}, ["conv2d", [1, 80, 73, 73, "int8"], [192, 80, 3, 3, "int8"], [1, 1], [0, 0], [1, 1], "NCHW", "int32"], {"i": 5999967, "t": "int8", "c": null, "e": [["tile_n", "sp", [-1, 1, 1, 1]], ["tile_f", "sp", [-1, 1, 1, 12]], ["tile_y", "sp", [-1, 1, 1, 1]], ["tile_x", "sp", [-1, 1, 71, 1]], ["fuse_yx", "ot", 0], ["tile_rc", "sp", [-1, 2]], ["tile_ry", "sp", [-1, 3]], ["tile_rx", "sp", [-1, 3]], ["reorder_inner", "re", [0, 2, 1]], ["AA_double_buffer", "ot", 1], ["WW_double_buffer", "ot", 0], ["auto_unroll_max_step", "ot", 1500]]}], "r": [[0.00013820516972477064], 0, 2.7124135494232178, 1581789934.2478607], "v": 0.1}
{"i": ["cuda", "topi_nn_conv2d", [["TENSOR", [1, 64, 73, 73], "int8"], ["TENSOR", [80, 64, 1, 1], "int8"], [1, 1], [0, 0], [1, 1], "NCHW", "int32"], {}, ["conv2d", [1, 64, 73, 73, "int8"], [80, 64, 1, 1, "int8"], [1, 1], [0, 0], [1, 1], "NCHW", "int32"], {"i": 4836, "t": "int8", "c": null, "e": [["tile_n", "sp", [-1, 1, 1, 1]], ["tile_f", "sp", [-1, 1, 1, 10]], ["tile_y", "sp", [-1, 1, 1, 1]], ["tile_x", "sp", [-1, 1, 73, 1]], ["fuse_yx", "ot", 1], ["tile_rc", "sp", [-1, 8]], ["tile_ry", "sp", [-1, 1]], ["tile_rx", "sp", [-1, 1]], ["reorder_inner", "re", [0, 1, 2]], ["AA_double_buffer", "ot", 0], ["WW_double_buffer", "ot", 0], ["auto_unroll_max_step", "ot", 0]]}], "r": [[9.246094518721977e-06], 0, 2.1006999015808105, 1581797899.4498947], "v": 0.1}
{"i": ["cuda", "topi_nn_conv2d", [["TENSOR", [1, 32, 149, 149], "int8"], ["TENSOR", [64, 32, 3, 3], "int8"], [1, 1], [0, 0], [1, 1], "NCHW", "int32"], {}, ["conv2d", [1, 32, 149, 149, "int8"], [64, 32, 3, 3, "int8"], [1, 1], [0, 0], [1, 1], "NCHW", "int32"], {"i": 114320445, "t": "int8", "c": null, "e": [["tile_n", "sp", [-1, 1, 1, 1]], ["tile_f", "sp", [-1, 1, 1, 2]], ["tile_y", "sp", [-1, 1, 1, 3]], ["tile_x", "sp", [-1, 1, 147, 1]], ["fuse_yx", "ot", 1], ["tile_rc", "sp", [-1, 1]], ["tile_ry", "sp", [-1, 3]], ["tile_rx", "sp", [-1, 3]], ["reorder_inner", "re", [1, 2, 0]], ["AA_double_buffer", "ot", 0], ["WW_double_buffer", "ot", 1], ["auto_unroll_max_step", "ot", 1500]]}], "r": [[5.293687327044025e-05], 0, 1.6836442947387695, 1581805215.7283762], "v": 0.1}
{"i": ["cuda", "topi_nn_conv2d", [["TENSOR", [1, 32, 149, 149], "int8"], ["TENSOR", [32, 32, 3, 3], "int8"], [1, 1], [0, 0], [1, 1], "NCHW", "int32"], {}, ["conv2d", [1, 32, 149, 149, "int8"], [32, 32, 3, 3, "int8"], [1, 1], [0, 0], [1, 1], "NCHW", "int32"], {"i": 41741970, "t": "int8", "c": null, "e": [["tile_n", "sp", [-1, 1, 1, 1]], ["tile_f", "sp", [-1, 1, 1, 2]], ["tile_y", "sp", [-1, 1, 1, 3]], ["tile_x", "sp", [-1, 1, 147, 1]], ["fuse_yx", "ot", 0], ["tile_rc", "sp", [-1, 1]], ["tile_ry", "sp", [-1, 3]], ["tile_rx", "sp", [-1, 3]], ["reorder_inner", "re", [2, 0, 1]], ["AA_double_buffer", "ot", 0], ["WW_double_buffer", "ot", 1], ["auto_unroll_max_step", "ot", 512]]}], "r": [[2.693056804037006e-05], 0, 1.6860857009887695, 1581815251.9460557], "v": 0.1}
{"i": ["cuda", "topi_nn_conv2d", [["TENSOR", [1, 3, 299, 299], "int8"], ["TENSOR", [32, 3, 3, 3], "int8"], [2, 2], [0, 0], [1, 1], "NCHW", "int32"], {}, ["conv2d", [1, 3, 299, 299, "int8"], [32, 3, 3, 3, "int8"], [2, 2], [0, 0], [1, 1], "NCHW", "int32"], {"i": 5863, "t": "direct", "c": null, "e": [["tile_f", "sp", [-1, 8, 1, 4]], ["tile_y", "sp", [-1, 1, 1, 1]], ["tile_x", "sp", [-1, 1, 149, 1]], ["tile_rc", "sp", [-1, 1]], ["tile_ry", "sp", [-1, 3]], ["tile_rx", "sp", [-1, 3]], ["auto_unroll_max_step", "ot", 0], ["unroll_explicit", "ot", 0]]}], "r": [[3.025857662492546e-05], 0, 1.4899530410766602, 1581821575.2438383], "v": 0.1}
{"i": ["llvm -mcpu=cascadelake", "topi_x86_conv2d_NCHWc_int8", [["TENSOR", [1, 4, 299, 299], "uint8"], ["TENSOR", [32, 4, 3, 3], "int8"], [2, 2], [0, 0], [1, 1], "NCHW", "int32"], {}, ["conv2d", [1, 4, 299, 299, "uint8"], [32, 4, 3, 3, "int8"], [2, 2], [0, 0], [1, 1], "NCHW", "int32"], {"i": 2, "t": "direct", "c": null, "e": [["tile_ic", "sp", [-1, 4]], ["tile_oc", "sp", [-1, 16]], ["tile_ow", "sp", [-1, 1]], ["unroll_kw", "ot", false]]}], "r": [[1.6574404181804322e-05], 0, 2.3211421966552734, 1579974505.7683718], "v": 0.1}
{"i": ["llvm -mcpu=cascadelake", "topi_x86_conv2d_NCHWc_int8", [["TENSOR", [1, 32, 149, 149], "uint8"], ["TENSOR", [32, 32, 3, 3], "int8"], [1, 1], [0, 0], [1, 1], "NCHW", "int32"], {}, ["conv2d", [1, 32, 149, 149, "uint8"], [32, 32, 3, 3, "int8"], [1, 1], [0, 0], [1, 1], "NCHW", "int32"], {"i": 9, "t": "direct", "c": null, "e": [["tile_ic", "sp", [-1, 8]], ["tile_oc", "sp", [-1, 16]], ["tile_ow", "sp", [-1, 3]], ["unroll_kw", "ot", true]]}], "r": [[5.8214547690014904e-05], 0, 1.2850375175476074, 1579974575.2340672], "v": 0.1}
{"i": ["llvm -mcpu=cascadelake", "topi_x86_conv2d_NCHWc_int8", [["TENSOR", [1, 32, 149, 149], "uint8"], ["TENSOR", [64, 32, 3, 3], "int8"], [1, 1], [0, 0], [1, 1], "NCHW", "int32"], {}, ["conv2d", [1, 32, 149, 149, "uint8"], [64, 32, 3, 3, "int8"], [1, 1], [0, 0], [1, 1], "NCHW", "int32"], {"i": 67, "t": "direct", "c": null, "e": [["tile_ic", "sp", [-1, 32]], ["tile_oc", "sp", [-1, 32]], ["tile_ow", "sp", [-1, 1]], ["unroll_kw", "ot", false]]}], "r": [[0.00010566434137953839], 0, 2.8315389156341553, 1579974766.5338185], "v": 0.1}
{"i": ["llvm -mcpu=cascadelake", "topi_x86_conv2d_NCHWc_int8", [["TENSOR", [1, 64, 73, 73], "uint8"], ["TENSOR", [80, 64, 1, 1], "int8"], [1, 1], [0, 0], [1, 1], "NCHW", "int32"], {}, ["conv2d", [1, 64, 73, 73, "uint8"], [80, 64, 1, 1, "int8"], [1, 1], [0, 0], [1, 1], "NCHW", "int32"], {"i": 4, "t": "direct", "c": null, "e": [["tile_ic", "sp", [-1, 64]], ["tile_oc", "sp", [-1, 16]], ["tile_ow", "sp", [-1, 1]], ["tile_oh", "ot", 1]]}], "r": [[1.2571515195463714e-05], 0, 2.085824966430664, 1579975024.2143686], "v": 0.1}
{"i": ["llvm -mcpu=cascadelake", "topi_x86_conv2d_NCHWc_int8", [["TENSOR", [1, 80, 73, 73], "uint8"], ["TENSOR", [192, 80, 3, 3], "int8"], [1, 1], [0, 0], [1, 1], "NCHW", "int32"], {}, ["conv2d", [1, 80, 73, 73, "uint8"], [192, 80, 3, 3, "int8"], [1, 1], [0, 0], [1, 1], "NCHW", "int32"], {"i": 46, "t": "direct", "c": null, "e": [["tile_ic", "sp", [-1, 40]], ["tile_oc", "sp", [-1, 32]], ["tile_ow", "sp", [-1, 1]], ["unroll_kw", "ot", false]]}], "r": [[0.00017536300010908694], 0, 2.865088939666748, 1579975213.893756], "v": 0.1}
{"i": ["llvm -mcpu=cascadelake", "topi_x86_conv2d_NCHWc_int8", [["TENSOR", [1, 192, 35, 35], "uint8"], ["TENSOR", [64, 192, 1, 1], "int8"], [1, 1], [0, 0], [1, 1], "NCHW", "int32"], {}, ["conv2d", [1, 192, 35, 35, "uint8"], [64, 192, 1, 1, "int8"], [1, 1], [0, 0], [1, 1], "NCHW", "int32"], {"i": 47, "t": "direct", "c": null, "e": [["tile_ic", "sp", [-1, 64]], ["tile_oc", "sp", [-1, 32]], ["tile_ow", "sp", [-1, 5]], ["tile_oh", "ot", 1]]}], "r": [[7.254530181348014e-06], 0, 2.0410709381103516, 1579975291.776653], "v": 0.1}
{"i": ["llvm -mcpu=cascadelake", "topi_x86_conv2d_NCHWc_int8", [["TENSOR", [1, 192, 35, 35], "uint8"], ["TENSOR", [48, 192, 1, 1], "int8"], [1, 1], [0, 0], [1, 1], "NCHW", "int32"], {}, ["conv2d", [1, 192, 35, 35, "uint8"], [48, 192, 1, 1, "int8"], [1, 1], [0, 0], [1, 1], "NCHW", "int32"], {"i": 26, "t": "direct", "c": null, "e": [["tile_ic", "sp", [-1, 48]], ["tile_oc", "sp", [-1, 16]], ["tile_ow", "sp", [-1, 5]], ["tile_oh", "ot", 1]]}], "r": [[7.008426099407189e-06], 0, 3.456552505493164, 1579976035.2913191], "v": 0.1}
{"i": ["llvm -mcpu=cascadelake", "topi_x86_conv2d_NCHWc_int8", [["TENSOR", [1, 48, 39, 39], "uint8"], ["TENSOR", [64, 48, 5, 5], "int8"], [1, 1], [0, 0], [1, 1], "NCHW", "int32"], {}, ["conv2d", [1, 48, 39, 39, "uint8"], [64, 48, 5, 5, "int8"], [1, 1], [0, 0], [1, 1], "NCHW", "int32"], {"i": 21, "t": "direct", "c": null, "e": [["tile_ic", "sp", [-1, 16]], ["tile_oc", "sp", [-1, 16]], ["tile_ow", "sp", [-1, 5]], ["unroll_kw", "ot", true]]}], "r": [[2.657582483374328e-05], 0, 2.6792080402374268, 1579976579.7085116], "v": 0.1}
{"i": ["llvm -mcpu=cascadelake", "topi_x86_conv2d_NCHWc_int8", [["TENSOR", [1, 64, 37, 37], "uint8"], ["TENSOR", [96, 64, 3, 3], "int8"], [1, 1], [0, 0], [1, 1], "NCHW", "int32"], {}, ["conv2d", [1, 64, 37, 37, "uint8"], [96, 64, 3, 3, "int8"], [1, 1], [0, 0], [1, 1], "NCHW", "int32"], {"i": 111, "t": "direct", "c": null, "e": [["tile_ic", "sp", [-1, 8]], ["tile_oc", "sp", [-1, 48]], ["tile_ow", "sp", [-1, 5]], ["unroll_kw", "ot", false]]}], "r": [[2.121041781019558e-05], 0, 2.424480676651001, 1579976782.6201067], "v": 0.1}
{"i": ["llvm -mcpu=cascadelake", "topi_x86_conv2d_NCHWc_int8", [["TENSOR", [1, 96, 37, 37], "uint8"], ["TENSOR", [96, 96, 3, 3], "int8"], [1, 1], [0, 0], [1, 1], "NCHW", "int32"], {}, ["conv2d", [1, 96, 37, 37, "uint8"], [96, 96, 3, 3, "int8"], [1, 1], [0, 0], [1, 1], "NCHW", "int32"], {"i": 37, "t": "direct", "c": null, "e": [["tile_ic", "sp", [-1, 32]], ["tile_oc", "sp", [-1, 16]], ["tile_ow", "sp", [-1, 5]], ["unroll_kw", "ot", true]]}], "r": [[2.889969719490815e-05], 0, 2.7372260093688965, 1579977314.546203], "v": 0.1}
{"i": ["llvm -mcpu=cascadelake", "topi_x86_conv2d_NCHWc_int8", [["TENSOR", [1, 192, 35, 35], "uint8"], ["TENSOR", [32, 192, 1, 1], "int8"], [1, 1], [0, 0], [1, 1], "NCHW", "int32"], {}, ["conv2d", [1, 192, 35, 35, "uint8"], [32, 192, 1, 1, "int8"], [1, 1], [0, 0], [1, 1], "NCHW", "int32"], {"i": 48, "t": "direct", "c": null, "e": [["tile_ic", "sp", [-1, 96]], ["tile_oc", "sp", [-1, 16]], ["tile_ow", "sp", [-1, 7]], ["tile_oh", "ot", 1]]}], "r": [[5.566723686752974e-06], 0, 3.3800876140594482, 1579977793.1597726], "v": 0.1}
{"i": ["llvm -mcpu=cascadelake", "topi_x86_conv2d_NCHWc_int8", [["TENSOR", [1, 256, 35, 35], "uint8"], ["TENSOR", [64, 256, 1, 1], "int8"], [1, 1], [0, 0], [1, 1], "NCHW", "int32"], {}, ["conv2d", [1, 256, 35, 35, "uint8"], [64, 256, 1, 1, "int8"], [1, 1], [0, 0], [1, 1], "NCHW", "int32"], {"i": 23, "t": "direct", "c": null, "e": [["tile_ic", "sp", [-1, 16]], ["tile_oc", "sp", [-1, 16]], ["tile_ow", "sp", [-1, 5]], ["tile_oh", "ot", 1]]}], "r": [[9.06745878969698e-06], 0, 1.938861608505249, 1579978056.9142373], "v": 0.1}
{"i": ["llvm -mcpu=cascadelake", "topi_x86_conv2d_NCHWc_int8", [["TENSOR", [1, 256, 35, 35], "uint8"], ["TENSOR", [48, 256, 1, 1], "int8"], [1, 1], [0, 0], [1, 1], "NCHW", "int32"], {}, ["conv2d", [1, 256, 35, 35, "uint8"], [48, 256, 1, 1, "int8"], [1, 1], [0, 0], [1, 1], "NCHW", "int32"], {"i": 34, "t": "direct", "c": null, "e": [["tile_ic", "sp", [-1, 256]], ["tile_oc", "sp", [-1, 16]], ["tile_ow", "sp", [-1, 7]], ["tile_oh", "ot", 1]]}], "r": [[8.269771390223661e-06], 0, 3.4313786029815674, 1579978639.2125027], "v": 0.1}
{"i": ["llvm -mcpu=cascadelake", "topi_x86_conv2d_NCHWc_int8", [["TENSOR", [1, 288, 35, 35], "uint8"], ["TENSOR", [64, 288, 1, 1], "int8"], [1, 1], [0, 0], [1, 1], "NCHW", "int32"], {}, ["conv2d", [1, 288, 35, 35, "uint8"], [64, 288, 1, 1, "int8"], [1, 1], [0, 0], [1, 1], "NCHW", "int32"], {"i": 90, "t": "direct", "c": null, "e": [["tile_ic", "sp", [-1, 36]], ["tile_oc", "sp", [-1, 32]], ["tile_ow", "sp", [-1, 7]], ["tile_oh", "ot", 1]]}], "r": [[9.079553987018633e-06], 0, 2.1306653022766113, 1579979297.9065857], "v": 0.1}
{"i": ["llvm -mcpu=cascadelake", "topi_x86_conv2d_NCHWc_int8", [["TENSOR", [1, 288, 35, 35], "uint8"], ["TENSOR", [48, 288, 1, 1], "int8"], [1, 1], [0, 0], [1, 1], "NCHW", "int32"], {}, ["conv2d", [1, 288, 35, 35, "uint8"], [48, 288, 1, 1, "int8"], [1, 1], [0, 0], [1, 1], "NCHW", "int32"], {"i": 50, "t": "direct", "c": null, "e": [["tile_ic", "sp", [-1, 12]], ["tile_oc", "sp", [-1, 16]], ["tile_ow", "sp", [-1, 7]], ["tile_oh", "ot", 1]]}], "r": [[8.471962826902732e-06], 0, 3.427577495574951, 1579979719.4033742], "v": 0.1}
{"i": ["llvm -mcpu=cascadelake", "topi_x86_conv2d_NCHWc_int8", [["TENSOR", [1, 288, 35, 35], "uint8"], ["TENSOR", [384, 288, 3, 3], "int8"], [2, 2], [0, 0], [1, 1], "NCHW", "int32"], {}, ["conv2d", [1, 288, 35, 35, "uint8"], [384, 288, 3, 3, "int8"], [2, 2], [0, 0], [1, 1], "NCHW", "int32"], {"i": 289, "t": "direct", "c": null, "e": [["tile_ic", "sp", [-1, 8]], ["tile_oc", "sp", [-1, 16]], ["tile_ow", "sp", [-1, 17]], ["unroll_kw", "ot", false]]}], "r": [[8.223546094196393e-05], 0, 1.3035545349121094, 1579980523.0014071], "v": 0.1}
{"i": ["llvm -mcpu=cascadelake", "topi_x86_conv2d_NCHWc_int8", [["TENSOR", [1, 96, 35, 35], "uint8"], ["TENSOR", [96, 96, 3, 3], "int8"], [2, 2], [0, 0], [1, 1], "NCHW", "int32"], {}, ["conv2d", [1, 96, 35, 35, "uint8"], [96, 96, 3, 3, "int8"], [2, 2], [0, 0], [1, 1], "NCHW", "int32"], {"i": 101, "t": "direct", "c": null, "e": [["tile_ic", "sp", [-1, 32]], ["tile_oc", "sp", [-1, 16]], ["tile_ow", "sp", [-1, 17]], ["unroll_kw", "ot", false]]}], "r": [[1.0641486059396945e-05], 0, 2.03727650642395, 1579981215.9377122], "v": 0.1}
{"i": ["llvm -mcpu=cascadelake", "topi_x86_conv2d_NCHWc_int8", [["TENSOR", [1, 768, 17, 17], "uint8"], ["TENSOR", [192, 768, 1, 1], "int8"], [1, 1], [0, 0], [1, 1], "NCHW", "int32"], {}, ["conv2d", [1, 768, 17, 17, "uint8"], [192, 768, 1, 1, "int8"], [1, 1], [0, 0], [1, 1], "NCHW", "int32"], {"i": 96, "t": "direct", "c": null, "e": [["tile_ic", "sp", [-1, 384]], ["tile_oc", "sp", [-1, 16]], ["tile_ow", "sp", [-1, 17]], ["tile_oh", "ot", 1]]}], "r": [[1.5684575738872404e-05], 0, 2.3947644233703613, 1579981468.6158621], "v": 0.1}
{"i": ["llvm -mcpu=cascadelake", "topi_x86_conv2d_NCHWc_int8", [["TENSOR", [1, 768, 17, 17], "uint8"], ["TENSOR", [128, 768, 1, 1], "int8"], [1, 1], [0, 0], [1, 1], "NCHW", "int32"], {}, ["conv2d", [1, 768, 17, 17, "uint8"], [128, 768, 1, 1, "int8"], [1, 1], [0, 0], [1, 1], "NCHW", "int32"], {"i": 27, "t": "direct", "c": null, "e": [["tile_ic", "sp", [-1, 768]], ["tile_oc", "sp", [-1, 32]], ["tile_ow", "sp", [-1, 1]], ["tile_oh", "ot", 1]]}], "r": [[1.1079193691473634e-05], 0, 1.9393086433410645, 1579982234.2944865], "v": 0.1}
{"i": ["llvm -mcpu=cascadelake", "topi_x86_conv2d_NCHWc_int8", [["TENSOR", [1, 128, 17, 23], "uint8"], ["TENSOR", [128, 128, 1, 7], "int8"], [1, 1], [0, 0], [1, 1], "NCHW", "int32"], {}, ["conv2d", [1, 128, 17, 23, "uint8"], [128, 128, 1, 7, "int8"], [1, 1], [0, 0], [1, 1], "NCHW", "int32"], {"i": 56, "t": "direct", "c": null, "e": [["tile_ic", "sp", [-1, 16]], ["tile_oc", "sp", [-1, 32]], ["tile_ow", "sp", [-1, 1]], ["unroll_kw", "ot", false]]}], "r": [[1.1595239753604736e-05], 0, 1.8606338500976562, 1579982712.972364], "v": 0.1}
{"i": ["llvm -mcpu=cascadelake", "topi_x86_conv2d_NCHWc_int8", [["TENSOR", [1, 128, 23, 17], "uint8"], ["TENSOR", [192, 128, 7, 1], "int8"], [1, 1], [0, 0], [1, 1], "NCHW", "int32"], {}, ["conv2d", [1, 128, 23, 17, "uint8"], [192, 128, 7, 1, "int8"], [1, 1], [0, 0], [1, 1], "NCHW", "int32"], {"i": 111, "t": "direct", "c": null, "e": [["tile_ic", "sp", [-1, 32]], ["tile_oc", "sp", [-1, 16]], ["tile_ow", "sp", [-1, 17]], ["unroll_kw", "ot", false]]}], "r": [[1.7314584748713586e-05], 0, 2.444277763366699, 1579983110.6765716], "v": 0.1}
{"i": ["llvm -mcpu=cascadelake", "topi_x86_conv2d_NCHWc_int8", [["TENSOR", [1, 128, 23, 17], "uint8"], ["TENSOR", [128, 128, 7, 1], "int8"], [1, 1], [0, 0], [1, 1], "NCHW", "int32"], {}, ["conv2d", [1, 128, 23, 17, "uint8"], [128, 128, 7, 1, "int8"], [1, 1], [0, 0], [1, 1], "NCHW", "int32"], {"i": 29, "t": "direct", "c": null, "e": [["tile_ic", "sp", [-1, 128]], ["tile_oc", "sp", [-1, 16]], ["tile_ow", "sp", [-1, 17]], ["unroll_kw", "ot", true]]}], "r": [[1.2661904424821817e-05], 0, 3.408336877822876, 1579983477.139363], "v": 0.1}
{"i": ["llvm -mcpu=cascadelake", "topi_x86_conv2d_NCHWc_int8", [["TENSOR", [1, 128, 17, 23], "uint8"], ["TENSOR", [192, 128, 1, 7], "int8"], [1, 1], [0, 0], [1, 1], "NCHW", "int32"], {}, ["conv2d", [1, 128, 17, 23, "uint8"], [192, 128, 1, 7, "int8"], [1, 1], [0, 0], [1, 1], "NCHW", "int32"], {"i": 109, "t": "direct", "c": null, "e": [["tile_ic", "sp", [-1, 8]], ["tile_oc", "sp", [-1, 16]], ["tile_ow", "sp", [-1, 17]], ["unroll_kw", "ot", false]]}], "r": [[1.7124331584296784e-05], 0, 2.469236373901367, 1579983572.1374319], "v": 0.1}
{"i": ["llvm -mcpu=cascadelake", "topi_x86_conv2d_NCHWc_int8", [["TENSOR", [1, 768, 17, 17], "uint8"], ["TENSOR", [160, 768, 1, 1], "int8"], [1, 1], [0, 0], [1, 1], "NCHW", "int32"], {}, ["conv2d", [1, 768, 17, 17, "uint8"], [160, 768, 1, 1, "int8"], [1, 1], [0, 0], [1, 1], "NCHW", "int32"], {"i": 60, "t": "direct", "c": null, "e": [["tile_ic", "sp", [-1, 24]], ["tile_oc", "sp", [-1, 16]], ["tile_ow", "sp", [-1, 17]], ["tile_oh", "ot", 1]]}], "r": [[1.4454661764049955e-05], 0, 2.4390974044799805, 1579984002.0037], "v": 0.1}
{"i": ["llvm -mcpu=cascadelake", "topi_x86_conv2d_NCHWc_int8", [["TENSOR", [1, 160, 17, 23], "uint8"], ["TENSOR", [160, 160, 1, 7], "int8"], [1, 1], [0, 0], [1, 1], "NCHW", "int32"], {}, ["conv2d", [1, 160, 17, 23, "uint8"], [160, 160, 1, 7, "int8"], [1, 1], [0, 0], [1, 1], "NCHW", "int32"], {"i": 68, "t": "direct", "c": null, "e": [["tile_ic", "sp", [-1, 32]], ["tile_oc", "sp", [-1, 16]], ["tile_ow", "sp", [-1, 1]], ["unroll_kw", "ot", false]]}], "r": [[1.9159847894913088e-05], 0, 2.2691211700439453, 1579984745.9958465], "v": 0.1}
{"i": ["llvm -mcpu=cascadelake", "topi_x86_conv2d_NCHWc_int8", [["TENSOR", [1, 160, 23, 17], "uint8"], ["TENSOR", [192, 160, 7, 1], "int8"], [1, 1], [0, 0], [1, 1], "NCHW", "int32"], {}, ["conv2d", [1, 160, 23, 17, "uint8"], [192, 160, 7, 1, "int8"], [1, 1], [0, 0], [1, 1], "NCHW", "int32"], {"i": 48, "t": "direct", "c": null, "e": [["tile_ic", "sp", [-1, 4]], ["tile_oc", "sp", [-1, 16]], ["tile_ow", "sp", [-1, 17]], ["unroll_kw", "ot", true]]}], "r": [[2.8873840172828024e-05], 0, 2.6824116706848145, 1579985099.8961918], "v": 0.1}
{"i": ["llvm -mcpu=cascadelake", "topi_x86_conv2d_NCHWc_int8", [["TENSOR", [1, 160, 23, 17], "uint8"], ["TENSOR", [160, 160, 7, 1], "int8"], [1, 1], [0, 0], [1, 1], "NCHW", "int32"], {}, ["conv2d", [1, 160, 23, 17, "uint8"], [160, 160, 7, 1, "int8"], [1, 1], [0, 0], [1, 1], "NCHW", "int32"], {"i": 97, "t": "direct", "c": null, "e": [["tile_ic", "sp", [-1, 8]], ["tile_oc", "sp", [-1, 16]], ["tile_ow", "sp", [-1, 17]], ["unroll_kw", "ot", false]]}], "r": [[1.9269106446513264e-05], 0, 2.417293071746826, 1579985404.664787], "v": 0.1}
{"i": ["llvm -mcpu=cascadelake", "topi_x86_conv2d_NCHWc_int8", [["TENSOR", [1, 160, 17, 23], "uint8"], ["TENSOR", [192, 160, 1, 7], "int8"], [1, 1], [0, 0], [1, 1], "NCHW", "int32"], {}, ["conv2d", [1, 160, 17, 23, "uint8"], [192, 160, 1, 7, "int8"], [1, 1], [0, 0], [1, 1], "NCHW", "int32"], {"i": 101, "t": "direct", "c": null, "e": [["tile_ic", "sp", [-1, 40]], ["tile_oc", "sp", [-1, 16]], ["tile_ow", "sp", [-1, 1]], ["unroll_kw", "ot", false]]}], "r": [[2.1701749730065768e-05], 0, 2.369410991668701, 1579985980.5081313], "v": 0.1}
{"i": ["llvm -mcpu=cascadelake", "topi_x86_conv2d_NCHWc_int8", [["TENSOR", [1, 192, 17, 23], "uint8"], ["TENSOR", [192, 192, 1, 7], "int8"], [1, 1], [0, 0], [1, 1], "NCHW", "int32"], {}, ["conv2d", [1, 192, 17, 23, "uint8"], [192, 192, 1, 7, "int8"], [1, 1], [0, 0], [1, 1], "NCHW", "int32"], {"i": 186, "t": "direct", "c": null, "e": [["tile_ic", "sp", [-1, 48]], ["tile_oc", "sp", [-1, 16]], ["tile_ow", "sp", [-1, 17]], ["unroll_kw", "ot", false]]}], "r": [[2.3938824175086438e-05], 0, 2.5772833824157715, 1579986333.5823674], "v": 0.1}
{"i": ["llvm -mcpu=cascadelake", "topi_x86_conv2d_NCHWc_int8", [["TENSOR", [1, 192, 23, 17], "uint8"], ["TENSOR", [192, 192, 7, 1], "int8"], [1, 1], [0, 0], [1, 1], "NCHW", "int32"], {}, ["conv2d", [1, 192, 23, 17, "uint8"], [192, 192, 7, 1, "int8"], [1, 1], [0, 0], [1, 1], "NCHW", "int32"], {"i": 186, "t": "direct", "c": null, "e": [["tile_ic", "sp", [-1, 48]], ["tile_oc", "sp", [-1, 16]], ["tile_ow", "sp", [-1, 17]], ["unroll_kw", "ot", false]]}], "r": [[2.4811878986766948e-05], 0, 2.5300519466400146, 1579987255.0369813], "v": 0.1}
{"i": ["llvm -mcpu=cascadelake", "topi_x86_conv2d_NCHWc_int8", [["TENSOR", [1, 192, 17, 17], "uint8"], ["TENSOR", [320, 192, 3, 3], "int8"], [2, 2], [0, 0], [1, 1], "NCHW", "int32"], {}, ["conv2d", [1, 192, 17, 17, "uint8"], [320, 192, 3, 3, "int8"], [2, 2], [0, 0], [1, 1], "NCHW", "int32"], {"i": 129, "t": "direct", "c": null, "e": [["tile_ic", "sp", [-1, 192]], ["tile_oc", "sp", [-1, 16]], ["tile_ow", "sp", [-1, 4]], ["unroll_kw", "ot", true]]}], "r": [[1.3006214278545801e-05], 0, 1.9259119033813477, 1579988212.8546464], "v": 0.1}
{"i": ["llvm -mcpu=cascadelake", "topi_x86_conv2d_NCHWc_int8", [["TENSOR", [1, 192, 17, 17], "uint8"], ["TENSOR", [192, 192, 3, 3], "int8"], [2, 2], [0, 0], [1, 1], "NCHW", "int32"], {}, ["conv2d", [1, 192, 17, 17, "uint8"], [192, 192, 3, 3, "int8"], [2, 2], [0, 0], [1, 1], "NCHW", "int32"], {"i": 394, "t": "direct", "c": null, "e": [["tile_ic", "sp", [-1, 24]], ["tile_oc", "sp", [-1, 64]], ["tile_ow", "sp", [-1, 4]], ["unroll_kw", "ot", false]]}], "r": [[8.3006443206942e-06], 0, 3.4675228595733643, 1579989039.322051], "v": 0.1}
{"i": ["llvm -mcpu=cascadelake", "topi_x86_conv2d_NCHWc_int8", [["TENSOR", [1, 1280, 8, 8], "uint8"], ["TENSOR", [320, 1280, 1, 1], "int8"], [1, 1], [0, 0], [1, 1], "NCHW", "int32"], {}, ["conv2d", [1, 1280, 8, 8, "uint8"], [320, 1280, 1, 1, "int8"], [1, 1], [0, 0], [1, 1], "NCHW", "int32"], {"i": 173, "t": "direct", "c": null, "e": [["tile_ic", "sp", [-1, 40]], ["tile_oc", "sp", [-1, 16]], ["tile_ow", "sp", [-1, 4]], ["tile_oh", "ot", 1]]}], "r": [[1.0368750660190757e-05], 0, 1.8249926567077637, 1579989704.5549443], "v": 0.1}
{"i": ["llvm -mcpu=cascadelake", "topi_x86_conv2d_NCHWc_int8", [["TENSOR", [1, 1280, 8, 8], "uint8"], ["TENSOR", [384, 1280, 1, 1], "int8"], [1, 1], [0, 0], [1, 1], "NCHW", "int32"], {}, ["conv2d", [1, 1280, 8, 8, "uint8"], [384, 1280, 1, 1, "int8"], [1, 1], [0, 0], [1, 1], "NCHW", "int32"], {"i": 699, "t": "direct", "c": null, "e": [["tile_ic", "sp", [-1, 1280]], ["tile_oc", "sp", [-1, 32]], ["tile_ow", "sp", [-1, 4]], ["tile_oh", "ot", 2]]}], "r": [[1.0886159769679419e-05], 0, 3.492004156112671, 1579991335.2203922], "v": 0.1}
{"i": ["llvm -mcpu=cascadelake", "topi_x86_conv2d_NCHWc_int8", [["TENSOR", [1, 384, 8, 10], "uint8"], ["TENSOR", [384, 384, 1, 3], "int8"], [1, 1], [0, 0], [1, 1], "NCHW", "int32"], {}, ["conv2d", [1, 384, 8, 10, "uint8"], [384, 384, 1, 3, "int8"], [1, 1], [0, 0], [1, 1], "NCHW", "int32"], {"i": 207, "t": "direct", "c": null, "e": [["tile_ic", "sp", [-1, 16]], ["tile_oc", "sp", [-1, 32]], ["tile_ow", "sp", [-1, 4]], ["unroll_kw", "ot", true]]}], "r": [[9.956163152663132e-06], 0, 3.4864134788513184, 1579993606.8231523], "v": 0.1}
{"i": ["llvm -mcpu=cascadelake", "topi_x86_conv2d_NCHWc_int8", [["TENSOR", [1, 384, 10, 8], "uint8"], ["TENSOR", [384, 384, 3, 1], "int8"], [1, 1], [0, 0], [1, 1], "NCHW", "int32"], {}, ["conv2d", [1, 384, 10, 8, "uint8"], [384, 384, 3, 1, "int8"], [1, 1], [0, 0], [1, 1], "NCHW", "int32"], {"i": 618, "t": "direct", "c": null, "e": [["tile_ic", "sp", [-1, 48]], ["tile_oc", "sp", [-1, 64]], ["tile_ow", "sp", [-1, 4]], ["unroll_kw", "ot", false]]}], "r": [[1.0137278399605403e-05], 0, 3.4607837200164795, 1579996595.8360634], "v": 0.1}
{"i": ["llvm -mcpu=cascadelake", "topi_x86_conv2d_NCHWc_int8", [["TENSOR", [1, 1280, 8, 8], "uint8"], ["TENSOR", [448, 1280, 1, 1], "int8"], [1, 1], [0, 0], [1, 1], "NCHW", "int32"], {}, ["conv2d", [1, 1280, 8, 8, "uint8"], [448, 1280, 1, 1, "int8"], [1, 1], [0, 0], [1, 1], "NCHW", "int32"], {"i": 274, "t": "direct", "c": null, "e": [["tile_ic", "sp", [-1, 128]], ["tile_oc", "sp", [-1, 32]], ["tile_ow", "sp", [-1, 8]], ["tile_oh", "ot", 1]]}], "r": [[1.3165948475135558e-05], 0, 3.3129236698150635, 1579998847.0775793], "v": 0.1}
{"i": ["llvm -mcpu=cascadelake", "topi_x86_conv2d_NCHWc_int8", [["TENSOR", [1, 448, 10, 10], "uint8"], ["TENSOR", [384, 448, 3, 3], "int8"], [1, 1], [0, 0], [1, 1], "NCHW", "int32"], {}, ["conv2d", [1, 448, 10, 10, "uint8"], [384, 448, 3, 3, "int8"], [1, 1], [0, 0], [1, 1], "NCHW", "int32"], {"i": 578, "t": "direct", "c": null, "e": [["tile_ic", "sp", [-1, 224]], ["tile_oc", "sp", [-1, 32]], ["tile_ow", "sp", [-1, 8]], ["unroll_kw", "ot", false]]}], "r": [[2.7604103610475467e-05], 0, 2.744518995285034, 1579999947.0095656], "v": 0.1}
{"i": ["llvm -mcpu=cascadelake", "topi_x86_conv2d_NCHWc_int8", [["TENSOR", [1, 1280, 8, 8], "uint8"], ["TENSOR", [192, 1280, 1, 1], "int8"], [1, 1], [0, 0], [1, 1], "NCHW", "int32"], {}, ["conv2d", [1, 1280, 8, 8, "uint8"], [192, 1280, 1, 1, "int8"], [1, 1], [0, 0], [1, 1], "NCHW", "int32"], {"i": 278, "t": "direct", "c": null, "e": [["tile_ic", "sp", [-1, 640]], ["tile_oc", "sp", [-1, 32]], ["tile_ow", "sp", [-1, 8]], ["tile_oh", "ot", 1]]}], "r": [[6.863200575441e-06], 0, 1.7455782890319824, 1580001447.9649222], "v": 0.1}
{"i": ["llvm -mcpu=cascadelake", "topi_x86_conv2d_NCHWc_int8", [["TENSOR", [1, 2048, 8, 8], "uint8"], ["TENSOR", [320, 2048, 1, 1], "int8"], [1, 1], [0, 0], [1, 1], "NCHW", "int32"], {}, ["conv2d", [1, 2048, 8, 8, "uint8"], [320, 2048, 1, 1, "int8"], [1, 1], [0, 0], [1, 1], "NCHW", "int32"], {"i": 378, "t": "direct", "c": null, "e": [["tile_ic", "sp", [-1, 1024]], ["tile_oc", "sp", [-1, 32]], ["tile_ow", "sp", [-1, 4]], ["tile_oh", "ot", 2]]}], "r": [[1.5527439006078806e-05], 0, 2.3706705570220947, 1580002705.672444], "v": 0.1}
{"i": ["llvm -mcpu=cascadelake", "topi_x86_conv2d_NCHWc_int8", [["TENSOR", [1, 2048, 8, 8], "uint8"], ["TENSOR", [384, 2048, 1, 1], "int8"], [1, 1], [0, 0], [1, 1], "NCHW", "int32"], {}, ["conv2d", [1, 2048, 8, 8, "uint8"], [384, 2048, 1, 1, "int8"], [1, 1], [0, 0], [1, 1], "NCHW", "int32"], {"i": 197, "t": "direct", "c": null, "e": [["tile_ic", "sp", [-1, 512]], ["tile_oc", "sp", [-1, 64]], ["tile_ow", "sp", [-1, 4]], ["tile_oh", "ot", 1]]}], "r": [[1.551594856784445e-05], 0, 2.0642218589782715, 1580003985.4191642], "v": 0.1}
{"i": ["llvm -mcpu=cascadelake", "topi_x86_conv2d_NCHWc_int8", [["TENSOR", [1, 2048, 8, 8], "uint8"], ["TENSOR", [448, 2048, 1, 1], "int8"], [1, 1], [0, 0], [1, 1], "NCHW", "int32"], {}, ["conv2d", [1, 2048, 8, 8, "uint8"], [448, 2048, 1, 1, "int8"], [1, 1], [0, 0], [1, 1], "NCHW", "int32"], {"i": 196, "t": "direct", "c": null, "e": [["tile_ic", "sp", [-1, 256]], ["tile_oc", "sp", [-1, 32]], ["tile_ow", "sp", [-1, 8]], ["tile_oh", "ot", 1]]}], "r": [[1.9120942959910503e-05], 0, 2.492788314819336, 1580005244.307925], "v": 0.1}
{"i": ["llvm -mcpu=cascadelake", "topi_x86_conv2d_NCHWc_int8", [["TENSOR", [1, 2048, 8, 8], "uint8"], ["TENSOR", [192, 2048, 1, 1], "int8"], [1, 1], [0, 0], [1, 1], "NCHW", "int32"], {}, ["conv2d", [1, 2048, 8, 8, "uint8"], [192, 2048, 1, 1, "int8"], [1, 1], [0, 0], [1, 1], "NCHW", "int32"], {"i": 196, "t": "direct", "c": null, "e": [["tile_ic", "sp", [-1, 256]], ["tile_oc", "sp", [-1, 32]], ["tile_ow", "sp", [-1, 8]], ["tile_oh", "ot", 1]]}], "r": [[9.353263968454295e-06], 0, 3.4408018589019775, 1580006639.2933533], "v": 0.1}
