scripts_paper/backup_tuned_logs_g4/mobilenet1.0-quantized-5batches-naive-symbol.log
{"i": ["cuda", "topi_nn_conv2d", [["TENSOR", [1, 1024, 7, 7], "int8"], ["TENSOR", [1024, 1024, 1, 1], "int8"], [1, 1], [0, 0], [1, 1], "NCHW", "int32"], {}, ["conv2d", [1, 1024, 7, 7, "int8"], [1024, 1024, 1, 1, "int8"], [1, 1], [0, 0], [1, 1], "NCHW", "int32"], {"i": 2208778, "t": "int8", "c": null, "e": [["tile_n", "sp", [-1, 1, 1, 1]], ["tile_f", "sp", [-1, 1, 2, 4]], ["tile_y", "sp", [-1, 1, 7, 1]], ["tile_x", "sp", [-1, 1, 7, 1]], ["fuse_yx", "ot", 0], ["tile_rc", "sp", [-1, 16]], ["tile_ry", "sp", [-1, 1]], ["tile_rx", "sp", [-1, 1]], ["reorder_inner", "re", [2, 0, 1]], ["AA_double_buffer", "ot", 1], ["WW_double_buffer", "ot", 1], ["auto_unroll_max_step", "ot", 512]]}], "r": [[2.101285596525439e-05], 0, 2.0391294956207275, 1581389219.7896755], "v": 0.1}
{"i": ["cuda", "topi_nn_depthwise_conv2d_nchw", [["TENSOR", [1, 1024, 9, 9], "int8"], ["TENSOR", [1024, 1, 3, 3], "int8"], [1, 1], [0, 0], [1, 1], "int32"], {}, ["depthwise_conv2d_nchw", [1, 1024, 9, 9, "int8"], [1024, 1, 3, 3, "int8"], [1, 1], [0, 0], [1, 1], "int32"], {"i": 21472, "t": "direct", "c": null, "e": [["tile_f", "sp", [-1, 2, 4, 1]], ["tile_y", "sp", [-1, 1, 1, 7]], ["tile_x", "sp", [-1, 1, 7, 1]], ["auto_unroll_max_step", "ot", 256], ["unroll_explicit", "ot", 1]]}], "r": [[3.1135857879621692e-06], 0, 1.741072177886963, 1581394465.1037421], "v": 0.1}
{"i": ["cuda", "topi_nn_conv2d", [["TENSOR", [1, 512, 7, 7], "int8"], ["TENSOR", [1024, 512, 1, 1], "int8"], [1, 1], [0, 0], [1, 1], "NCHW", "int32"], {}, ["conv2d", [1, 512, 7, 7, "int8"], [1024, 512, 1, 1, "int8"], [1, 1], [0, 0], [1, 1], "NCHW", "int32"], {"i": 2306388, "t": "int8", "c": null, "e": [["tile_n", "sp", [-1, 1, 1, 1]], ["tile_f", "sp", [-1, 2, 4, 1]], ["tile_y", "sp", [-1, 1, 7, 1]], ["tile_x", "sp", [-1, 1, 7, 1]], ["fuse_yx", "ot", 1], ["tile_rc", "sp", [-1, 16]], ["tile_ry", "sp", [-1, 1]], ["tile_rx", "sp", [-1, 1]], ["reorder_inner", "re", [0, 1, 2]], ["AA_double_buffer", "ot", 1], ["WW_double_buffer", "ot", 0], ["auto_unroll_max_step", "ot", 1500]]}], "r": [[1.1491667675214523e-05], 0, 2.1714017391204834, 1581396507.7357187], "v": 0.1}
{"i": ["cuda", "topi_nn_depthwise_conv2d_nchw", [["TENSOR", [1, 512, 16, 16], "int8"], ["TENSOR", [512, 1, 3, 3], "int8"], [2, 2], [0, 0], [1, 1], "int32"], {}, ["depthwise_conv2d_nchw", [1, 512, 16, 16, "int8"], [512, 1, 3, 3, "int8"], [2, 2], [0, 0], [1, 1], "int32"], {"i": 16534, "t": "direct", "c": null, "e": [["tile_f", "sp", [-1, 1, 16, 1]], ["tile_y", "sp", [-1, 1, 1, 7]], ["tile_x", "sp", [-1, 1, 7, 1]], ["auto_unroll_max_step", "ot", 256], ["unroll_explicit", "ot", 1]]}], "r": [[3.2614276151808247e-06], 0, 1.7240478992462158, 1581399488.628037], "v": 0.1}
{"i": ["cuda", "topi_nn_conv2d", [["TENSOR", [1, 512, 14, 14], "int8"], ["TENSOR", [512, 512, 1, 1], "int8"], [1, 1], [0, 0], [1, 1], "NCHW", "int32"], {}, ["conv2d", [1, 512, 14, 14, "int8"], [512, 512, 1, 1, "int8"], [1, 1], [0, 0], [1, 1], "NCHW", "int32"], {"i": 22380250, "t": "int8", "c": null, "e": [["tile_n", "sp", [-1, 1, 1, 1]], ["tile_f", "sp", [-1, 4, 2, 1]], ["tile_y", "sp", [-1, 1, 7, 1]], ["tile_x", "sp", [-1, 1, 14, 1]], ["fuse_yx", "ot", 0], ["tile_rc", "sp", [-1, 16]], ["tile_ry", "sp", [-1, 1]], ["tile_rx", "sp", [-1, 1]], ["reorder_inner", "re", [1, 2, 0]], ["AA_double_buffer", "ot", 1], ["WW_double_buffer", "ot", 1], ["auto_unroll_max_step", "ot", 512]]}], "r": [[1.5711034800134365e-05], 0, 2.222383737564087, 1581407155.691714], "v": 0.1}
{"i": ["cuda", "topi_nn_depthwise_conv2d_nchw", [["TENSOR", [1, 512, 16, 16], "int8"], ["TENSOR", [512, 1, 3, 3], "int8"], [1, 1], [0, 0], [1, 1], "int32"], {}, ["depthwise_conv2d_nchw", [1, 512, 16, 16, "int8"], [512, 1, 3, 3, "int8"], [1, 1], [0, 0], [1, 1], "int32"], {"i": 256099, "t": "direct", "c": null, "e": [["tile_f", "sp", [-1, 1, 4, 1]], ["tile_y", "sp", [-1, 1, 1, 7]], ["tile_x", "sp", [-1, 1, 14, 1]], ["auto_unroll_max_step", "ot", 256], ["unroll_explicit", "ot", 1]]}], "r": [[3.2971616915422887e-06], 0, 1.7760224342346191, 1581413462.2544253], "v": 0.1}
{"i": ["cuda", "topi_nn_conv2d", [["TENSOR", [1, 256, 14, 14], "int8"], ["TENSOR", [512, 256, 1, 1], "int8"], [1, 1], [0, 0], [1, 1], "NCHW", "int32"], {}, ["conv2d", [1, 256, 14, 14, "int8"], [512, 256, 1, 1, "int8"], [1, 1], [0, 0], [1, 1], "NCHW", "int32"], {"i": 20567804, "t": "int8", "c": null, "e": [["tile_n", "sp", [-1, 1, 1, 1]], ["tile_f", "sp", [-1, 2, 2, 2]], ["tile_y", "sp", [-1, 1, 7, 1]], ["tile_x", "sp", [-1, 1, 14, 1]], ["fuse_yx", "ot", 1], ["tile_rc", "sp", [-1, 32]], ["tile_ry", "sp", [-1, 1]], ["tile_rx", "sp", [-1, 1]], ["reorder_inner", "re", [2, 1, 0]], ["AA_double_buffer", "ot", 1], ["WW_double_buffer", "ot", 1], ["auto_unroll_max_step", "ot", 512]]}], "r": [[8.627894352958869e-06], 0, 2.2399983406066895, 1581416770.0755713], "v": 0.1}
{"i": ["cuda", "topi_nn_depthwise_conv2d_nchw", [["TENSOR", [1, 256, 30, 30], "int8"], ["TENSOR", [256, 1, 3, 3], "int8"], [2, 2], [0, 0], [1, 1], "int32"], {}, ["depthwise_conv2d_nchw", [1, 256, 30, 30, "int8"], [256, 1, 3, 3, "int8"], [2, 2], [0, 0], [1, 1], "int32"], {"i": 233145, "t": "direct", "c": null, "e": [["tile_f", "sp", [-1, 1, 1, 1]], ["tile_y", "sp", [-1, 7, 2, 1]], ["tile_x", "sp", [-1, 1, 14, 1]], ["auto_unroll_max_step", "ot", 1500], ["unroll_explicit", "ot", 1]]}], "r": [[3.338264862125893e-06], 0, 1.8668570518493652, 1581422598.6436217], "v": 0.1}
{"i": ["cuda", "topi_nn_conv2d", [["TENSOR", [1, 256, 28, 28], "int8"], ["TENSOR", [256, 256, 1, 1], "int8"], [1, 1], [0, 0], [1, 1], "NCHW", "int32"], {}, ["conv2d", [1, 256, 28, 28, "int8"], [256, 256, 1, 1, "int8"], [1, 1], [0, 0], [1, 1], "NCHW", "int32"], {"i": 101262627, "t": "int8", "c": null, "e": [["tile_n", "sp", [-1, 1, 1, 1]], ["tile_f", "sp", [-1, 1, 4, 2]], ["tile_y", "sp", [-1, 1, 1, 4]], ["tile_x", "sp", [-1, 1, 28, 1]], ["fuse_yx", "ot", 1], ["tile_rc", "sp", [-1, 32]], ["tile_ry", "sp", [-1, 1]], ["tile_rx", "sp", [-1, 1]], ["reorder_inner", "re", [2, 1, 0]], ["AA_double_buffer", "ot", 0], ["WW_double_buffer", "ot", 0], ["auto_unroll_max_step", "ot", 1500]]}], "r": [[1.0559270680896676e-05], 0, 2.6898508071899414, 1581431509.4407961], "v": 0.1}
{"i": ["cuda", "topi_nn_depthwise_conv2d_nchw", [["TENSOR", [1, 256, 30, 30], "int8"], ["TENSOR", [256, 1, 3, 3], "int8"], [1, 1], [0, 0], [1, 1], "int32"], {}, ["depthwise_conv2d_nchw", [1, 256, 30, 30, "int8"], [256, 1, 3, 3, "int8"], [1, 1], [0, 0], [1, 1], "int32"], {"i": 1233870, "t": "direct", "c": null, "e": [["tile_f", "sp", [-1, 1, 1, 1]], ["tile_y", "sp", [-1, 1, 2, 14]], ["tile_x", "sp", [-1, 1, 14, 2]], ["auto_unroll_max_step", "ot", 256], ["unroll_explicit", "ot", 1]]}], "r": [[3.4637481066691147e-06], 0, 1.8854243755340576, 1581438489.8428512], "v": 0.1}
{"i": ["cuda", "topi_nn_conv2d", [["TENSOR", [1, 128, 28, 28], "int8"], ["TENSOR", [256, 128, 1, 1], "int8"], [1, 1], [0, 0], [1, 1], "NCHW", "int32"], {}, ["conv2d", [1, 128, 28, 28, "int8"], [256, 128, 1, 1, "int8"], [1, 1], [0, 0], [1, 1], "NCHW", "int32"], {"i": 47905827, "t": "int8", "c": null, "e": [["tile_n", "sp", [-1, 1, 1, 1]], ["tile_f", "sp", [-1, 1, 4, 2]], ["tile_y", "sp", [-1, 1, 1, 4]], ["tile_x", "sp", [-1, 1, 28, 1]], ["fuse_yx", "ot", 0], ["tile_rc", "sp", [-1, 16]], ["tile_ry", "sp", [-1, 1]], ["tile_rx", "sp", [-1, 1]], ["reorder_inner", "re", [2, 1, 0]], ["AA_double_buffer", "ot", 0], ["WW_double_buffer", "ot", 0], ["auto_unroll_max_step", "ot", 512]]}], "r": [[6.750180746738642e-06], 0, 1.737419843673706, 1581452369.7428255], "v": 0.1}
{"i": ["cuda", "topi_nn_depthwise_conv2d_nchw", [["TENSOR", [1, 128, 58, 58], "int8"], ["TENSOR", [128, 1, 3, 3], "int8"], [2, 2], [0, 0], [1, 1], "int32"], {}, ["depthwise_conv2d_nchw", [1, 128, 58, 58, "int8"], [128, 1, 3, 3, "int8"], [2, 2], [0, 0], [1, 1], "int32"], {"i": 1045920, "t": "direct", "c": null, "e": [["tile_f", "sp", [-1, 1, 1, 1]], ["tile_y", "sp", [-1, 1, 1, 14]], ["tile_x", "sp", [-1, 1, 28, 1]], ["auto_unroll_max_step", "ot", 1500], ["unroll_explicit", "ot", 1]]}], "r": [[4.413952767810345e-06], 0, 1.9278314113616943, 1581458730.8555546], "v": 0.1}
{"i": ["cuda", "topi_nn_conv2d", [["TENSOR", [1, 128, 56, 56], "int8"], ["TENSOR", [128, 128, 1, 1], "int8"], [1, 1], [0, 0], [1, 1], "NCHW", "int32"], {}, ["conv2d", [1, 128, 56, 56, "int8"], [128, 128, 1, 1, "int8"], [1, 1], [0, 0], [1, 1], "NCHW", "int32"], {"i": 111594040, "t": "int8", "c": null, "e": [["tile_n", "sp", [-1, 1, 1, 1]], ["tile_f", "sp", [-1, 1, 2, 4]], ["tile_y", "sp", [-1, 1, 1, 2]], ["tile_x", "sp", [-1, 1, 56, 1]], ["fuse_yx", "ot", 1], ["tile_rc", "sp", [-1, 32]], ["tile_ry", "sp", [-1, 1]], ["tile_rx", "sp", [-1, 1]], ["reorder_inner", "re", [0, 2, 1]], ["AA_double_buffer", "ot", 0], ["WW_double_buffer", "ot", 0], ["auto_unroll_max_step", "ot", 512]]}], "r": [[1.0532881316098708e-05], 0, 1.5251688957214355, 1581464885.5538712], "v": 0.1}
{"i": ["cuda", "topi_nn_depthwise_conv2d_nchw", [["TENSOR", [1, 128, 58, 58], "int8"], ["TENSOR", [128, 1, 3, 3], "int8"], [1, 1], [0, 0], [1, 1], "int32"], {}, ["depthwise_conv2d_nchw", [1, 128, 58, 58, "int8"], [128, 1, 3, 3, "int8"], [1, 1], [0, 0], [1, 1], "int32"], {"i": 4298280, "t": "direct", "c": null, "e": [["tile_f", "sp", [-1, 1, 1, 1]], ["tile_y", "sp", [-1, 4, 1, 7]], ["tile_x", "sp", [-1, 1, 28, 2]], ["auto_unroll_max_step", "ot", 1500], ["unroll_explicit", "ot", 1]]}], "r": [[5.228655507559396e-06], 0, 2.255828619003296, 1581471756.646831], "v": 0.1}
{"i": ["cuda", "topi_nn_conv2d", [["TENSOR", [1, 64, 56, 56], "int8"], ["TENSOR", [128, 64, 1, 1], "int8"], [1, 1], [0, 0], [1, 1], "NCHW", "int32"], {}, ["conv2d", [1, 64, 56, 56, "int8"], [128, 64, 1, 1, "int8"], [1, 1], [0, 0], [1, 1], "NCHW", "int32"], {"i": 20918849, "t": "int8", "c": null, "e": [["tile_n", "sp", [-1, 1, 1, 1]], ["tile_f", "sp", [-1, 1, 2, 8]], ["tile_y", "sp", [-1, 1, 1, 2]], ["tile_x", "sp", [-1, 1, 56, 1]], ["fuse_yx", "ot", 0], ["tile_rc", "sp", [-1, 16]], ["tile_ry", "sp", [-1, 1]], ["tile_rx", "sp", [-1, 1]], ["reorder_inner", "re", [2, 1, 0]], ["AA_double_buffer", "ot", 0], ["WW_double_buffer", "ot", 0], ["auto_unroll_max_step", "ot", 0]]}], "r": [[6.949072086309071e-06], 0, 1.7269346714019775, 1581477290.2865388], "v": 0.1}
{"i": ["cuda", "topi_nn_depthwise_conv2d_nchw", [["TENSOR", [1, 64, 114, 114], "int8"], ["TENSOR", [64, 1, 3, 3], "int8"], [2, 2], [0, 0], [1, 1], "int32"], {}, ["depthwise_conv2d_nchw", [1, 64, 114, 114, "int8"], [64, 1, 3, 3, "int8"], [2, 2], [0, 0], [1, 1], "int32"], {"i": 2466576, "t": "direct", "c": null, "e": [["tile_f", "sp", [-1, 1, 1, 1]], ["tile_y", "sp", [-1, 8, 1, 1]], ["tile_x", "sp", [-1, 1, 28, 2]], ["auto_unroll_max_step", "ot", 256], ["unroll_explicit", "ot", 1]]}], "r": [[7.032999039161449e-06], 0, 1.9488856792449951, 1581485295.9993289], "v": 0.1}
{"i": ["cuda", "topi_nn_conv2d", [["TENSOR", [1, 32, 112, 112], "int8"], ["TENSOR", [64, 32, 1, 1], "int8"], [1, 1], [0, 0], [1, 1], "NCHW", "int32"], {}, ["conv2d", [1, 32, 112, 112, "int8"], [64, 32, 1, 1, "int8"], [1, 1], [0, 0], [1, 1], "NCHW", "int32"], {"i": 3615104, "t": "int8", "c": null, "e": [["tile_n", "sp", [-1, 1, 1, 1]], ["tile_f", "sp", [-1, 1, 8, 2]], ["tile_y", "sp", [-1, 1, 1, 8]], ["tile_x", "sp", [-1, 1, 16, 1]], ["fuse_yx", "ot", 1], ["tile_rc", "sp", [-1, 4]], ["tile_ry", "sp", [-1, 1]], ["tile_rx", "sp", [-1, 1]], ["reorder_inner", "re", [0, 1, 2]], ["AA_double_buffer", "ot", 0], ["WW_double_buffer", "ot", 0], ["auto_unroll_max_step", "ot", 0]]}], "r": [[8.904894159444054e-06], 0, 1.824861764907837, 1581493394.5062466], "v": 0.1}
{"i": ["cuda", "topi_nn_depthwise_conv2d_nchw", [["TENSOR", [1, 32, 114, 114], "int8"], ["TENSOR", [32, 1, 3, 3], "int8"], [1, 1], [0, 0], [1, 1], "int32"], {}, ["depthwise_conv2d_nchw", [1, 32, 114, 114, "int8"], [32, 1, 3, 3, "int8"], [1, 1], [0, 0], [1, 1], "int32"], {"i": 6066424, "t": "direct", "c": null, "e": [["tile_f", "sp", [-1, 1, 1, 1]], ["tile_y", "sp", [-1, 2, 1, 8]], ["tile_x", "sp", [-1, 2, 28, 2]], ["auto_unroll_max_step", "ot", 1500], ["unroll_explicit", "ot", 1]]}], "r": [[5.336636692120541e-06], 0, 2.3666770458221436, 1581504006.4571111], "v": 0.1}
{"i": ["cuda", "topi_nn_conv2d", [["TENSOR", [1, 3, 226, 226], "int8"], ["TENSOR", [32, 3, 3, 3], "int8"], [2, 2], [0, 0], [1, 1], "NCHW", "int32"], {}, ["conv2d", [1, 3, 226, 226, "int8"], [32, 3, 3, 3, "int8"], [2, 2], [0, 0], [1, 1], "NCHW", "int32"], {"i": 24442812, "t": "direct", "c": null, "e": [["tile_f", "sp", [-1, 2, 4, 4]], ["tile_y", "sp", [-1, 1, 2, 7]], ["tile_x", "sp", [-1, 1, 16, 1]], ["tile_rc", "sp", [-1, 1]], ["tile_ry", "sp", [-1, 3]], ["tile_rx", "sp", [-1, 3]], ["auto_unroll_max_step", "ot", 1500], ["unroll_explicit", "ot", 0]]}], "r": [[8.160916716851465e-06], 0, 1.8963019847869873, 1581516244.6928976], "v": 0.1}
{"i": ["llvm -mcpu=cascadelake", "topi_x86_conv2d_NCHWc_int8", [["TENSOR", [1, 4, 226, 226], "uint8"], ["TENSOR", [32, 4, 3, 3], "int8"], [2, 2], [0, 0], [1, 1], "NCHW", "int32"], {}, ["conv2d", [1, 4, 226, 226, "uint8"], [32, 4, 3, 3, "int8"], [2, 2], [0, 0], [1, 1], "NCHW", "int32"], {"i": 2, "t": "direct", "c": null, "e": [["tile_ic", "sp", [-1, 4]], ["tile_oc", "sp", [-1, 16]], ["tile_ow", "sp", [-1, 2]], ["unroll_kw", "ot", true]]}], "r": [[7.962606069951525e-06], 0, 1.781761646270752, 1579871080.4960015], "v": 0.1}
{"i": ["llvm -mcpu=cascadelake", "topi_x86_depthwise_conv2d_NCHWc_from_nchw", [["TENSOR", [1, 32, 114, 114], "uint8"], ["TENSOR", [32, 1, 3, 3], "int8"], [1, 1], [0, 0], [1, 1], "int32"], {}, ["depthwise_conv2d_nchw", [1, 32, 114, 114, "uint8"], [32, 1, 3, 3, "int8"], [1, 1], [0, 0], [1, 1], "int32"], {"i": 0, "t": "direct", "c": null, "e": [["tile_ic", "sp", [-1, 1]], ["tile_oc", "sp", [-1, 1]], ["tile_ow", "sp", [-1, 1]]]}], "r": [[1.9128244931313218e-05], 0, 2.3096694946289062, 1579871512.6226964], "v": 0.1}
{"i": ["llvm -mcpu=cascadelake", "topi_x86_conv2d_NCHWc_int8", [["TENSOR", [1, 32, 112, 112], "uint8"], ["TENSOR", [64, 32, 1, 1], "int8"], [1, 1], [0, 0], [1, 1], "NCHW", "int32"], {}, ["conv2d", [1, 32, 112, 112, "uint8"], [64, 32, 1, 1, "int8"], [1, 1], [0, 0], [1, 1], "NCHW", "int32"], {"i": 123, "t": "direct", "c": null, "e": [["tile_ic", "sp", [-1, 32]], ["tile_oc", "sp", [-1, 16]], ["tile_ow", "sp", [-1, 2]], ["tile_oh", "ot", 2]]}], "r": [[1.2927899858088463e-05], 0, 2.3358664512634277, 1579871990.219702], "v": 0.1}
{"i": ["llvm -mcpu=cascadelake", "topi_x86_depthwise_conv2d_NCHWc_from_nchw", [["TENSOR", [1, 64, 114, 114], "uint8"], ["TENSOR", [64, 1, 3, 3], "int8"], [2, 2], [0, 0], [1, 1], "int32"], {}, ["depthwise_conv2d_nchw", [1, 64, 114, 114, "uint8"], [64, 1, 3, 3, "int8"], [2, 2], [0, 0], [1, 1], "int32"], {"i": 41, "t": "direct", "c": null, "e": [["tile_ic", "sp", [-1, 64]], ["tile_oc", "sp", [-1, 32]], ["tile_ow", "sp", [-1, 1]]]}], "r": [[8.615886701057876e-06], 0, 3.36474871635437, 1579873150.1692147], "v": 0.1}
{"i": ["llvm -mcpu=cascadelake", "topi_x86_conv2d_NCHWc_int8", [["TENSOR", [1, 64, 56, 56], "uint8"], ["TENSOR", [128, 64, 1, 1], "int8"], [1, 1], [0, 0], [1, 1], "NCHW", "int32"], {}, ["conv2d", [1, 64, 56, 56, "uint8"], [128, 64, 1, 1, "int8"], [1, 1], [0, 0], [1, 1], "NCHW", "int32"], {"i": 222, "t": "direct", "c": null, "e": [["tile_ic", "sp", [-1, 16]], ["tile_oc", "sp", [-1, 16]], ["tile_ow", "sp", [-1, 7]], ["tile_oh", "ot", 2]]}], "r": [[1.2180852391896328e-05], 0, 2.499626636505127, 1579874072.9849017], "v": 0.1}
{"i": ["llvm -mcpu=cascadelake", "topi_x86_depthwise_conv2d_NCHWc_from_nchw", [["TENSOR", [1, 128, 58, 58], "uint8"], ["TENSOR", [128, 1, 3, 3], "int8"], [1, 1], [0, 0], [1, 1], "int32"], {}, ["depthwise_conv2d_nchw", [1, 128, 58, 58, "uint8"], [128, 1, 3, 3, "int8"], [1, 1], [0, 0], [1, 1], "int32"], {"i": 310, "t": "direct", "c": null, "e": [["tile_ic", "sp", [-1, 64]], ["tile_oc", "sp", [-1, 64]], ["tile_ow", "sp", [-1, 8]]]}], "r": [[1.530751860596341e-05], 0, 2.004991054534912, 1579874987.9946003], "v": 0.1}
{"i": ["llvm -mcpu=cascadelake", "topi_x86_conv2d_NCHWc_int8", [["TENSOR", [1, 128, 56, 56], "uint8"], ["TENSOR", [128, 128, 1, 1], "int8"], [1, 1], [0, 0], [1, 1], "NCHW", "int32"], {}, ["conv2d", [1, 128, 56, 56, "uint8"], [128, 128, 1, 1, "int8"], [1, 1], [0, 0], [1, 1], "NCHW", "int32"], {"i": 101, "t": "direct", "c": null, "e": [["tile_ic", "sp", [-1, 128]], ["tile_oc", "sp", [-1, 16]], ["tile_ow", "sp", [-1, 8]], ["tile_oh", "ot", 1]]}], "r": [[1.9448845254317857e-05], 0, 3.358659029006958, 1579876232.0400703], "v": 0.1}
{"i": ["llvm -mcpu=cascadelake", "topi_x86_depthwise_conv2d_NCHWc_from_nchw", [["TENSOR", [1, 128, 58, 58], "uint8"], ["TENSOR", [128, 1, 3, 3], "int8"], [2, 2], [0, 0], [1, 1], "int32"], {}, ["depthwise_conv2d_nchw", [1, 128, 58, 58, "uint8"], [128, 1, 3, 3, "int8"], [2, 2], [0, 0], [1, 1], "int32"], {"i": 39, "t": "direct", "c": null, "e": [["tile_ic", "sp", [-1, 128]], ["tile_oc", "sp", [-1, 16]], ["tile_ow", "sp", [-1, 1]]]}], "r": [[5.984570497235111e-06], 0, 3.4110169410705566, 1579877526.577897], "v": 0.1}
{"i": ["llvm -mcpu=cascadelake", "topi_x86_conv2d_NCHWc_int8", [["TENSOR", [1, 128, 28, 28], "uint8"], ["TENSOR", [256, 128, 1, 1], "int8"], [1, 1], [0, 0], [1, 1], "NCHW", "int32"], {}, ["conv2d", [1, 128, 28, 28, "uint8"], [256, 128, 1, 1, "int8"], [1, 1], [0, 0], [1, 1], "NCHW", "int32"], {"i": 77, "t": "direct", "c": null, "e": [["tile_ic", "sp", [-1, 128]], ["tile_oc", "sp", [-1, 64]], ["tile_ow", "sp", [-1, 4]], ["tile_oh", "ot", 1]]}], "r": [[1.094010380744535e-05], 0, 2.2492668628692627, 1579878027.5010555], "v": 0.1}
{"i": ["llvm -mcpu=cascadelake", "topi_x86_depthwise_conv2d_NCHWc_from_nchw", [["TENSOR", [1, 256, 30, 30], "uint8"], ["TENSOR", [256, 1, 3, 3], "int8"], [1, 1], [0, 0], [1, 1], "int32"], {}, ["depthwise_conv2d_nchw", [1, 256, 30, 30, "uint8"], [256, 1, 3, 3, "int8"], [1, 1], [0, 0], [1, 1], "int32"], {"i": 143, "t": "direct", "c": null, "e": [["tile_ic", "sp", [-1, 256]], ["tile_oc", "sp", [-1, 64]], ["tile_ow", "sp", [-1, 2]]]}], "r": [[7.158650975905297e-06], 0, 3.3473522663116455, 1579879563.501315], "v": 0.1}
{"i": ["llvm -mcpu=cascadelake", "topi_x86_conv2d_NCHWc_int8", [["TENSOR", [1, 256, 28, 28], "uint8"], ["TENSOR", [256, 256, 1, 1], "int8"], [1, 1], [0, 0], [1, 1], "NCHW", "int32"], {}, ["conv2d", [1, 256, 28, 28, "uint8"], [256, 256, 1, 1, "int8"], [1, 1], [0, 0], [1, 1], "NCHW", "int32"], {"i": 152, "t": "direct", "c": null, "e": [["tile_ic", "sp", [-1, 128]], ["tile_oc", "sp", [-1, 32]], ["tile_ow", "sp", [-1, 14]], ["tile_oh", "ot", 1]]}], "r": [[1.783997584035024e-05], 0, 2.50730562210083, 1579879833.0586257], "v": 0.1}
{"i": ["llvm -mcpu=cascadelake", "topi_x86_depthwise_conv2d_NCHWc_from_nchw", [["TENSOR", [1, 256, 30, 30], "uint8"], ["TENSOR", [256, 1, 3, 3], "int8"], [2, 2], [0, 0], [1, 1], "int32"], {}, ["depthwise_conv2d_nchw", [1, 256, 30, 30, "uint8"], [256, 1, 3, 3, "int8"], [2, 2], [0, 0], [1, 1], "int32"], {"i": 141, "t": "direct", "c": null, "e": [["tile_ic", "sp", [-1, 64]], ["tile_oc", "sp", [-1, 64]], ["tile_ow", "sp", [-1, 2]]]}], "r": [[4.088296632816675e-06], 0, 3.2655282020568848, 1579880874.4420004], "v": 0.1}
{"i": ["llvm -mcpu=cascadelake", "topi_x86_conv2d_NCHWc_int8", [["TENSOR", [1, 256, 14, 14], "uint8"], ["TENSOR", [512, 256, 1, 1], "int8"], [1, 1], [0, 0], [1, 1], "NCHW", "int32"], {}, ["conv2d", [1, 256, 14, 14, "uint8"], [512, 256, 1, 1, "int8"], [1, 1], [0, 0], [1, 1], "NCHW", "int32"], {"i": 85, "t": "direct", "c": null, "e": [["tile_ic", "sp", [-1, 8]], ["tile_oc", "sp", [-1, 16]], ["tile_ow", "sp", [-1, 7]], ["tile_oh", "ot", 1]]}], "r": [[1.0437972976284916e-05], 0, 3.423185110092163, 1579881728.0548081], "v": 0.1}
{"i": ["llvm -mcpu=cascadelake", "topi_x86_depthwise_conv2d_NCHWc_from_nchw", [["TENSOR", [1, 512, 16, 16], "uint8"], ["TENSOR", [512, 1, 3, 3], "int8"], [1, 1], [0, 0], [1, 1], "int32"], {}, ["depthwise_conv2d_nchw", [1, 512, 16, 16, "uint8"], [512, 1, 3, 3, "int8"], [1, 1], [0, 0], [1, 1], "int32"], {"i": 66, "t": "direct", "c": null, "e": [["tile_ic", "sp", [-1, 64]], ["tile_oc", "sp", [-1, 64]], ["tile_ow", "sp", [-1, 1]]]}], "r": [[5.616141671811076e-06], 0, 3.299238681793213, 1579883097.2542224], "v": 0.1}
{"i": ["llvm -mcpu=cascadelake", "topi_x86_conv2d_NCHWc_int8", [["TENSOR", [1, 512, 14, 14], "uint8"], ["TENSOR", [512, 512, 1, 1], "int8"], [1, 1], [0, 0], [1, 1], "NCHW", "int32"], {}, ["conv2d", [1, 512, 14, 14, "uint8"], [512, 512, 1, 1, "int8"], [1, 1], [0, 0], [1, 1], "NCHW", "int32"], {"i": 149, "t": "direct", "c": null, "e": [["tile_ic", "sp", [-1, 128]], ["tile_oc", "sp", [-1, 16]], ["tile_ow", "sp", [-1, 14]], ["tile_oh", "ot", 1]]}], "r": [[1.727265374797538e-05], 0, 2.482102394104004, 1579884194.228794], "v": 0.1}
{"i": ["llvm -mcpu=cascadelake", "topi_x86_depthwise_conv2d_NCHWc_from_nchw", [["TENSOR", [1, 512, 16, 16], "uint8"], ["TENSOR", [512, 1, 3, 3], "int8"], [2, 2], [0, 0], [1, 1], "int32"], {}, ["depthwise_conv2d_nchw", [1, 512, 16, 16, "uint8"], [512, 1, 3, 3, "int8"], [2, 2], [0, 0], [1, 1], "int32"], {"i": 33, "t": "direct", "c": null, "e": [["tile_ic", "sp", [-1, 8]], ["tile_oc", "sp", [-1, 8]], ["tile_ow", "sp", [-1, 1]]]}], "r": [[3.5604621415053295e-06], 0, 3.2879509925842285, 1579884496.83294], "v": 0.1}
{"i": ["llvm -mcpu=cascadelake", "topi_x86_conv2d_NCHWc_int8", [["TENSOR", [1, 512, 7, 7], "uint8"], ["TENSOR", [1024, 512, 1, 1], "int8"], [1, 1], [0, 0], [1, 1], "NCHW", "int32"], {}, ["conv2d", [1, 512, 7, 7, "uint8"], [1024, 512, 1, 1, "int8"], [1, 1], [0, 0], [1, 1], "NCHW", "int32"], {"i": 71, "t": "direct", "c": null, "e": [["tile_ic", "sp", [-1, 512]], ["tile_oc", "sp", [-1, 32]], ["tile_ow", "sp", [-1, 7]], ["tile_oh", "ot", 1]]}], "r": [[1.0181970557190703e-05], 0, 1.7906954288482666, 1579885170.8863957], "v": 0.1}
{"i": ["llvm -mcpu=cascadelake", "topi_x86_depthwise_conv2d_NCHWc_from_nchw", [["TENSOR", [1, 1024, 9, 9], "uint8"], ["TENSOR", [1024, 1, 3, 3], "int8"], [1, 1], [0, 0], [1, 1], "int32"], {}, ["depthwise_conv2d_nchw", [1, 1024, 9, 9, "uint8"], [1024, 1, 3, 3, "int8"], [1, 1], [0, 0], [1, 1], "int32"], {"i": 65, "t": "direct", "c": null, "e": [["tile_ic", "sp", [-1, 1024]], ["tile_oc", "sp", [-1, 32]], ["tile_ow", "sp", [-1, 1]]]}], "r": [[4.1382147881800245e-06], 0, 1.66660737991333, 1579885630.0488942], "v": 0.1}
{"i": ["llvm -mcpu=cascadelake", "topi_x86_conv2d_NCHWc_int8", [["TENSOR", [1, 1024, 7, 7], "uint8"], ["TENSOR", [1024, 1024, 1, 1], "int8"], [1, 1], [0, 0], [1, 1], "NCHW", "int32"], {}, ["conv2d", [1, 1024, 7, 7, "uint8"], [1024, 1024, 1, 1, "int8"], [1, 1], [0, 0], [1, 1], "NCHW", "int32"], {"i": 78, "t": "direct", "c": null, "e": [["tile_ic", "sp", [-1, 256]], ["tile_oc", "sp", [-1, 32]], ["tile_ow", "sp", [-1, 7]], ["tile_oh", "ot", 1]]}], "r": [[1.6879464363837742e-05], 0, 2.2338414192199707, 1579886255.8287377], "v": 0.1}
