scripts_paper/backup_tuned_logs_g4/resnet18_v1-quantized-5batches-naive-symbol.log
{"i": ["cuda", "topi_nn_conv2d", [["TENSOR", [1, 256, 14, 14], "int8"], ["TENSOR", [512, 256, 1, 1], "int8"], [2, 2], [0, 0], [1, 1], "NCHW", "int32"], {}, ["conv2d", [1, 256, 14, 14, "int8"], [512, 256, 1, 1, "int8"], [2, 2], [0, 0], [1, 1], "NCHW", "int32"], {"i": 1278016, "t": "int8", "c": null, "e": [["tile_n", "sp", [-1, 1, 1, 1]], ["tile_f", "sp", [-1, 2, 4, 1]], ["tile_y", "sp", [-1, 1, 7, 1]], ["tile_x", "sp", [-1, 1, 7, 1]], ["fuse_yx", "ot", 1], ["tile_rc", "sp", [-1, 8]], ["tile_ry", "sp", [-1, 1]], ["tile_rx", "sp", [-1, 1]], ["reorder_inner", "re", [2, 1, 0]], ["AA_double_buffer", "ot", 1], ["WW_double_buffer", "ot", 1], ["auto_unroll_max_step", "ot", 512]]}], "r": [[6.654087476898706e-06], 0, 1.7521445751190186, 1581358131.7539454], "v": 0.1}
{"i": ["cuda", "topi_nn_conv2d", [["TENSOR", [1, 512, 9, 9], "int8"], ["TENSOR", [512, 512, 3, 3], "int8"], [1, 1], [0, 0], [1, 1], "NCHW", "int32"], {}, ["conv2d", [1, 512, 9, 9, "int8"], [512, 512, 3, 3, "int8"], [1, 1], [0, 0], [1, 1], "NCHW", "int32"], {"i": 8335929, "t": "int8", "c": null, "e": [["tile_n", "sp", [-1, 1, 1, 1]], ["tile_f", "sp", [-1, 2, 2, 1]], ["tile_y", "sp", [-1, 1, 7, 1]], ["tile_x", "sp", [-1, 1, 7, 1]], ["fuse_yx", "ot", 1], ["tile_rc", "sp", [-1, 4]], ["tile_ry", "sp", [-1, 3]], ["tile_rx", "sp", [-1, 3]], ["reorder_inner", "re", [0, 2, 1]], ["AA_double_buffer", "ot", 1], ["WW_double_buffer", "ot", 1], ["auto_unroll_max_step", "ot", 1500]]}], "r": [[4.496553627284719e-05], 0, 2.128101348876953, 1581361010.8465014], "v": 0.1}
{"i": ["cuda", "topi_nn_conv2d", [["TENSOR", [1, 256, 16, 16], "int8"], ["TENSOR", [512, 256, 3, 3], "int8"], [2, 2], [0, 0], [1, 1], "NCHW", "int32"], {}, ["conv2d", [1, 256, 16, 16, "int8"], [512, 256, 3, 3, "int8"], [2, 2], [0, 0], [1, 1], "NCHW", "int32"], {"i": 7183984, "t": "int8", "c": null, "e": [["tile_n", "sp", [-1, 1, 1, 1]], ["tile_f", "sp", [-1, 1, 1, 4]], ["tile_y", "sp", [-1, 1, 7, 1]], ["tile_x", "sp", [-1, 1, 7, 1]], ["fuse_yx", "ot", 1], ["tile_rc", "sp", [-1, 2]], ["tile_ry", "sp", [-1, 3]], ["tile_rx", "sp", [-1, 3]], ["reorder_inner", "re", [0, 1, 2]], ["AA_double_buffer", "ot", 1], ["WW_double_buffer", "ot", 1], ["auto_unroll_max_step", "ot", 1500]]}], "r": [[2.6072326227887047e-05], 0, 2.357633113861084, 1581365538.5170994], "v": 0.1}
{"i": ["cuda", "topi_nn_conv2d", [["TENSOR", [1, 128, 28, 28], "int8"], ["TENSOR", [256, 128, 1, 1], "int8"], [2, 2], [0, 0], [1, 1], "NCHW", "int32"], {}, ["conv2d", [1, 128, 28, 28, "int8"], [256, 128, 1, 1, "int8"], [2, 2], [0, 0], [1, 1], "NCHW", "int32"], {"i": 2677266, "t": "int8", "c": null, "e": [["tile_n", "sp", [-1, 1, 1, 1]], ["tile_f", "sp", [-1, 1, 8, 1]], ["tile_y", "sp", [-1, 1, 1, 1]], ["tile_x", "sp", [-1, 1, 14, 1]], ["fuse_yx", "ot", 0], ["tile_rc", "sp", [-1, 4]], ["tile_ry", "sp", [-1, 1]], ["tile_rx", "sp", [-1, 1]], ["reorder_inner", "re", [2, 0, 1]], ["AA_double_buffer", "ot", 1], ["WW_double_buffer", "ot", 0], ["auto_unroll_max_step", "ot", 0]]}], "r": [[4.552277337785288e-06], 0, 1.809361457824707, 1581369947.7537565], "v": 0.1}
{"i": ["cuda", "topi_nn_conv2d", [["TENSOR", [1, 256, 16, 16], "int8"], ["TENSOR", [256, 256, 3, 3], "int8"], [1, 1], [0, 0], [1, 1], "NCHW", "int32"], {}, ["conv2d", [1, 256, 16, 16, "int8"], [256, 256, 3, 3, "int8"], [1, 1], [0, 0], [1, 1], "NCHW", "int32"], {"i": 80504768, "t": "int8", "c": null, "e": [["tile_n", "sp", [-1, 1, 1, 1]], ["tile_f", "sp", [-1, 2, 2, 1]], ["tile_y", "sp", [-1, 1, 7, 1]], ["tile_x", "sp", [-1, 1, 7, 2]], ["fuse_yx", "ot", 1], ["tile_rc", "sp", [-1, 4]], ["tile_ry", "sp", [-1, 3]], ["tile_rx", "sp", [-1, 3]], ["reorder_inner", "re", [0, 1, 2]], ["AA_double_buffer", "ot", 1], ["WW_double_buffer", "ot", 1], ["auto_unroll_max_step", "ot", 1500]]}], "r": [[2.6299603305785124e-05], 0, 2.5243687629699707, 1581377255.8956015], "v": 0.1}
{"i": ["cuda", "topi_nn_conv2d", [["TENSOR", [1, 128, 30, 30], "int8"], ["TENSOR", [256, 128, 3, 3], "int8"], [2, 2], [0, 0], [1, 1], "NCHW", "int32"], {}, ["conv2d", [1, 128, 30, 30, "int8"], [256, 128, 3, 3, "int8"], [2, 2], [0, 0], [1, 1], "NCHW", "int32"], {"i": 25644294, "t": "int8", "c": null, "e": [["tile_n", "sp", [-1, 1, 1, 1]], ["tile_f", "sp", [-1, 1, 8, 1]], ["tile_y", "sp", [-1, 1, 1, 2]], ["tile_x", "sp", [-1, 1, 14, 1]], ["fuse_yx", "ot", 0], ["tile_rc", "sp", [-1, 4]], ["tile_ry", "sp", [-1, 3]], ["tile_rx", "sp", [-1, 3]], ["reorder_inner", "re", [0, 1, 2]], ["AA_double_buffer", "ot", 0], ["WW_double_buffer", "ot", 0], ["auto_unroll_max_step", "ot", 512]]}], "r": [[1.4740033367425211e-05], 0, 1.9530344009399414, 1581383638.7214715], "v": 0.1}
{"i": ["cuda", "topi_nn_conv2d", [["TENSOR", [1, 64, 56, 56], "int8"], ["TENSOR", [128, 64, 1, 1], "int8"], [2, 2], [0, 0], [1, 1], "NCHW", "int32"], {}, ["conv2d", [1, 64, 56, 56, "int8"], [128, 64, 1, 1, "int8"], [2, 2], [0, 0], [1, 1], "NCHW", "int32"], {"i": 5772493, "t": "int8", "c": null, "e": [["tile_n", "sp", [-1, 1, 1, 1]], ["tile_f", "sp", [-1, 4, 4, 1]], ["tile_y", "sp", [-1, 1, 1, 1]], ["tile_x", "sp", [-1, 1, 28, 1]], ["fuse_yx", "ot", 0], ["tile_rc", "sp", [-1, 4]], ["tile_ry", "sp", [-1, 1]], ["tile_rx", "sp", [-1, 1]], ["reorder_inner", "re", [0, 1, 2]], ["AA_double_buffer", "ot", 1], ["WW_double_buffer", "ot", 0], ["auto_unroll_max_step", "ot", 0]]}], "r": [[4.241892822652296e-06], 0, 1.8325011730194092, 1581391065.9469078], "v": 0.1}
{"i": ["cuda", "topi_nn_conv2d", [["TENSOR", [1, 128, 30, 30], "int8"], ["TENSOR", [128, 128, 3, 3], "int8"], [1, 1], [0, 0], [1, 1], "NCHW", "int32"], {}, ["conv2d", [1, 128, 30, 30, "int8"], [128, 128, 3, 3, "int8"], [1, 1], [0, 0], [1, 1], "NCHW", "int32"], {"i": 304679771, "t": "int8", "c": null, "e": [["tile_n", "sp", [-1, 1, 1, 1]], ["tile_f", "sp", [-1, 1, 4, 1]], ["tile_y", "sp", [-1, 1, 1, 7]], ["tile_x", "sp", [-1, 1, 28, 1]], ["fuse_yx", "ot", 0], ["tile_rc", "sp", [-1, 4]], ["tile_ry", "sp", [-1, 3]], ["tile_rx", "sp", [-1, 3]], ["reorder_inner", "re", [2, 0, 1]], ["AA_double_buffer", "ot", 1], ["WW_double_buffer", "ot", 1], ["auto_unroll_max_step", "ot", 1500]]}], "r": [[1.7585076022066048e-05], 0, 3.5987772941589355, 1581396419.5215287], "v": 0.1}
{"i": ["cuda", "topi_nn_conv2d", [["TENSOR", [1, 64, 58, 58], "int8"], ["TENSOR", [128, 64, 3, 3], "int8"], [2, 2], [0, 0], [1, 1], "NCHW", "int32"], {}, ["conv2d", [1, 64, 58, 58, "int8"], [128, 64, 3, 3, "int8"], [2, 2], [0, 0], [1, 1], "NCHW", "int32"], {"i": 110422327, "t": "int8", "c": null, "e": [["tile_n", "sp", [-1, 1, 1, 1]], ["tile_f", "sp", [-1, 1, 8, 1]], ["tile_y", "sp", [-1, 1, 1, 4]], ["tile_x", "sp", [-1, 1, 14, 1]], ["fuse_yx", "ot", 0], ["tile_rc", "sp", [-1, 2]], ["tile_ry", "sp", [-1, 3]], ["tile_rx", "sp", [-1, 3]], ["reorder_inner", "re", [0, 1, 2]], ["AA_double_buffer", "ot", 1], ["WW_double_buffer", "ot", 0], ["auto_unroll_max_step", "ot", 512]]}], "r": [[1.2832124923555902e-05], 0, 2.2450077533721924, 1581408263.4727523], "v": 0.1}
{"i": ["cuda", "topi_nn_conv2d", [["TENSOR", [1, 64, 58, 58], "int8"], ["TENSOR", [64, 64, 3, 3], "int8"], [1, 1], [0, 0], [1, 1], "NCHW", "int32"], {}, ["conv2d", [1, 64, 58, 58, "int8"], [64, 64, 3, 3, "int8"], [1, 1], [0, 0], [1, 1], "NCHW", "int32"], {"i": 554259200, "t": "int8", "c": null, "e": [["tile_n", "sp", [-1, 1, 1, 1]], ["tile_f", "sp", [-1, 1, 2, 1]], ["tile_y", "sp", [-1, 1, 1, 7]], ["tile_x", "sp", [-1, 1, 56, 1]], ["fuse_yx", "ot", 0], ["tile_rc", "sp", [-1, 4]], ["tile_ry", "sp", [-1, 3]], ["tile_rx", "sp", [-1, 3]], ["reorder_inner", "re", [0, 2, 1]], ["AA_double_buffer", "ot", 0], ["WW_double_buffer", "ot", 1], ["auto_unroll_max_step", "ot", 1500]]}], "r": [[1.660403638186636e-05], 0, 3.686436653137207, 1581417839.1716332], "v": 0.1}
{"i": ["cuda", "topi_nn_conv2d", [["TENSOR", [1, 3, 230, 230], "int8"], ["TENSOR", [64, 3, 7, 7], "int8"], [2, 2], [0, 0], [1, 1], "NCHW", "int32"], {}, ["conv2d", [1, 3, 230, 230, "int8"], [64, 3, 7, 7, "int8"], [2, 2], [0, 0], [1, 1], "NCHW", "int32"], {"i": 69584402, "t": "direct", "c": null, "e": [["tile_f", "sp", [-1, 2, 8, 4]], ["tile_y", "sp", [-1, 14, 1, 1]], ["tile_x", "sp", [-1, 1, 16, 1]], ["tile_rc", "sp", [-1, 1]], ["tile_ry", "sp", [-1, 7]], ["tile_rx", "sp", [-1, 1]], ["auto_unroll_max_step", "ot", 1500], ["unroll_explicit", "ot", 1]]}], "r": [[4.373164995322731e-05], 0, 3.0642900466918945, 1581423922.0807345], "v": 0.1}
